ord,ife,PARTIDO_CI,CANDIDATURA_PROPIETARIA,CANDIDATURA_SUPLENTE,ife,inegi,win
3,8001,PVEM,FABIAN FOURZAN TRUJILLO,JOSE RICARDO TORRES ESCOBEDO,8001,8001,pvem
12,8002,PM-PT-NACH,MIGUEL RUBIO CASTILLO,MANUEL GUEVARA NIÑO,8002,8002,pt-morena-pna
13,8003,PRI,JESUS HORACIO SOTO ARMENDARIZ,RAFAEL PAYAN MORALES,8003,8003,pri
20,8004,PRI,TERESA ERIVES BACA,MARIA TERESA ORONA GARCIA,8004,8004,pri
30,8005,PRD,IVONNE DE LA HOYA VENZOR,ANA CRISTINA GONZALEZ ONTIVEROS,8005,8005,prd
33,8006,PAN,VIVIANA ALTAMIRANO CARDENAS,LAURA KAREN CASAVANTES JAVALERA,8006,8006,pan
40,8007,PRI,JESUS AUGUSTO MEDINA AGUIRRE,GERALDO LOZANO OCHOA,8007,8007,pri
43,8008,PRI,EDUARDO AARON RUELAS FERNANDEZ,RAFAEL RUELAS GASTELUM,8008,8008,pri
47,8009,PAN,MACARIO BALDIVAR HERMOSILLO POMPA,EYDY LEOPOLDO RODRIGUEZ CHAPARRO,8009,8009,pan
54,8010,PRI,ROGELIO PACHECO FLORES,MANUEL BUSTAMANTE RAMOS,8010,8010,pri
59,8011,PAN,JORGE ALEJANDRO ALDANA AGUILAR,GABRIELA TERRAZAS ALVAREZ,8011,8011,pan
66,8012,PRI,IVAN ALEJANDRO GUTIERREZ VILLARREAL,NORIS BUSTILLOS CHAVEZ,8012,8012,pri
69,8013,PRI,ROBERTO LUCERO GALAZ,MAURO CORONA QUEZADA,8013,8013,pri
74,8014,PAN,LEO LOPEZ MUÑOZ,JESUS NORBERTO BAYLON DEL VAL,8014,8014,pan
79,8015,PRI,ILSE GISSEL TORRES CORONADO,MAYRA ROMERO NAVARRETE,8015,8015,pri
87,8016,NACH,SERGIO LUIS OLVERA GALLEGOS,JESUS ABRAHAM DELGADO LARA,8016,8016,pna
88,8017,PAN,ELÌAS HUMBERTO PÈREZ MENDOZA,MIGUEL ÀNGEL HOLGUÌN GARCÌA,8017,8017,pan
95,8018,PAN,CAYETANO ORDOÑEZ RODRIGUEZ,VELINDA MACIAS GUTIERREZ,8018,8018,pan
104,8019,PAN-PRD,MARCO ANTONIO BONILLA MENDOZA,JORGE CRISTOBAL CRUZ RUSSEK,8019,8019,pan-prd
106,8020,PRI,SALOME RAMOS SALMON,LUIS EMERALDO ROMERO SOTELO,8020,8020,pri
115,8021,PAN-PRD,JESUS ALBERTO VALENCIANO GARCIA,JORGE LUIS ISSA CALDERON,8021,8021,pan-prd
121,8022,MC,FELIZARDO GALLEGOS LOYA,,8022,8022,mc
123,8023,PAN,AMMON DAYER LEBARON TRACY,TERRY FRANCIS LEANY LE BARON,8023,8023,pan
129,8024,PRI,FERNANDO  JACQUEZ,JOSE GILBERTO FIGUEROA SANTILLANES,8024,8024,pri
134,8025,PRI,MARIA DE LOS ANGELES MORENO RASCON,LORENA OROZCO OROZ,8025,8025,pri
142,8026,PVEM,GILBERTO GUTIERREZ MONTES,CARLOS NUÑEZ PORTILLO,8026,8026,pvem
145,8027,PRI,JOSE MIGUEL YAÑEZ RONQUILLO,ALEJANDRO HERNANDEZ CRUZ,8027,8027,pri
155,8028,PVEM,FAUSTO GONZALEZ PEREZ,MIGUEL ANGEL AMAYA ALVILLAR,8028,8028,pvem
160,8029,PRI,JULIO CESAR CHAVEZ PONCE,REFUGIO LOPEZ VALENZUELA,8029,8029,pri
163,8030,PAN,JOEL GUILLERMO BUSTILLOS RAMIREZ,ARTURO ORTEGA SALMERON,8030,8030,pan
171,8031,PM-PT-NACH,CARLOS COMADURAN AMAYA,JAVIER ARMANDO ESTRADA ARAGON,8031,8031,pt-morena-pna
176,8032,MC,CESAR ALBERTO PEÑA VALLES,JORGE LLOYD RABLING PRIETO,8032,8032,mc
181,8033,PRI,FLORA RUIZ CORRAL,BEATRIZ AREVALO AROSTEGUI,8033,8033,pri
187,8034,MC,LAURO OROZCO GÓMEZ,JOSÉ BALDEMAR TORRES ,8034,8034,mc
190,8035,PAN,JOEL LOYA MÁRQUEZ,INOCENTE SARELLANO DIAZ,8035,8035,pan
203,8036,PM-PT-NACH,MARCOS CHAVEZ TORRES,ROBERTO BELTRAN DEL RIO BELTRAN DEL RIO,8036,8036,pt-morena-pna
213,8037,PM-PT-NACH,CRUZ PEREZ CUELLAR ,MARTIN CHAPARRO PAYAN,8037,8037,pt-morena-pna
215,8038,PRI,JOSE MONCAYO PORRAS,BERENICE MUÑIZ JIMENEZ,8038,8038,pri
221,8039,MC,HEBERTO CABALLERO ROMÁN,SEVERO REYES MORENO,8039,8039,mc
227,8040,PAN-PRD,MARCELINO PRIETO CARREON,OSVALDO RUBEN CHAVEZ RIVERA,8040,8040,pan-prd
230,8041,PRI,PEDRO IGNACIO QUEZADA ENRIQUEZ,MARCIANO QUEZADA MANJARREZ,8041,8041,pri
236,8042,PRD,FERNANDO GARCIA VILLANUEVA,JOSE MIGUEL MENDOZA ZUBIA,8042,8042,prd
241,8043,PRI,LORENA VAZQUEZ PEÑALOZA,LILIANA ANTILLON RUIZ,8043,8043,pri
248,8044,PAN,JESUS ENRIQUE PEÑA VAZQUEZ,ELIZABETH PEINADO LOPEZ,8044,8044,pan
257,8045,PAN-PRD,MIRIAM SOTO ORNELAS,NORELIA HERNANDEZ RUVALCABA,8045,8045,pan-prd
260,8046,PM,JOSE DE LORETO JAVALERA BOJORQUEZ,JUAN MANUEL MENDEZ BAEZ,8046,8046,morena
262,8047,PRI,PERLA GACELA LOPEZ PEREZ,REYNA EDILIA ALVELAIS CABRERA,8047,8047,pri
265,8048,PRI,OSCAR BARRAZA ROBLEDO,CARLOS UBALDO VILLEGAS CHÁVEZ,8048,8048,pri
273,8049,PM,ARTURO SALINAS VILLALOBOS,PAULO HERNANDEZ LOZANO,8049,8049,morena
281,8050,PM-PT-NACH,CYNTHIA MARINA CEBALLOS DELGADO,EDITH ESCARCEGA ESCONTRIAS,8050,8050,pt-morena-pna
288,8051,PM,JOSE LUIS LOZANO ESCANDON,JAVIER FRANCISCO DOMINGUEZ SALMON,8051,8051,morena
290,8052,PRI,ANDRES RAMOS DE ANDA,JESUS BAEZA NIETO,8052,8052,pri
298,8053,PM,SELESTINO ESTRADA VILLANUEVA,OSVALDO MALDONADO APODACA,8053,8053,morena
299,8054,PAN,SALVADOR CHACON RIVERA,BALDOMERO LOYA RIVERA,8054,8054,pan
309,8055,PAN-PRD,MARCIAL ROMUALDO MARQUEZ GUTIERREZ,FRANCISCO ALBERTO  MARTA,8055,8055,pan-prd
311,8056,PRI,ARON ALFONSO SAENZ EGUADE,OSCAR LOYA TERRAZAS,8056,8056,pri
315,8057,PRI,VICENTE ANSELMO NEVAREZ VILLALBA,VICTOR MANUEL MOLINA TAPIA,8057,8057,pri
318,8058,PRI,JAIME RAMIREZ CARRASCO,IGNACIO PARRA BAYLON,8058,8058,pri
323,8059,PT,ARTURO HUERTA LUEVANO,RAMON ADRIAN RODRIGUEZ DE SANTIAGO,8059,8059,pt
329,8060,PRI,JOSE ANTONIO BILBAO MARTINEZ,JOSE ARMANDO GUERECA CORRAL,8060,8060,pri
336,8061,PAN,NORMA MUÑOZ ANCHONDO,ADRIANA MIRANDA TARANGO,8061,8061,pan
340,8062,PAN,MANUELA AIDE LOPEZ DE ANDA,LILIANA RAMOS FERNANDEZ,8062,8062,pan
349,8063,PRD,RAMON HUMBERTO VARELA GODINA,NORMA ELIZA MORALES ERIVES,8063,8063,prd
352,8064,PAN,JAVIER RODRIGUEZ CHAVEZ,ANTONIO RODRIGUEZ RODRIGUEZ,8064,8064,pan
358,8065,MC,DANIEL AARON SILVA FIGUEROA,FELIX DOMINGUEZ OLIVAS,8065,8065,mc
361,8066,PRI,MARCELO RASCON FELIX,CARLOS VAZQUEZ HERNANDEZ,8066,8066,pri
364,8067,PRI,MISAEL HOMERO MARQUEZ MORALES,SABINO HOMERO SOLTERO FAUDOA,8067,8067,pri
1,8001,PAN,OLIVIA CRUZ PIZARRO,ELVIRA HERNANDEZ NEVAREZ,,,
2,8001,PRI,MARIA REYES RANGEL NUÑEZ,ANA ROSA SILVA QUEZADA,,,
4,8001,MC,ALEJANDRA LOPEZ MARRUFO,ARELY ARIZBETH LOPEZ CARDONA,,,
5,8001,PES,ADRIANA PALMIRA ZEPEDA CHAIDEZ,IDALIA AIDEE VEGA GONZALEZ,,,
6,8001,PM-PT-NACH,SARA EDITH BUENO ACOSTA,CINTHIA APHRIL GONZALEZ CASTRO,,,
7,8002,PRI,ANA SOCORRO MONTOYA FRANCO,BLANCA LILIANA ESTRADA RUBIO,,,
8,8002,PVEM,LLUVIA SORAM PALACIOS LOPEZ,JUANA PATRICIA GARDEA MIRANDA,,,
9,8002,MC,RAMIRO VAQUERA VICENCIO,GRACIELA VILLAGRAN CASTRO,,,
10,8002,PES,ALBERTO VAZQUEZ SOLIS,JOAQUIN HERNANDEZ GONZALEZ,,,
11,8002,PAN-PRD,GILDARDO HUGO BARAJAS MARTINEZ,EUSEBIO CHAVEZ LERMA,,,
14,8003,PVEM,LAURA EDUWIGES RAMOS VARGAS,MAGDALENA GARCIA GUTIERREZ,,,
15,8003,PT,MIGUEL ANGEL MORA TABARES,J. HILARIO QUIÑONEZ QUIÑONEZ,,,
16,8003,MC,RAMON AGUSTIN VILLEGAS PORTILLO,MANUEL ENRIQUE RUBIO CHAVEZ,,,
17,8003,PM,BRISSA KARINA LAZOS GAMBOA,PATRICIA LEYVA ARMENDARIZ,,,
18,8003,PES,LAURENCIA ARACELI CASTAÑEDA DOMINGUEZ,ELIZABETH CONTRERAS MARTINEZ,,,
19,8003,PAN-PRD,BLANCA JENNYRA FIGUEROA CHAVEZ,ANA CRISTINA MARTINEZ BETANCE,,,
21,8004,PVEM,RICARDO SAENZ ALMANZA,HUMBERTO SANTOYO GUTIERREZ,,,
22,8004,MC,ANA KAREN ARALY DE LA CRUZ CABELLO,RUTH LORENA GALLEGOS TORRES,,,
23,8004,PES,TERESITA DE JESUS MEDINA CHAVEZ,NIEVES GOMEZ GARCIA,,,
24,8004,RSP,JAIME ESTRADA TERCERO,JESUS ANTONIO NEVAREZ DURAN,,,
25,8004,FxM,EMILIO AGUIRRE BUSTAMANTE,JESUS ALBERTO SOSA OCHOA,,,
26,8004,PAN-PRD,MONICA LIZBETH REYES BALDERRAMA,ALEJANDRA BERENICE REYES ORTEGA,,,
27,8004,PM-PT-NACH,MARIA DE JESUS LOPEZ GARCIA,GEORGINA PAOLA SANCHEZ CALZADA,,,
28,8005,PAN,LAURA BERNARDA ROMERO GARCIA,MAIRA TRINIDAD PEREYRA VARELA,,,
29,8005,PRI,ANA BELL GOMEZ FIERRO,ELMA GLORIA SAENZ ARAGON,,,
31,8005,MC,LORENZO ARREDONDO RANGEL,PATRICIA IBON CHAVIRA PAEZ,,,
32,8005,PM-PT-NACH,ELVA HERNANDEZ BALTIERREZ,MAYRA SANDOVAL ACOSTA,,,
34,8006,PRI,FABIOLA DOLORES VAZQUEZ GRANADOS,MONICA GABRIELA RIVERA ARMENTA,,,
35,8006,PRD,LORENA MUÑOZ VALLADARES,EDITH HERNANDEZ MUÑOZ,,,
36,8006,PVEM,MANUEL HIPOLITO GARCIA GUTIERREZ,NICOLAS VASQUEZ OCHOA,,,
37,8006,MC,EDGAR MANUEL NAJERA MUÑOZ,JULIA OCHOA TREVIZO,,,
38,8006,PM,GABRIEL HERNANDEZ MARQUEZ,JESUS BARAY ALDERETE,,,
39,8007,PAN,JULIA BOJORQUEZ BOJORQUEZ,CLAUDIA MARIA URIBE SOTELO,,,
41,8007,MC,MANUEL BUSTILLOS CRUZ,EVA BUSTILLOS COVOS,,,
42,8007,PM-PT-NACH,DANIEL SALINAS VILLALOBOS,GREGORIO ARO SEGURA,,,
44,8008,PM,EDUARDO ARAUJO GILL,JUAN ROBERTO MARTINEZ ORDOÑEZ,,,
45,8008,PES,CELIA NAVA LOPEZ,MARIA RAQUEL NUÑEZ CHAVEZ,,,
46,8008,PAN-PRD,JOSE ROBERTO HERNANDEZ FELIX,JUAN MANUEL OLIVAS GARCIA,,,
48,8009,PRI,ERNESTO ESTRADA GONZALEZ,JOSE DOLORES GONZALEZ PARRA,,,
49,8009,PVEM,NESTOR ENRIQUE RAMOS SANDOVAL,RAUL ARMANDO PARRA RODRIGUEZ,,,
50,8009,MC,PABLO VAZQUEZ DAVALOS,JOSAFAT RAMOS CAMPOS,,,
51,8009,PES,CANDELARIA OTILIA VELETA SALIDO,UMERLINDA DOMINGUEZ GALINDO,,,
52,8009,FxM,ESTEBAN PEREZ VALDENEGRO,ROGELIO WEISEL ARMENDARIZ,,,
53,8009,PM-PT-NACH,FRANCISCO JAVIER NUÑEZ NUÑEZ,HUGO BALTAZAR RASCON PEREZ,,,
55,8010,PVEM,LUIS ANTONIO RUIZ VEGA,JOSE ANGEL BETANCOURT GARCIA,,,
56,8010,MC,DALILA FLORES BASOCO,SANDY IRASEMA NEVAREZ ARREOLA,,,
57,8010,PAN-PRD,DORA MINEE ARREOLA DOZAL,MARIA JACQUELINE FLORES ENRIQUEZ,,,
58,8010,PM-PT-NACH,MA. AMPARO VILLALBA ORTIZ,JUANA ANAYA RUIZ,,,
60,8011,PRI,CLAUDIA LIZBETH HERNANDEZ VILLANUEVA,IMELDA VELO SAENZ,,,
61,8011,PRD,HEBER ANTONIA MEDINA CASTRO,MARA ALEJANDRA MUÑOZ ESCOBAR,,,
62,8011,PVEM,LORENA GARCIA NUÑEZ,RITA CECILIA ARZAVALA RODELA,,,
63,8011,MC,ARTURO REY VALLES,RUBEN ARMENDARIZ HERNANDEZ,,,
64,8011,PM-PT-NACH,MARIA DEL REFUGIO CARRILLO SAENZ,ALEJANDRA VELO BEJARANO,,,
65,8012,PAN,OLGA LETICIA AVILA SANCHEZ,REYNA YESENIA SAENZ CARRILLO,,,
67,8012,PM,MAGDALENA RAMOS ACOSTA,VICTORIA OROZCO FLORES,,,
68,8013,PAN,GUILLERMO NOE SOTO HOLGUIN,IVES ARCHULETA RASCON,,,
70,8013,PVEM,JOSE MIGUEL TENA MADRID,GABRIEL ARTURO PARRA GALAZ,,,
71,8013,MC,CESAR DOMINGUEZ ALVARADO,EDILIO CORRAL MORENO,,,
72,8013,PES,THALIA DENISSE CARRASCO ALDANA,VIVIANA BEJARANO ALMEIDA,,,
73,8013,PM-PT-NACH,NORMA ELIA CHAVEZ RODRIGUEZ,GLORIA HILDA ROMERO RUIZ,,,
75,8014,PRI,MAYRA MARGARITA RODRIGUEZ MONARREZ,BRENDA YAZMIN BAILÓN FLORES,,,
76,8014,MC,RAMONA ANTONIA VARGAS ALVARADO,,,,
77,8014,PM,UBALDO REZA ASTORGA,BRAULIA ORALIA BAYLON VILLALOBOS,,,
78,8015,PAN,ALEXA FERNANDA REYES FRANCO,MELISSA FERNANDA NIETO JUAREZ,,,
80,8015,PM,MARY ARLIN GARCIA SANTILLAN,CONCEPCION RAMIREZ FRANCO,,,
81,8015,PES,HOMERO PADRON OLIVAS,ALFONSO OLIVAS NAVARRETE,,,
82,8016,PAN,VICTOR HUGO ROMERO MELENDEZ,VIRGINIA SANTANA ORTEGA,,,
83,8016,PRI,FRANCISCO JAVIER BONILLA SANTA ANA,ROQUE RENTERIA RUBIO,,,
84,8016,PRD,LIDIA TORRES GUTIERREZ,TELMA ALICIA TORRES GUTIERREZ,,,
85,8016,MC,LUCIA SEPULVEDA ORTEGA,NORMA ANGELICA RUEDA ARROYO,,,
86,8016,PM,ESTRELLA ESMERALDA CARRASCO ZUBIA,MASCIEL VICTORIA CALDERON GUILLEN,,,
89,8017,PRI,FRANCISCO SAENZ SOTO,GUILLERMO ALBERTO STAUFERT DOMINGUEZ,,,
90,8017,PRD,OBED LARA CHAVEZ,LUCILA MURILLO ROBLES,,,
91,8017,PVEM,FRIDA FERNANDA MORENO PEREZ,BRENDA NACIRA OROZCO ESPINOZA,,,
92,8017,MC,LUZ MARIA RUBIO ORTEGA,TERESITA DE JESUS AVILA PRADO,,,
93,8017,PES,CESAR PAUL RAMOS GONZALEZ,SILVIA TRINIDAD CHAVEZ GONZALEZ,,,
94,8017,PM-PT-NACH,GUADALUPE PEREZ DOMINGUEZ,CLAUDIA ELENA PEÑA ANTILLON,,,
96,8018,PRI,ABEL ORDOÑEZ GARCIA,MARCOS ABEL AGUIRRE DIAZ,,,
97,8018,PM-PT-NACH,JESUS MARIA CAMUÑEZ VENZOR,OSCAR VILLA RENTERIA,,,
98,8019,PRI,SERGIO CARRILLO ESCUDERO,ANTONIO SANDOVAL OLIVAS,,,
99,8019,PVEM,PAOLA KARINA ARROYO GONZALEZ,DIANA ISCELA SANCHEZ LUGO,,,
100,8019,MC,MIGUEL ALONSO RIGGS BAEZA,HUMBERTO GRANADOS ELIZONDO,,,
101,8019,PES,LUIS MANUEL MEDEL SANCHEZ,MIGUEL ANGEL VILLA ACOSTA,,,
102,8019,RSP,PRISCILA EUGENIA LARA CANO,MARIA DEL CARMEN SIFUENTES GARCIA,,,
103,8019,FxM,PATRICIA BORUNDA LARA,ESPERANZA GONZALEZ AGUILERA,,,
105,8019,PM-PT-NACH,MARCO ADAN QUEZADA MARTINEZ,JOSE DE JESUS FAJARDO SANDOVAL,,,
107,8020,MC,MARINA GUADALUPE VELAZQUEZ GONZALEZ,DULCE MARIA HERNANDEZ PEREZ,,,
108,8020,PM,GUADALUPE PEREZ PALMA,OSCAR LUIS VELDERRAIN FELIX,,,
109,8021,PRI,IVAN ESPARZA VASQUEZ,ZUZUKI LUZ MARIA DELGADO LIMAS,,,
110,8021,PVEM,RAUL BOTELLO TORRES,MARCELINO ORTIZ MARQUEZ,,,
111,8021,MC,ROBERTO ANTONIO GONZALEZ GARCIA,VENANCIO ARTURO BRITO HERNANDEZ,,,
112,8021,PES,VERONICA PARENTE JAIMES,MARISOL REYES GARCIA,,,
113,8021,RSP,SYLVIA PATRICIA CHAVEZ HERNANDEZ,LIDIA BUSTILLOS BUSTILLOS,,,
114,8021,FxM,YADIRA ALONSO GASPAR,,,,
116,8021,PM-PT-NACH,JESUS MANUEL LEYVA HOLGUIN,ALFREDO ALONSO SANCHEZ LOZOYA,,,
117,8022,PAN,PATRICIA AZUCENA OLIVAS ESTRADA,JUANA OLIVAS GUTIERREZ,,,
118,8022,PRI,MAGDALENA ZAPATA AGUIRRE,BLANCA ALICIA LUNARES GALLEGOS,,,
119,8022,PRD,SALOMON GALLEGOS TREVIZO,MIGUEL HERNANDEZ GONZALEZ,,,
120,8022,PVEM,OLGA ADRIANA MORALES RASCON,DIANA VENZOR MENDOZA,,,
122,8022,PM-PT-NACH,GABRIELA ESTRADA CHACON,RITA KARINA ARROYO CHACON,,,
124,8023,PVEM,GUILLERMO IRAM POLANCO ARRIETA,JOSE RUBEN ACOSTA CARBAJAL,,,
125,8023,MC,MARISOL PAYAN JARAMILLO,MA. TERESA MENDOZA RODRIGUEZ,,,
126,8023,PES,EVER UVALDO GARCIA RODRIGUEZ,CRUZ MONCADA HERNANDEZ,,,
127,8023,PM-PT-NACH,LINDA MARIA RAY ANGEL,ERIKA ABIGAIL STUBBS GALAZ,,,
128,8024,PAN,HECTOR SAUL BORUNDA MEDINA,CASIMIRO JAQUEZ FLORES,,,
130,8024,MC,JAVIER GARCIA CORDOVA,MANUEL VENZOR TREVIZO,,,
131,8024,PM,ROSA EMMA RIVERA ARAMBULA,RAQUEL SELENE CAZARES NAJERA,,,
132,8024,RSP,RUBEN SALAS COVARRUBIO,CHRISTIAN MAURICIO PHILLIP KIESSLING PORTILLO,,,
133,8024,FxM,MARIA TERESA ALVAREZ RAMOS,,,,
135,8025,PVEM,ELSA EDITH MUÑOZ MEDINA,MARIA DE JESUS TREVIZO PEREA,,,
136,8025,MC,MARCO ANTONIO MUÑIZ REYES,JUAN MARQUEZ CHAVEZ,,,
137,8025,PES,SILVIANO CHACON HINOJOS,JORGE LUIS BURCIAGA ORONA,,,
138,8025,PAN-PRD,MARIA JESUS MONTES GUTIERREZ,IVONNE LERMA MOLINA,,,
139,8025,PM-PT-NACH,SILVIA RIOS GARCIA,GUADALUPE RASCON ANAYA,,,
140,8026,PAN,CLAUDIA GARCIA CHACON,MARIA JESUS PEÑA RAMIREZ,,,
141,8026,PRI,YOLANDA ORTEGA MARTINEZ,JANETTE VENZOR CHAVEZ,,,
143,8026,MC,LAURA ELENA MONTES PEREZ,LUZ IRENE LOYA LOYA,,,
144,8026,PM,MANUELA ESPERANZA NUÑEZ GARCIA,VIVIANA MIRANDA PEREZ,,,
146,8027,PVEM,CELINA YURIBI GONZALEZ DIAZ,CARMEN LILIANA GONZALEZ HOLGUIN,,,
147,8027,MC,ALBERTINA MONTOYA CHAPARRO,CLAUDIA NAVA COBO,,,
148,8027,PES,MARIA SABINA BUSTILLOS LOPEZ,ANTONIA BUSTILLOS LOPEZ,,,
149,8027,RSP,NEIDA YAJAIRA ORTEGA BUSTILLOS,YESENIA ARMENDARIZ PAYAN,,,
150,8027,FxM,EDITH DIAZ AGUIRRE,LYDIA ROSEACHI GONZALEZ,,,
151,8027,PAN-PRD,ANTONIO RONQUILLO AGUIRRE,ROQUE LOYA LOYA,,,
152,8027,PM-PT-NACH,PABLO FRANCISCO MORENO MARTINEZ,EDILIA GUADALUPE PALMA CORDOBA,,,
153,8028,PAN,ALFONSO TREJO SALAS,LORENZO TARANGO VENEGAS,,,
154,8028,PRI,EDNA EDITH ACEVES LOPEZ,NEREYDA JAVALERA JAVALERA,,,
156,8028,MC,GABRIEL URTEAGA NUÑEZ,ADAN RAMOS PARGA,,,
157,8028,FxM,TOMAS ARCHULETA RODRIGUEZ,JOSE ALEJANDRO REY ALVARADO,,,
158,8028,PM-PT-NACH,MIRELLA MINERVA AMARO GALDEAN,MAYTE ORALIA GALLARDO PEREZ,,,
159,8029,PAN,JESUS VELAZQUEZ RODRIGUEZ,FLORINO CALDERON MEZA,,,
161,8029,MC,MARIA EUSTOLIA MOLINA ARZABALA,PERLA ANALY URBINA COVARRUBIAS,,,
162,8029,PM-PT-NACH,PABLO DEMETRIO SUBIAS CHAVEZ,FAUSTO SOTELO CRESPO,,,
164,8030,MC,ENEDINA MARQUEZ AGUILAR,,,,
165,8030,PM,MARIA DEL ROSARIO VILLALOBOS MORQUECHO,GLORIA ISMENE CRUZ YEPIZ,,,
166,8031,PAN,SAUL DOMINGUEZ OROZCO,MANUEL ALFREDO ACOSTA DOMINGUEZ,,,
167,8031,PRI,HELIODORO VALENZUELA PEREZ,ELIU ACOSTA AMADO,,,
168,8031,PVEM,YETZA YESENIA GARCIA TORRES,DINA GABRIELA RASCON HOLGUIN,,,
169,8031,MC,ALFONSO GONZALEZ ALMUINA,JESUS MANUEL CASTRO PEREZ,,,
170,8031,FxM,IGNACIO MORALES RAMOS,IVAN DAVID SAENZ GUERRERO,,,
172,8032,PAN,MANUEL HUMBERTO OLIVAS CARAVEO,MARIO DE AVILA JIMENEZ,,,
173,8032,PRI,MIGUEL JURADO PRIETO,MARIA DEL SOCORRO AGUIRRE GARCIA,,,
174,8032,PRD,PALOMA DOMINGUEZ VILLADO,KARLA GUADALUPE GARCIA MARTA,,,
175,8032,PVEM,JORGE LUNA RODRIGUEZ,DANIEL DARIO LUNA ARROYO,,,
177,8032,PES,SALVADOR CALDERON AGUIRRE,URIEL ULBERTO LOYA CHAVIRA,,,
178,8032,FxM,YVETTE JULIAN LENDECHE,MYRNA ALEJANDRA TORRES SANCHEZ,,,
179,8032,PM-PT-NACH,HUGO MORENO ALVARADO,MAYELA GUADALUPE ALVIDREZ BACA,,,
180,8033,PAN,MARIA ESTELA CORRAL GANDARILLA,SANDRA ELIZABETH BUSTILLOS SANCHEZ,,,
182,8033,MC,REGULA LIDIA CHAVEZ MONTOYA,BLANCA AZUCENA JAQUEZ SERRANO,,,
183,8033,PM,ABEL CORRAL LOYA,EDMUNDO CHAVIRA MOLINA,,,
184,8034,PAN,KARINA ADAENA RAMIREZ RAMIREZ,PATRICIA VEGA BENCOMO,,,
185,8034,PRD,ROBERTO ALONSO FLORES CASTILLO,FIDELA DIAZ SAENZ,,,
186,8034,PVEM,JESUS RASCON VAZQUEZ,VIRGILIO HERNANDEZ RIOS,,,
188,8034,FxM,OMAR ESCORZA ORTIZ,GASTON VARGAS VEGA,,,
189,8034,PM-PT-NACH,DIANA ARMINE BELTRAN MARQUEZ,MARIA NEVAREZ TERRAZAS,,,
191,8035,PRI,TRINIDAD MADRID PARRA,MANUEL ECHERIVEL GRAJEDA,,,
192,8035,PRD,ROMELIA MARRUFO PEREZ,NIDIA AIDALE MARTINEZ MARRUFO,,,
193,8035,PES,LORENZO RICARDO CHAVEZ CORONADO,GUILLERMO LUJAN DOMINGUEZ,,,
194,8035,RSP,GRACIANO VALDEZ RUBIO,JUAN MANUEL GUTIERREZ JASSO,,,
195,8035,FxM,ARTURO VARELA MADRID,SAUL RUIZ CARAVEO,,,
196,8035,PM-PT-NACH,MERCEDES LIZETH ENRIQUEZ MARTINEZ,NORMA EDITH BUSTAMANTES HERRERA,,,
197,8036,PAN,JESUS MANUEL VAZQUEZ MEDINA,GIBRAN YAIR GOMEZ SEGOVIANO,,,
198,8036,PRI,JUAN MANCILLAS PALACIOS,AGUSTIN ARTEAGA PEINADO,,,
199,8036,PRD,SANDRA REFUGIO TORRES ALVAREZ,BLANCA YURIANA TORRES ALVAREZ,,,
200,8036,MC,MARGARITA ARMENDARIZ MENDEZ,MARY JOSE ROMERO DE LA O,,,
201,8036,PES,HEIDI ALEJANDRA CALDERA HERNANDEZ,ASTRID DIAZ MACIAS,,,
202,8036,FxM,GERARDO GUTIERREZ CHAPARRO,JESUS VIELMA PADILLA,,,
204,8036,MONTOYA,OLGA MARGARITA MONTOYA BELTRAN,TERESITA DEL NIÑO JESUS CARDONA LUJAN,,,
205,8036,TREJO,CONCEPCION TREJO CARDOZA,RAMON SILVA VAZQUEZ,,,
206,8037,PRI,ADRIANA FUENTES TELLEZ,AURORA IRMA MAYNEZ GUADERRAMA,,,
207,8037,PVEM,RODOLFO ALBERTO BENAVIDES CRUZ,,,,
208,8037,MC,JOSE RODOLFO MARTINEZ ORTEGA,JORGE MARIO QUINTANA SILVEYRA,,,
209,8037,PES,MARISELA SAENZ MORIEL,LIDIA HERNANDEZ BARRAZA,,,
210,8037,RSP,MISAEL MAYNEZ CANO,JAIME VILLALVA SALAS,,,
211,8037,FxM,ANDRES SOLIS HERNANDEZ,,,,
212,8037,PAN-PRD,JAVIER GONZALEZ MOCKEN,RAUL GARCIA RUIZ,,,
214,8038,PAN,DIANA PATRICIA CASAS TINAJERO,ROMELIA ZUBIA GOMEZ,,,
216,8038,PVEM,EUNICE CARNERO OCHOA,KAREN YAJAIRA HINOJOSA ARANDA,,,
217,8038,MC,JOSEFINA AVILA MARTINEZ,ANETTE MARTINEZ OLIVAS,,,
218,8038,PM,IVAN NUÑEZ PONCE,JESUS JOSE BALDERRAMA RODRIGUEZ,,,
219,8038,PES,CLAUDIA IVETTE CERA ALMANZA,MARGARITA AZUCENA RODRIGUEZ CISNEROS,,,
220,8039,PRI,DALILA MALDONADO CHAPARRO,ARELY BERENISE HERNÁNDEZ VARGAS,,,
222,8039,PAN-PRD,CECILIA GURROLA GÓMEZ,MARIA TERESA MUÑOZ CORDERO,,,
223,8039,PM-PT-NACH,EMMA MARIBEL FLORES CAMACHO,DORA ELIA MARTA FLORES,,,
224,8040,PRI,JORGE HUMBERTO GUZMAN ENRIQUEZ,JORGE ARTURO OCHOA JUAREZ,,,
225,8040,MC,RITA JANETH GAYTAN TALAMANTES,FRANCISCA IDALIA RÍOS CHÁVEZ,,,
226,8040,RSP,EBEDEL GONZALEZ CORDOVA,CARLOS EDUARDO ANTILLON FERNANDEZ,,,
228,8040,PM-PT-NACH,ARNOLDO JAQUEZ PEREZ,VICTOR JAVIER LEON CHACON,,,
229,8041,PAN,MARILYNN MORAN ACOSTA,VIRGINIA ACOSTA VILLAR,,,
231,8041,PRD,MIGUEL ANGEL BANDA MANRIQUEZ,MARIA ANGELA RASCON NUÑEZ,,,
232,8041,MC,GERARDO BANDA BANDA,GUADALUPE ORTIZ RIVAS,,,
233,8041,PM,MARIA ELENA BANDA BANDA,MARIA BELEN QUEZADA JAQUEZ,,,
234,8042,PAN,ELSA GUTIERREZ MORALES,LESLY ANAHI HERNANDEZ GASTELUM,,,
235,8042,PRI,MAYRA AIDE MORENO ARANDA,AZUCENA GRADO HINOJOS,,,
237,8042,PVEM,CELSO JEFFTE TRUJILLO GARCIA,GUSTAVO BAEZA GALINDO,,,
238,8042,MC,MARIA NANCY CERDA MEDRANO,NOELIA OROZCO HERNANDEZ,,,
239,8042,PM-PT-NACH,MANUEL ALFONSO MONTOYA GALINDO,ALAN NUÑEZ PADILLA,,,
240,8043,PAN,MARIA MARQUEZ CRUZ,KATIA MATIANA ROMERO MORALES,,,
242,8043,PRD,RAQUEL JANETH HERNANDEZ BALDERRAMA,SILVIA MIREYA CORDOVA GUTIERREZ,,,
243,8043,PT,ALBERTINA DOMINGUEZ ITURRALDE,YESENIA MARYSOL CABADA DOMINGUEZ,,,
244,8043,MC,ALMA VIVIANA BASTARDO CARDENAS,AIRAM YATZIRI ALVARADO ARANDA,,,
245,8043,PM,YESIKA CORDOVA MOLINAR,CARMEN LILIANA ARVIZO GRANADOS,,,
246,8043,NACH,CECILIA CARRASCO SOLIS,IDA EDITH SUAREZ DUARTE,,,
247,8043,PES,MARIO EDUARDO MORALES PARRA,LUIS ALFREDO VINIEGRA ANTILLON,,,
249,8044,PRI,GUADALUPE GAXIOLA MELCHOR,GRACIELA EUNICE GARDEA MENDEZ,,,
250,8044,PVEM,ROSA ELIZABETH MONTES ,KARINA GONZALEZ MORALES,,,
251,8044,MC,GUADALUPE OTILIA MOYA OAXACA,GUILLERMINA TAVIZON CHAVEZ,,,
252,8044,PM,MAYRA SUSANA MOLINA HEREDIA,ROSA ISELA CHAVEZ PILLADO,,,
253,8045,PRI,ALMA ROSARIO RODRIGUEZ BRETADO,MARIA GUADALUPE OLIVAS ACOSTA,,,
254,8045,MC,IRMA VALENZUELA RUEDA,MARELY DE LA TORRE ONTIVEROS,,,
255,8045,PES,VLADIMIR MORALES RIVERA,JESUS RODRIGUEZ DE ANDA,,,
256,8045,RSP,FELIPE HERMOSILLO PRIETO,ORLANDO CASTILLO SOTO,,,
258,8045,PM-PT-NACH,MARTHA LORENA MELENDEZ MATA,SANDRA ANGELICA CASTILLO LOPEZ,,,
259,8045,LUJÁN,REYNALDO LUJAN ALVAREZ,SAYDA GUADALUPE PORRAS OCHOA,,,
261,8047,PAN,JOSE MARTIN PEREZCAMPOS PEREZ,FROYLAN MOORE ERIVES,,,
263,8047,PM,NEYFY DIANA RANGEL CASTILLO,ALEJANDRA AGUAYO AMADO,,,
264,8048,PAN,JOSE CRUZ RUIZ SOLIS,CARLOS FERNANDO MARRUFO PEREZ,,,
266,8048,PRD,DANIEL ORNELAS TENA,JORGE IVAN TREVIZO BURCIAGA,,,
267,8048,PVEM,MANUELA ELIZABETH DURAN DURAN,KAREN IVETH CERVANTES VALADEZ,,,
268,8048,MC,PRISCILLA TERRAZAS MENDOZA,BRENDA ISABEL HERRERA TORRES,,,
269,8048,PM-PT-NACH,ERIKA STENNER ORTIZ,ELSA YADIRA MARQUEZ ARAIZA,,,
270,8048,GARCÍA,RAFAEL ANGEL GARCIA CANO,PAULO OLIVAS DOMINGUEZ,,,
271,8049,PAN,JOSE HECTOR CARO VILLALOBOS,CARLOS ROMERO CALAMACO,,,
272,8049,PRI,HOMERO CARMONA CARMONA,RAMIRO GONZALEZ GONZALEZ,,,
274,8050,PRI,MARCELA IVETTE HINOJOS CANO,JESSICA JANETH BENCOMO VARELA,,,
275,8050,PVEM,MANUEL ALBERTO CHAIREZ COSS,LUIS ALEJANDRO GUTIERREZ GUTIERREZ,,,
276,8050,MC,LUIS JAVIER MENDOZA VALDEZ,ENRIQUE SANDOVAL LOPEZ,,,
277,8050,PES,CLAUDIA ESMERALDA ALCANTAR RODRIGUEZ,FLOR LIZETH BARBA MARTINEAU,,,
278,8050,RSP,ELSA PATRICIA ACOSTA QUEZADA,JUDITH CONSUELO NAVARRETE NAVARRETE,,,
279,8050,FxM,CARMEN MARCELA ALVAREZ FLORES,MARIA GUADALUPE LAGUNAS MARQUEZ,,,
280,8050,PAN-PRD,PEDRO JOSE GARCIA VALENZUELA,LUIS ALBERTO ARROYOS FERNANDEZ,,,
282,8050,PRECIADO,DELIA LEONARDA PRECIADO NUÑEZ,DELIA SAMANTHA SANDOVAL PRECIADO,,,
283,8051,PAN,BLANCA ELVA RASCON GRIJALVA,AMERICA RIVERA MARTINEZ,,,
284,8051,PRI,LILIA IRENE RAMIREZ BAYRRUZ,SILVIA LUZ MENDOZA ,,,
285,8051,PRD,ANTONIA MURILLO TELLO,VIRIDIANA GRIJALVA MANJARREZ,,,
286,8051,PVEM,JOSE AMADOR CHAVEZ SIERRA,YESICA CUEVAS VALENZUELA,,,
287,8051,MC,OMAR CHAVEZ OROZCO,MANUEL RAUL PAREDES HERRERA,,,
289,8052,PAN,JORGE HUMBERTO SANCHEZ VALLES,JESUS OSCAR FLOTTE GUEVARA,,,
291,8052,PVEM,ALEJANDRA VALDEZ SOTELO,CLAUDIA JACQUELINE CONDE RODRIGUEZ,,,
292,8052,MC,IRMA ARACELY MARTINEZ MARQUEZ,ELIZABETH MOLINA ANDUJO,,,
293,8052,PM-PT-NACH,JESUS FLORENTINO CHAVEZ VALLES,FRANCISCO JAVIER JAQUEZ HINOJOS,,,
294,8053,PAN,SILVIA ARZATE ESPINO,ARGELIA CORINA HERNANDEZ PEREZ,,,
295,8053,PRI,VERONICA TARIN GOMEZ,REYNA YUDITH BARRIENTOS GARCIA,,,
296,8053,PVEM,AMERICA BERENIS HERRERA FLORES,VALERIA IVETTE YAÑEZ RIVERA,,,
297,8053,MC,ALMA LETICIA RODRIGUEZ BARRAZA,ANA LUISA HERNANDEZ CASTILLO,,,
300,8054,PRI,JORGE ADRIAN AGUILAR CORRAL,RAMIRO ERASMO CHACON ACOSTA,,,
301,8054,PT,ROCIO RIVERA OCHOA,IRIS GRISELDA OCHOA AYADO,,,
302,8054,PM,MARIA AUSTREBERTA BUSTAMANTE GRAJEDA,MARIA DEL CARMEN GRAJEDA TERRAZAS,,,
303,8054,FxM,ALMA YADIRA DEL ANGEL GARDEA,DANIELA MARTINEZ QUINTANA,,,
304,8055,PRI,ANA LILIA GUILLEN CARRILLO,MANUELA RAQUEL AGUILAR FLORES,,,
305,8055,PT,JOSE FRANCISCO RAMIREZ LICON,EDEL SOTELO REYES,,,
306,8055,MC,ELIDA AIMEE SANCHEZ DIAZ,MARTHA ELVA LEO RAMIREZ,,,
307,8055,PM,SANDRA LUNA HERNANDEZ,SANDRA YUDITH ALVARADO MORALES,,,
308,8055,PES,MARIA ISABEL LOPEZ CARRILLO,,,,
310,8056,PAN,GUADALUPE GONZALEZ MERAZ,MARIA ISA GONZALEZ MERAZ,,,
312,8056,PRD,JESUS FRANCISCO GARCIA CORRAL,PEDRO GUADALUPE GALAVIZ GARCIA,,,
313,8056,PM,LISETT CHAPARRO CHAVIRA,KARINA ISELA MERAZ MORALES,,,
314,8057,PAN,ADRIANA HERNANDEZ TORRES,AIDALY PALMA MENDOZA,,,
316,8057,PT,GUADALUPE VIOLETA LARREA,MARTHA CHAPARRO CHAVEZ,,,
317,8057,PM,LEOVARDO MARIO TORRES PARRA,EVA CERA ANDRADE,,,
319,8058,MC,VICENTE BETANCE OLIVEROS,MANUEL VICTOR CARRILLO MEZA,,,
320,8058,PM,ANA MARTHA URIBE SAGARNAGA,ANTONIA LORENA LEAL SERNA,,,
321,8059,PRI,GRISELDA LIDUVINA FONTES PALMA,AMALIA SANDOVAL GUTIERREZ,,,
322,8059,PVEM,RAFAEL MONTOYA VILLALOBOS,ARLENE AIDE AMARO PIÑON,,,
324,8059,MC,DENNIS EDUARDO MARTINEZ ARCINIEGA,JOSE MANUEL SANCHEZ RODRIGUEZ,,,
325,8059,PM,JUAN CARLOS CORRAL PACHECO,RICARDO ORTIZ BURCIAGA,,,
326,8059,PES,FELIPE TERRAZAS GUTIERREZ,AMADOR LERMA MURO,,,
327,8059,FxM,YOLANDA VILLALOBOS MOLINA,VANESSA CARRERA REYES,,,
328,8059,PAN-PRD,LUZ MARIA LOPEZ HERRERA,ZUILMA VALENTINA GALLEGOS SANDOVAL,,,
330,8060,PVEM,GUADALUPE MORALES REYES,DANNYA MABEL GUERECA HERNANDEZ,,,
331,8060,MC,LUIS ALBERTO RODRIGUEZ CHAIREZ,LAZARO ZAPIEN LOYA,,,
332,8060,PES,JORGE ALFREDO SALCIDO HERNANDEZ,OSCAR GIL HERNANDEZ JURADO,,,
333,8060,FxM,EDGAR RICARDO SALCIDO TORRES,MARINA REBECA BELTRAN RIVERA,,,
334,8060,PAN-PRD,ALMA GUADALUPE WONG MORENO,MARIA RAMONA ONTIVEROS CANO,,,
335,8060,PM-PT-NACH,RAMON SOTO JURADO,JUAN JOSE SALINAS DIAZ,,,
337,8061,PRI,MARIA CARIDAD ROMAN FLORES,TOMASA  RIVERO,,,
338,8061,MC,YOLANDA CARO QUINTANA,FERNANDA ANAHY BALDERRAMA CARO,,,
339,8061,PM,MARTHA ESTHER AGUILAR RODRIGUEZ,CLAUDIA VERONICA RUIZ MENDOZA,,,
341,8062,PRI,MARIA ELENA RUEDA ALVIDREZ,ERNESTINA LARA MERAZ,,,
342,8062,PRD,JAIME LARA HERNANDEZ,ISRRAEL TORRES PEREZ,,,
343,8062,PVEM,MARIA ISABEL ALVAREZ NAVA,SONIA LORENA NAVA ANDRADE,,,
344,8062,MC,FATIMA DEL ROSARIO ARROYO MENDOZA,YOLANDA REZA ESTRADA,,,
345,8062,PES,CARLOS RICARDO NAVARRO FERNANDEZ,RAMON GILBERTO REGALADO REGALADO,,,
346,8062,FxM,CARMEN ISELA ORTIZ GARCIA,ANA ELIZABETH JIMENEZ MARTINEZ,,,
347,8062,PM-PT-NACH,FRANCISCO HUMBERTO CHAVEZ HERRERA,MARIO ALBERTO PALACIOS AYALA,,,
348,8063,PAN,MARIA DOLORES ANTILLON GAMEZ,MA. CATALINA ACOSTA RIOS,,,
350,8063,PM,OMAR CALEB LAZO HERRERA,RAMONA PATRICIA CONTRERAS GOMEZ,,,
351,8063,RSP,ANGELICA MARIA RODRIGUEZ BUSTILLOS,ELSA ISELA CANO IBARRA,,,
353,8064,PRI,GRISELDA GUTIERREZ CHAVEZ,SOCORRO GUTIERREZ SANCHEZ,,,
354,8064,MC,NAYDELIN RIOS PIÑON,MARIA DE LOURDES CAZARES FRANCO,,,
355,8064,PM,ANABEL PRIETO SOSA,MARIANA SANCHEZ PRIETO,,,
356,8065,PAN,MAYRA DE JESUS DIAZ GUTIERREZ,AIDA ARACELI DOMINGUEZ LOZANIA,,,
357,8065,PRI,DALIA URIAS SILVA,MARIA CADENA CORRALES,,,
359,8065,PM,HEBER ARTURO LANGARICA ALMANZA,EDGAR EVELIO ESTRADA MANCINAS,,,
360,8066,PAN,ADRIANA CAMPOS RASCON,ROSARIO INOCENTA TAPIA MARQUEZ,,,
362,8066,MC,SERGIO MANCINAS GONZALEZ,JESUS RAUL MONTES CAMPOS,,,
363,8066,PM,NORMA RAFAELA HUEREQUE RASCON,EUNICE MONTES PEREZ,,,
365,8067,PVEM,GERMAN MORALES CHAVIRA,DIANA IVET TARANGO ARMENDARIZ,,,
