ID_ESTADO,ID_MUNICIPIO_LOCAL,PARTIDO_CI,CANDIDATURA_PROPIETARIA,CANDIDATURA_SUPLENTE
14,1,PAN,MARCO TULIO MOYA DIAZ,JULIAN HERNANDEZ GONZALEZ
14,1,PRI,ARTURO HERNANDEZ CARBAJAL,JUAN MARCOS GARCIA AGUIRRE
14,1,PVEM,MARCELA AVILA DIAZ,CECILIA SUAREZ GOMEZ
14,1,MC,RIGOBERTO DE LA TORRE ANAYA,RAMON PAREDES GUERRERO
14,1,MORENA,NORMA ANGELICA GONZALEZ GUTIERREZ,ALMA SARAHI RODRIGUEZ CUEVA
14,1,HAGAMOS,DAVID CAMARENA VERA,ALONSO CIRILO CHAVEZ NUNGARAY
14,1,FM,MARIA ELENA ALVARADO ROBLEDO,SONIA CARBAJAL GONZALEZ
14,2,PAN,MA TERESA MOJICA GOMEZ,ANDREA YUSSEL FUNEZ GONZALEZ
14,2,PRI,IVONE GUDIÑO GONZALEZ,PAMELA FABIOLA GARCIA LOPEZ
14,2,PVEM,GLORIA ELIZABETH GONZALEZ DAVALOS,MARIA ESTEFANIA PARDO PEDROZA
14,2,MC,JAIME ENRIQUE VELASCO LOPEZ,MARCO ALONSO ORTEGA MARTINEZ
14,2,MORENA,ANEL JUDITH LOPEZ AGUILAR,ERIKA MARIA RODRIGUEZ CAMACHO
14,2,PES,JUAN CARLOS GARCIA IBARRA,CESAR ENRIQUE MARTINEZ ZAMORA
14,2,HAGAMOS,ERICK MEDINA SIORDIA,JUAN ARMANDO RUIZ DIAZ
14,2,RSP,GUADALUPE ELIZABETH LOPEZ MEDINA,MARIA DE LOURDES RODRIGUEZ GARCIA
14,2,FM,ALEJANDRO ALVARADO TOSCANO,JONATHAN ALBERTO ALVAREZ ROMAN
14,3,PAN,JOSE RAFAEL DOMINGUEZ MORA,AURELIO QUEZADA GARCIA
14,3,PRI,CESAR ARTURO COBIAN LOPEZ,FRANCISCO EDUARDO QUINTERO MADRIGAL
14,3,PT,MARIA ELENA SANTOS GARCIA,MARIA DE JESUS FLORES DE ANDA
14,3,MC,JOSE BLADIMIR ARREOLA ALVAREZ,CHRISTIAN DANIEL VELASCO RAMIREZ
14,3,MORENA,MARIA JIMENEZ CAMARILLO,
14,3,HAGAMOS,CRISTOPHER ALEJANDRO VELAZQUEZ OROZCO,MARIA DEL CARMEN TIZNADO VELAZQUEZ
14,4,PAN,,
14,4,PRI,CIRCE ANDREA SANTANA PERALTA,YESENIA BENITO AGUILAR
14,4,PRD,DANIEL CORDOVA JIMENEZ,JUAN JOSE VALDIVIA PINTO
14,4,MC,LUZ ELVIRA DURAN VALENZUELA,ANA KAREN LOPEZ MARTINEZ
14,4,MORENA,LIZ DEFENSA RAMIREZ GALINDO,MARIA SOLEDAD OLIVARES MARQUEZ
14,4,HAGAMOS,FABIOLA SANCHEZ GRAJEDA,SAYRA YANET HERNANDEZ FLORES
14,5,PAN,RUBEN REYNOSO FLORES,ARMANDO ONTIVEROS ASSAD
14,5,PRI,HEIDI ASURIM AVIÑA RAMIREZ,MONICA YAZMIN ARROYO ROMERO
14,5,PRD,LILIANA LIZBETH OCAMPO ELIAS,IRMA YOLANDA DELGADO GUZMAN
14,5,PVEM,J JESUS RIVERA LANDEROS,OFELIA MORQUECHO RAMIREZ
14,5,MC,NERY SAUL GARCIA ESQUEDA,RODRIGO GUTIERREZ PARTIDA
14,5,MORENA,JOSUE SAUL PEREZ OCAMPO,SUSANA OSUNA GOMEZ
14,5,PES,ROSA ANAHI ORNELAS GARCIA,MARIA CRISTINA ORNELAS AGUAYO
14,5,HAGAMOS,JANET CASTAÑEDA PONCE,MARTHA ISABEL GARCIA CORTEZ
14,5,FUTURO,PABLO REYES GONZALEZ,JOSE LUIS ROMAN MONTES
14,5,RSP,CECILIA IBARRA PLASCENCIA,GUADALUPE PARTIDA VILLAREAL
14,5,FM,ROSIO MARIANA RAVELERO CRUZ,JOHANA LIZETH OCAMPO GARCIA
14,6,PAN,ANUAR TAVERA ROMERO,VICTOR MARCIANO VIRGEN RODRIGUEZ
14,6,PRI,LUIS ARTURO MEZA ANDALON,JUAN MANUEL LUQUIN LOPEZ
14,6,PRD,MARIA DE LOS ANGELES LOPEZ ROSAS,
14,6,PVEM,EDILBERTO ENRIQUEZ PARRA,JUAN CARLOS GUZMAN RAMOS
14,6,MC,JUAN VALENTIN SERRANO JIMENEZ,HECTOR ENRIQUE CASTRO ROSAS
14,6,MORENA,FRANCISCO MARIN JIMENEZ,VICTOR MANUEL AMADOR RAMOS
14,6,PES,ANDRES RODRIGUEZ FLORES,OBDULIA HERNANDEZ AGUILAR
14,6,HAGAMOS,VICTORIA MARISCAL ROMERO,KARINA LISSET RIVERA MORENO
14,6,FUTURO,XOCHITL JULIETA RUELAS PONCE,LUZ DEL MAR GARCIA VELASCO
14,6,FM,MARCO ANTONIO GONZALEZ BECERRA,GERARDO RODARTE GARIBALDI
14,8,PAN,MARIA CAROLINA AGUIRRE BERNAL,GABRIELA JIMENEZ LOZANO
14,8,PRI,MIGUEL ALEJANDRO ZUÑIGA VEGA,VICTOR ALONSO SANCHEZ HERNANDEZ
14,8,PT,MARIA DE JESUS GALINDO GARCIA,GRACIA ESTELA PLASCENCIA MARQUEZ
14,8,MC,ANA ISABEL BAÑUELOS RAMIREZ,HEIDI MARMOLEJO LOPEZ
14,8,MORENA,JUAN DAVID GUZMAN MORALES,ISRAEL VILLASEÑOR JIMENEZ
14,8,PES,,CLAUDIA ALEJANDRA ACEVES GUTIERREZ
14,8,HAGAMOS,JOSE SOCORRO MARTINEZ VELAZQUEZ,EDGAR DE JESUS LOPEZ HERNANDEZ
14,8,RSP,JAIME FERNANDO ARISTEO MARTINEZ HERNANDEZ,ALBERTO ARCE SANCHEZ
14,8,FM,GUADALUPE DE JESUS SAMOANO VALENZUELA,MARINA SAINZ LOPEZ
14,10,PAN,SANTIAGO LEON CASTRO,JOSE MANUEL BALTAZAR SANTIAGO
14,10,PRI,BELEN RITO APARICIO,ALMA NOEMI RITO DE LA CRUZ
14,10,PVEM,MAYRA ALEJANDRA PEREZ MARTINEZ,MAYRA MARTINEZ ORTEGA
14,10,MC,J JESUS MONROY MORENO,EFREN RAMOS ESCOLASTICO
14,10,MORENA,GERARDO RIVERA ESPINOZA,RODOLFO SANCHEZ SANCHEZ
14,10,PES,MARIA GUADALUPE RIVERA CRUZ,MARIA CAROLINA HERNANDEZ COLON
14,10,HAGAMOS,FRANCISCO MARTINEZ HERRERA,MA EUGENIA DE LOS SANTOS CASTRO
14,11,PAN,NANCY MALDONADO GOMEZ,MA OLIVIA LANDEROS TORRES
14,11,PRI,LUZ TERESA VALLE GONZALEZ,MAYRA QUINTANA FREGOSO
14,11,MC,CLEMENTINA FERNANDEZ MARTINEZ,AIDE DE LOS SANTOS VIRGEN
14,11,MORENA,MA ELVA GONZALEZ GONZALEZ,
14,11,HAGAMOS,BELGICA JIMENEZ ORGANISTA,MAYAN AMAIRANI PEÑA GUZMAN
14,12,PAN,MARIA DE LOS ANGELES RUIZ MACEDO,MARILU MACEDO HERNANDEZ
14,12,PRI,MANUEL MARTIN VELASCO PRECIADO,ADRIANA CUEVAS CHAVEZ
14,12,MC,MAYRA ISELA GUITRON CONTRERAS,EVELIA GONZALEZ QUIJAS
14,12,MORENA,MA CONCEPCION GOMEZ ALVARADO,
14,12,PES,BRENDA FABIOLA LOPEZ MARTINEZ,MARIA GUADALUPE FLORES GONZALEZ
14,12,HAGAMOS,ANGEL GUILLERMO LOPEZ DUEÑAS,EMMANUEL GOMEZ DE ROBLES
14,13,PAN,FRANCISCO JAVIER AGUIRRE MENDEZ,HECTOR MIGUEL GONZALEZ GONZALEZ
14,13,PRI,JOSE AURELIO FONSECA OLIVARES,JORGE SOLORIO MACIAS
14,13,PRD,SILVIA LORENA GARCIA TORRES,MARIA DEL CARMEN ALCANTAR VAZQUEZ
14,13,PVEM,MARIA DE JESUS PLASCENCIA AGUILAR,VERONICA JIMENEZ ORTEGA
14,13,PT,ARMANDO CERDASANTIAGO ROJAS,ROGELIO GARCIA BORUNDA
14,13,MC,CRUZ CARRILLO SOLIS,LUIS EDUARDO GUZMAN SERRANO
14,13,MORENA,RAFAEL EDUARDO BARRAGAN CASTILLO,JOSE DE JESUS HERNANDEZ FONSECA
14,13,PES,ALEJANDRO AVALOS ANDRADE,
14,13,HAGAMOS,ALICIA ESCOTO SIERRA,NORMA ALICIA GOMEZ TORRES
14,13,FUTURO,MARTHA PATRICIA ARENAS MUÑOZ,JUDITH NAVARRO GUTIERREZ
14,13,RSP,NOEL HERIBERTO GARCIA TORRES,FERNANDO ANTONIO MEJIA SANCHEZ
14,13,FM,SONIA RUBI NAVARRO TELLO,ESMERALDA ELIZABETH PAZ SERRATO
14,13,RHCA,CARLOS ALBERTO ROMO HERNANDEZ,JOSE ELIAS ACEVES NAVARRO
14,14,PAN,MARIA CAROLINA ARREZOLA DELGADO,ESMERALDA DE LA CRUZ CASTILLO
14,14,PRI,SONIA GUADALUPE CABRERA RAMIREZ,MARIA ESTHER ARECHIGA AVILA
14,14,PRD,ESMERALDA ALONSO RODRIGUEZ,ILEANA YARELI RAMIREZ ANGUIANO
14,14,MC,KARLA ALEJANDRA CRUZ SANCHEZ,SONIA JEANETTE TOSCANO RAMIREZ
14,14,MORENA,PATRICIA MIREYA TORRES VERGARA,MARIA DE JESUS RAMIREZ JIMENEZ
14,14,PES,MARTINA VENEGAS MURILLO,
14,14,HAGAMOS,FRANCISCO JAVIER JIMENEZ HERNANDEZ,PEDRO LOPES PEREZ
14,14,FM,PABLO RENE TORRES UREÑA,JOSE MANUEL ACOSTA ZUBIETA
14,15,PAN,JAIME ANTONIO HERNANDEZ HERNANDEZ,LUIS JORGE DIAZ CORONADO
14,15,PRI,GUSTAVO SALVADOR ROBLES MARTINEZ,CARLOS ALBERTO RAMIREZ ESPINOSA
14,15,PRD,EVA JUDITH HUESO GUERRERO,MARIA ELENA LOPEZ HERNANDEZ
14,15,PT,MARTHA ELENA LOPEZ VELAZQUEZ,LAURA GUADALUPE SANCHEZ ROJAS
14,15,MC,J NICOLAS AYALA DEL REAL,MANUEL DE JESUS JOYA ADAME
14,15,MORENA,FAUSTO MANCILLA MARTINEZ,SALVADOR GARCIA RUVALCABA
14,15,PES,SERVANDO NAVARRO MEDINA,LUIS NARANJO VARGAS
14,15,HAGAMOS,JOSE MARTIN GARCIA DE ALBA TOSCANO,ADRIAN BRAMBILA GUERRA
14,15,FUTURO,TERESA DANIELLA RAMIREZ GAMIÑO,JENIFFER SAMANTHA LUNA FLORES
14,15,RSP,LUIS ROBERTO PRECIADO ZAVALA,ALEJANDRO MORALES CATAÑEDA
14,15,FM,FELIPE FLORES GOMEZ,
14,15,CMSR,SERGIO RAFAEL CAPACETE MORAN,ERNESTO GARCIA MEDINA
14,15,ZQO,OSCAR ZEPEDA QUIÑONEZ,SABINO JAVIER RAMOS MORALES
14,16,PAN,M GUADALUPE HURTADO SANCHEZ,ANDREA ESPAÑA BERMUDEZ
14,16,PRI,AGUSTIN ZUÑIGA BANDA,JOANA JAZMIN VELAZQUEZ MONTELONGO
14,16,PVEM,DIANA VICTORIA GARCIA GONZALEZ,GRISCELDA GUADALUPE GONZALEZ AGUILAR
14,16,PT,CLAUDIA ISABEL VALLES RAMIREZ,MA GUADALUPE ASCENCIO LOZA
14,16,MC,RODOLFO HERNANDEZ SANCHEZ,PORFIRIO ROCHA ESCOTO
14,16,MORENA,JUAN PEDRO PEREZ ROJAS,JOSE GUADALUPE AYALA VAZQUEZ
14,16,PES,YEIEL PAUL LAU PARRA,
14,16,HAGAMOS,LUIS EDUARDO GONZALEZ ESCOTO,MOISES ISAAC HERNANDEZ ARAMBULA
14,16,RSP,GUILLERMO RODRIGUEZ ESCOTO,JOEL ALCALA TOVAR
14,16,FM,ANA BERENICE ZUÑIGA VARGAS,ERIKA DEL CARMEN MATA AVILEZ
14,17,PAN,JAVIER SANCHEZ CAMPOS,GERMAN TORRES PEREZ
14,17,PRI,BLANCA MARLENE DOMINGUEZ HUERTA,MIRIAM NOEMI GONZALEZ RAMIREZ
14,17,PT,LEOBARDO LOPEZ ANDRADE,ANA MARGARITA DIAZ FONSECA
14,17,MC,JOSE ANGEL PRUDENCIO VARGAS,SILVIA ALCALA LEPE
14,17,MORENA,RAMON BARREDA NARANJO,ROBERTO VARGAS CONTRERAS
14,17,PES,ROSARIO AMARAL EFIGENIO,ELBA PATRICIA MONTOYA NUÑEZ
14,17,HAGAMOS,JOSE FRANCISCO SANDOVAL BRAMBILA,MIRIAM DENISSE VILLEGAS VERBERA
14,17,FUTURO,YESSENIA ARELY LOPEZ GUITRON,ROCIO RAMOS MUÑIZ
14,19,PAN,MARGARITA MARTINEZ SANCHEZ,YAMILET ESMERALDA MARTINEZ DE LA CRUZ
14,19,PRI,MARIA DOLORES CHAVEZ DE LA CRUZ,ALMA CHINO SANCHEZ
14,19,PRD,SANTOS DE LA CRUZ GONZALEZ,ANCELMO DE LA CRUZ VAZQUEZ
14,19,MC,IRMA GONZALEZ MAYORGA,BEATRIZ MAYORGA LAREZ
14,19,MORENA,ANTONIO CARRILLO GONZALEZ,FELIPE COSIO CARRILLO
14,19,HAGAMOS,MARIA GUADALUPE CURIEL ALEGRIA,ERICA SALINAS GONZALEZ
14,20,PRI,ANA BRISEYRA IBARRA SOLIS,
14,20,PVEM,MIGUEL ANGEL SILVA RAMIREZ,
14,20,PT,MARIO HUMBERTO RODRIGUEZ ROMERO,RAYMUNDO GONZALEZ CHAVARIN
14,20,MC,LOURDES OLIVERA MORENO,NEIRA IVETH RODRIGUEZ RODRIGUEZ
14,20,MORENA,MARIA BELEN CHAVARIN PALACIOS,GLORIA THALIA VERDE GONZALEZ
14,20,HAGAMOS,FELICITAS MANRIQUEZ NAVA,TERESA ELIZABETH OLIVERA OROZCO
14,117,PAN,ADELAIDA ELIZABETH CARVAJAL TORRES,AMPARO OROZCO MENDOZA
14,117,PRI,MA EVA ALCALA IÑIGUEZ,MARIA DE JESUS GUTIERREZ RUVALCABA
14,117,PVEM,MIGUEL OROPEZA RUVALCABA,ISMAEL PADILLA VALLEJO
14,117,MC,LAURA LIZBETTE RUEZGA ALCALA,JARETZY MARGARITA HUERTA GUTIERREZ
14,117,MORENA,MARIA DE LA LUZ GARCIA DIAZ,DULCE CORAZON RAMIREZ MORALES
14,117,HAGAMOS,ANA MARIA JAUREGUI JIMENEZ,
14,117,FM,ESTHER YOLANDA ALCALA BARBA,MARIA DE LOURDES MARTINEZ RAMIREZ
14,21,PAN,DIANA LAURA GALLEGOS VAZQUEZ,PAOLA ESMERALDA PARTIDA VAZQUEZ
14,21,PRI,MARIO PELAYO GUZMAN,VICTOR MANUEL RODRIGUEZ ANGUIANO
14,21,PVEM,EMIDIO CARBAJAL CURIEL,MARTHA ELENA PEÑA DE NIZ
14,21,MC,GIOVANNI JAVIER PELAYO RAUDALES,JUAN CARLOS VAZQUEZ VELAZCO
14,21,PES,MARIA AURORA AGUILAR RAMIREZ,CANDELARIA DONATO MEDINA
14,21,HAGAMOS,JUAN FRANCISCO ADAME GOMEZ,EDUARDO TONATIHU CHAGOLLA PEREZ
14,31,PAN,ALEJANDRO DE JESUS AGUIRRE CURIEL,JESUS ERNESTO MEDELES CORDOVA
14,31,PRI,ALBERTO ALCANTAR MEDELES,ENRIQUE RAMIREZ SALCEDO
14,31,PVEM,KARLA MONSERRAT GARCIA GARCIA,MARIA ISABEL RIVERA CARDENAS
14,31,PT,SOFIA SANTIAGO FLORES,EDITH RODRIGUEZ LIRA
14,31,MC,MOISES ALEJANDRO ANAYA AGUILAR,PAULO GOMEZ TORRES
14,31,MORENA,CRUZ ELIZABETH GUTIERREZ RODRIGUEZ,JULIANA JIMENEZ RENDON
14,31,PES,LILIANA GUADALUPE GARCIA CORONA,
14,31,HAGAMOS,JUAN DE DIOS GARCIA VELASCO,AARON PAUL ARRAYGA GONZALEZ
14,31,FUTURO,SOFIA MARIA ROSAS JIMENEZ,LURDES LETICIA SAUCEDO ALCALA
14,31,RSP,FERNANDO GONZALEZ CUEVAS,FERNANDO JESUS LUNA OROZCO
14,31,FM,GERARDO DEGOLLADO GONZALEZ,LUIS RAUL RAYO ACEVES
14,31,CMJD,JUAN DIEGO CASTRO MORALES,MARISSA EUGENIA URRUTIA MARTINEZ
14,31,RRF,FREDI RAYO RAZO,CARLOS ALBERTO ROSALES TIRADO
14,32,PAN,MARCOS MIGUEL BRAMASCO PALACIOS,JULIO CESAR TORRES DE LA O
14,32,PRI,SILVINO YAÑEZ LOPEZ,J GUADALUPE MACIAS MURILLO
14,32,PT,LUZ ARIANA PAZ CARRILLO,MARIA SANTOS GUTIERREZ JARA
14,32,MC,LUZ VAZQUEZ HERNANDEZ,MARIA CRUZ VAZQUEZ HERNANDEZ
14,32,MORENA,ALONSO RAMIREZ ARTEAGA,JOSE DE JESUS FAUSTO HARO
14,32,HAGAMOS,ALMA MONICA GARCIA CARRILLO,MARIA GUADALUPE BAHENA TREJO
14,32,FUTURO,AMALIA ARELLANO ALEGRIA,MARISELA ARELLANO BAUTISTA
14,33,PAN,CIPRIANA ARACELI SANTANA CORONA,PATRICIA QUINTERO MEDINA
14,33,PRI,KAREN GUADALUPE GONZALEZ GUDIÑO,ANA SOFIA LOPEZ LEON
14,33,PRD,ALBERTO REYNAGA PEREZ,IGNACIO AGUILAR BALTAZAR
14,33,MC,MARIA ELENA SANTANA MENDOZA,GUILLERMINA MEDINA PADILLA
14,33,MORENA,MA EUGENIA CASTAÑEDA ALVARADO,
14,33,HAGAMOS,ALVARO GONZALEZ ALVARADO,RODRIGO LEON PARTIDA
14,22,PAN,,MIGUEL ANGEL TORRES AGUIRRE
14,22,PRI,ELIAS EDUARDO LUNA OSUNA,EDUARDO NAVA ROMERO
14,22,PVEM,LUZ MARIA CORONA HUERTA,GABRIELA IRIS LOPEZ CABELLO RIVAS
14,22,PT,,SIHAM CARDENAS LOPEZ
14,22,MC,JORGE ELISEO SALAS CHAVEZ,JUAN DIEGO BELTRAN GUZMAN
14,22,MORENA,MA LOURDES ZAVALA CARDENAS,JUDITH RUIZ CAMACHO
14,22,HAGAMOS,APOLONIO DE JESUS PELAYO FLORES,CINTHIA BERENICE LOPEZ DE DIOS
14,22,FM,FELICIANO AGUIRRE GARCIA,TOMAS CEBALLOS SALAS
14,25,PAN,DANIEL MONTELONGO AGUAYO,LILIA BEATRIZ LOPEZ ZEPEDA
14,25,PRI,MIGUEL ANGEL IBARRA FLORES,YESSICA NOEMMI GONZALEZ LOPEZ
14,25,PT,ARNULFO TRUJILLO LOPEZ,JUAN PABLO CORONA RICO
14,25,MC,MIGUEL DE JESUS ESPARZA PARTIDA,GERMAN AGUILAR PEREZ
14,25,MORENA,JUAN CARLOS OROZCO FLORES,JUVENTINO GARCIA PIMIENTA
14,25,PES,HECTOR JESUS CASTILLO ANDRADE,OSCAR MANUEL PEREZ CAMACHO
14,25,HAGAMOS,ABELARDO RUELAS ARANDA,VICTOR HUGO HERNANDEZ ESPARZA
14,25,FM,JUAN RAMON TELLEZ NUÑO,ANDRES GUADALUPE CORONEL NUÑO
14,25,AGLA,LUIS ARMANDO ALDANA GONZALEZ,MIGUEL RAFAEL FLETES PALACIOS
14,26,PAN,OCTAVIO CORDOVA FERNANDEZ,JOSE MANUEL MIRAMONTES HUERTA
14,26,PRI,NORMA ANGELICA HUIZAR MARQUEZ,ANA CECILIA HUIZAR HUIZAR
14,26,PRD,ANA CECILIA CASAS FLORES,LORENA DIAZ VAZQUEZ
14,26,PT,FELIPE IBARRA CORNEJO,FRANCISCO JAVIER RUIZ HUIZAR
14,26,MC,JOSE JULIAN QUEZADA SANTOYO,JUAN MANUEL LOPEZ ESCOBEDO
14,26,MORENA,MANUEL VALDOVINOS ENRIQUEZ,CLAUDIO ALEJO MAYORGA
14,26,HAGAMOS,ANABEL ROBLES HERNANDEZ,SILVIA ELENA MOTA MACIAS
14,26,GCF,FRANCISCO GANDARA CARDENAS,ROMAN GUSTAVO FLORES CARRASCO
14,27,PAN,VIRGINIA ANAYA CISNEROS,MA GUADALUPE SANCHEZ ANGUIANO
14,27,PRI,JULIO CESAR CONTRERAS DIAZ,JOSE DE JESUS SOLIS MORENO
14,27,PVEM,RAUL PEÑA CHAVEZ,RAMIRO REYES LOPEZ
14,27,MC,ALEYKA DEL ROSARIO ARELLANO MADRIGAL,ESTEPHANIA GUADALUPE ALVAREZ HERRERA
14,27,MORENA,HILDA BELTRAN DELGADILLO,
14,27,PES,CESAR SALVADOR SANCHEZ NAVARRO,JOSE MANUEL GARCIA OLIVARES
14,27,HAGAMOS,TAYDE EUGENIA GUDIÑO OCEGUEDA,CRISTEL JANET BARRAGAN TORRES
14,27,FM,,JANET GUADALUPE SANCHEZ TORRES
14,28,PAN,GERARDO PALACIOS CAMPOS,ELEAZAR LORENZO ALVAREZ BARRAGAN
14,28,PRI,BULFRANO ARAIZA RODRIGUEZ,OMAR RAMON GARCIA LOERA
14,28,MC,J JESUS DELGADO CAMBEROS,EVERARDO ARAIZA GARCIA
14,28,MORENA,AURELIO SANDOVAL ELIAS,GILBERTO MONROY ROSALES
14,28,PES,ISAURA VILLALVASO HURTADO,
14,28,HAGAMOS,HORTENSIA JACOBO PADILLA,CIRIA ZARAGOZA ARIAS
14,28,FM,LUZ MARIA JIMENEZ MAGAÑA,FATIMA CRISTAL LOZA SANDOVAL
14,29,PAN,ALFONSO GOMEZ GARCIA,MIGUEL ISIDRO DE LA CRUZ RAMOS
14,29,PRI,ARACELI ALMEDA REYNAGA,ROSA MARIA ANAYA GALVAN
14,29,MC,ROCIO ANETH ZAMORA LOPEZ,LUCIA MARTINEZ PEREZ
14,29,MORENA,MARIA GUADALUPE VIDRIO AGUILAR,CECILIA VIDRIO AGUILAR
14,29,HAGAMOS,JUAN MANUEL TORRES ARREOLA,MARTIN RODRIGUEZ LOPEZ
14,30,PAN,GONZALO GONZALEZ VILLARREAL,CESAR GUADALUPE CALVILLO GOMEZ
14,30,PRI,UBALDO CHAVEZ DELGADILLO,CRESCENCIO DELGADO OLEA
14,30,PT,MA SOLEDAD GUTIERREZ MORA,MA DOLORES PONCE MERCADO
14,30,MC,NATHALIA PAOLA GONZALEZ GUTIERREZ,NORMA ARACELI OLEA RAMIREZ
14,30,MORENA,JUAN PEDRO SANDOVAL GALVAN,JOAN ALEJANDRO LOPEZ LOPEZ
14,30,PES,ANGELICA LIZBETH ESTEVEZ VILLEGAS,VERONICA MARTINEZ MARTINEZ
14,30,HAGAMOS,JUAN RAMON LUNA FERNANDEZ,MODESTO RODRIGUEZ DE ALBA
14,34,PAN,SERGIO MEDINA GARCIA,MARTIN ARTURO NEGRETE ROCHA
14,34,PRI,ANTONIO MEDINA FUENTES,CARLOS JESUS CORONADO MARQUEZ
14,34,PVEM,MAGDALENA HUARACHA SANCHEZ,MA TERESA MARTINEZ MARTINEZ
14,34,MC,ALEJANDRO GARCIA NAVARRO,ISRAEL GUZMAN GARCIA
14,34,MORENA,INDIRA TORRES GILES,JESSICA CERVANTES CAZAREZ
14,34,HAGAMOS,RICARDO ZARAGOZA LEON,MARIA ELENA VALADEZ COBIAN
14,35,PAN,GUILLERMO GARCIA GONZALEZ,BERTHA ALICIA SANTANA ALVAREZ
14,35,PRI,MARIA DE JESUS GOMEZ DIAZ,MARIA DEL ROCIO MONTERROZA RODRIGUEZ
14,35,MC,MARIA CRISTINA MICHEL URIBE,ANA GABRIELA CORTES ALVAREZ
14,35,MORENA,GABRIEL RAMIREZ SANTANA,OSCAR RUBEN PONCE ROMO
14,35,HAGAMOS,FRANCISCO JAVIER PEREZ RAMIREZ,MA ADILENE GONZALEZ SANTANA
14,9,PAN,JOSE DE JESUS GERARDO GONZALEZ MEJIA,ARTURO JAVIER GOMEZ MARTINEZ
14,9,PRI,PILAR GUADALUPE ROJO GONZALEZ,JESSICA JAZMIN SANCHEZ GUTIERREZ
14,9,PVEM,OLIMPIA DUEÑAS GONZALEZ,
14,9,PT,ROBERTO SANDOVAL RUIZ,DAVID MEZA PALOMARES
14,9,MC,ELVIA DEL CARMEN TORRES MEDINA,YESICA MARIANA VAZQUEZ CASTAÑEDA
14,9,MORENA,MARIA TERESA MEDINA LOZANO,SILVIA ALCANTAR RUIZ
14,9,SOMOS,ERIKA ELIZABETH MARISCAL ROSALES,ROSA NUÑEZ COLMENARES
14,9,HAGAMOS,JORGE MARTIN CAMARENA BALTAZAR,JORGE ARTURO MERCADO LOPEZ
14,9,FUTURO,LEOBARDO PADILLA MIRANDA,SERGIO OROZCO LOPEZ
14,9,FM,ALEJANDRO ROMERO SERNA,JOSE MIGUEL RUIZ GUTIERREZ
14,39,PAN,DELIA PEÑA ZAMORA,KAREN GETZABEL AVILA LOPEZ
14,39,PRI,EURISE JAZMIN GONZALEZ GONZALEZ,GEMMA GRISEL LEAL SANTANA
14,39,PT,SANDRA TORRES CHAVEZ,
14,39,MC,MILTON CARLOS CARDENAS OSORIO,IGNACIO TELLO FIGUEROA
14,39,MORENA,SALVADOR VILLANUEVA BAUTISTA,
14,39,PES,OSCAR JIMENEZ VARGAS,JOSE PRECIADO QUINTERO
14,39,HAGAMOS,ALEJANDRO ZAMORA OSORIO,MOISES NUÑEZ SANCHEZ
14,39,RSP,PABLO GOMEZ ALCALA,JUAN PEDRO PEREZ MURILLO
14,39,FM,,
14,56,PAN,RAUL LOPEZ MORENO,HUGO GONZALEZ COVARRUBIAS
14,56,PRI,SOFIA JIMENEZ TRUJILLO,MARIA DEL ROSARIO RAMIREZ RODRIGUEZ
14,56,PRD,MARTINA LIZZETH SUAREZ COBIAN,ANA PATRICIA SANTANA ACOSTA
14,56,PVEM,ERIC RAFAEL CAMACHO ZAMORA,FRANCISCO SANCHEZ RAMOS
14,56,MC,EVELIA PATRICIA BAUTISTA PLAZOLA,HERMINIA GUADALUPE GUZMAN GRAJEDA
14,56,MORENA,NELSON GONZALEZ FIGUEROA,MANUEL HERNANDEZ CAMACHO
14,56,PES,EVANGELINA FLORES LARIOS,IMELDA VAZQUEZ HERNANDEZ
14,56,HAGAMOS,MARIA DE LA LUZ LOPEZ RAMOS,ROSA ARAIZA PEREZ
14,72,PAN,ADRIAN ALEJANDRO FLORES VELEZ,SAMUEL SUAREZ OCEGUEDA
14,72,PRI,JOEL GONZALEZ DIAZ,EDGAR ANTONIO AVILA LOPEZ
14,72,PRD,DIEGO HERNANDEZ SEPULVEDA,EDGAR ADRIAN LOZADA HERNANDEZ
14,72,PVEM,DEISY ADRIANA ARANA IÑIGUEZ,ROSA ISELA CORTES RICO
14,72,PT,CAROLINA ROMUALDO RAMIREZ,LETICIA MORA LOMELI
14,72,MC,RICARDO ZAID SANTILLAN CORTES,JOHNNIE GARCIA LOPEZ
14,72,MORENA,MA ELENA FARIAS VILLAFAN,MIREYA RIVERA DIAZ
14,72,PES,ERIC OLIVEROS ORTEGA,MANUEL ALEJANDRO JIMENEZ GONZALEZ
14,72,HAGAMOS,JOSE ANTONIO PEREZ PEREZ,ALAN JULIAN MAGAÑA ALMARAL
14,72,FUTURO,FRANCISCO JAVIER RODRIGUEZ GONZALEZ,ALMA ROSA GUTIERREZ GARCIA
14,72,RSP,CHRISTIAN FERNANDO LOPEZ CABELLO,ALONDRA CALVILLO MEDINA
14,72,FM,ARACELI OROZCO LOPEZ,LUCINA CONTRERAS MENA
14,36,PAN,LEOBARDO ROMO CORNEJO,JOSE ALBERTO ROMO ALMANZA
14,36,PRI,JESUS ALBERTO PEREZ ARIAS,JUAN LUIS BERMEJO CHAVEZ
14,36,MC,JOSE DE JESUS VILLALOBOS CERVANTES,CESAR LOPEZ VILLALOBOS
14,36,MORENA,GILBERTO ANTONIO PALOMAR GONZALEZ,SOCORRO SERRANO DIAZ
14,36,PES,J GUADALUPE LOZANO CORNEJO,LUIS ALEJANDRO PARADA ANGEL
14,36,HAGAMOS,NORMA JANETT ALDANA DAVILA,CLAUDIA MARIA MARTINEZ ALVAREZ
14,36,FUTURO,CRISTIAN PEDROZA ALBA,EDMUNDO GARCIA SILVA
14,37,PAN,FRANCISCO JAVIER BERNAL OCHOA,HECTOR CARLOS MARISCAL MORALES
14,37,PRI,FRANCISCO JAVIER VALDERRAMA PINEDA,MARIA GUADALUPE GUTIERREZ RAMIREZ
14,37,PVEM,ARACELI BELEN TOPETE CORTEZ,MARIA DE JESUS TOPETE CORTES
14,37,MC,MARIO CAMARENA GONZALEZ RUBIO,JOSE GUADALUPE HERNANDEZ LOPEZ
14,37,MORENA,OSCAR ALEJANDRO BERNAL GARCIA,MIGUEL ANGEL AGUILA RAMOS
14,37,HAGAMOS,DULCE MARIA SALGADO ROMERO,BRENDA YADIRA VELEZ SIORDIA
14,37,FUTURO,KERMIA SAGRARIO CHAVARIN ESPINOZA,CINTHYA AURORA RODRIGUEZ REYES
14,38,PAN,ROCIO CARINA LEON MARTINEZ,GABRIELA HERNANDEZ CANO
14,38,PRI,MARIA DE JESUS SANCHEZ CHAVEZ,AZUCENA ARANZASU RAFAEL RENDON
14,38,PT,MARIA DEL SOCORRO FERMIN BERNABE,BEATRIZ IRENE SANTOS LUGO
14,38,MC,NESTOR EMMANUEL DE LA CRUZ MACIAS,JOSE VENANCIO BENITO
14,38,MORENA,SILVIA HERRERA ARIAS,CARMEN IGNACIO MEJIA
14,38,HAGAMOS,ARIANA BARAJAS GALVEZ,ISABEL GONZALEZ ROJAS
14,40,PAN,MARIA DE JESUS ANAYA ESTRADA,FRANCISCA MARTINEZ ALVAREZ
14,40,PRI,GENOVEVA CORTES CURIEL,
14,40,PT,LUIS FRANCISCO ARREOLA VELASCO,ALFONSO DUEÑAS VARGAS
14,40,MC,ILDA ANGEL GONZALEZ,SUSANA CASTILLO OLMOS
14,40,MORENA,BERNAL TOPETE YBARRA,ARIANA DUEÑAS ROBLES
14,40,HAGAMOS,FELICIANO CASTRO LOPEZ,JOSE MARIA CARO CASTILLO
14,40,FUTURO,JOSE ANTONIO HERNANDEZ DUEÑAS,MARTIN RAFAEL AGUILAR SANTIAGO
14,41,PAN,FERNANDO GARZA MARTINEZ,CECILIA CARREON CHAVEZ
14,41,PRI,SOFIA BERENICE GARCIA MOSQUEDA,ALMA GUADALUPE SALAS MONTIEL
14,41,PRD,GERARDO LEON DE LA CRUZ,EVERARDO GALVAN MAGDALENO
14,41,PVEM,OFELIA GAMBOA NORIEGA,GLORIA PATRICIA RIVAS MACIEL
14,41,PT,YOMARA PAOLA GONZALEZ LEMUS,ROSAURA VILLALOBOS ALVARADO
14,41,MC,JESUS PABLO LEMUS NAVARRO,ROBERTO DELGADILLO GONZALEZ
14,41,MORENA,CARLOS LOMELI BOLAÑOS,SERGIO MIGUEL MARTIN COVARRUBIAS
14,41,SOMOS,DIANA PALACIOS SOLORZANO,MARIA DEL PILAR LARIOS CHAVARIN
14,41,PES,XOCHITL ELIZABETH VAZQUEZ MEDEL,MAGALI BERENICE GARCIA GOMEZ
14,41,HAGAMOS,ITZCOATL TONATIUH BRAVO PADILLA,ERNESTO VILLARRUEL ALVARADO
14,41,FUTURO,DOLORES EUGENIA PEREZ LAZCARRO,MARIA INES PARTIDA ROBLES
14,41,RSP,KARLA VIRIDIANA NATHALY RIVAS CASTILLO,ANA PAULINA TORRES GARZA
14,41,FM,GUSTAVO ADOLFO FLORES DELGADILLO,JOSE RAMON JASSO MENDEZ
14,41,CNJF,JOSE FRANCISCO CASTILLO NAVARRO,CLAUDIA IVONNE VILLARREAL MURGUIA
14,42,PAN,TERESA DE JESUS GONZALEZ CARMONA,GLORIA GONZALEZ GUTIERREZ
14,42,PRI,MARGARITA CAMACHO RODRIGUEZ,LIZBETH ANTONIA OROZCO AVILA
14,42,PVEM,LUIS ALBERTO CAMACHO FLORES,OCTAVIO ZUÑIGA AYALA
14,42,MC,ILIANA CRISTINA ESPARZA RIOS,ANA ROSA NAVARRO BECERRA
14,42,MORENA,VIOLETA LIZETTE TOPETE ESPARZA,LORENA COVARRUBIAS RODRIGUEZ
14,42,PES,RAFAEL RODRIGUEZ GOMEZ,LEONARDO GARCIA ROJAS
14,42,HAGAMOS,LUIS ANTONIO LEON RUIZ,JULIO CONRADO RIVERA VALDEZ
14,43,PAN,SALVADOR ACOSTA LEDEZMA,JUAN CARLOS BAÑUELOS FIERROS
14,43,PRI,HILDA DIAZ DE SANTIAGO,MARITZA VALENZUELA ULLOA
14,43,MC,ARCELIA DIAZ MARQUEZ,BLANCA ANGELICA MURO GOMEZ
14,43,MORENA,CLAUDIA PATRICIA BIBIANO LOPEZ,MARICELA RAMIREZ MIRANDA
14,43,HAGAMOS,BLANCA LETICIA LANDEROS GALVAN,LORENA QUIÑONEZ RAMOS
14,43,FM,HEROLINDA FLORES DIAZ,NOEMI GALVAN DE LA TORRE
14,44,PAN,SAUL MUÑOZ ORTIZ,MIGUEL VALDEZ GRACIANO
14,44,PRI,GLORIA ELENA MORENO MUÑOZ,DANIELA NALLELI PACHECO CAMPOS
14,44,MC,CARINA REYES RODRIGUEZ,ELSA MARIA SAUCEDO ORTIZ
14,44,MORENA,CARINA MUÑIZ GUARDADO,MA DE JESUS RAMIREZ GALICIA
14,44,HAGAMOS,FABIOLA CESARIA CRUZ ELIAS,MAYRA REBECA MENDOZA HERNANDEZ
14,46,PAN,JOSE RODRIGO GARCIA ZARAGOZA,ANTONIO MARIN GONZALEZ
14,46,PRI,JOSE HERIBERTO GARCIA MURILLO,MARTHA ALICIA GONZALEZ MEDINA
14,46,PRD,JOSE LUIS MARISCAL PERALTA,IGNACIO JAIR VAZQUEZ VILLALOBOS
14,46,PVEM,CECILIA YADIRA ZUÑIGA BERNARDO,MA CONSUELO BERNARDO DELGADILLO
14,46,PT,MARA ORNELA MARTINEZ CONTRERAS,IVON TOVAR TALAVERA
14,46,MC,OTILIA DIAZ ENCISO,SANDRA PEREZ GARCIA
14,46,MORENA,REYMUNDO ROMO GARCIA,JESUS CERVANTES CERVANTES
14,46,PES,SILVIA NIÑO RAMIREZ,NORMA ANGELICA MUÑOZ GONZALEZ
14,46,HAGAMOS,BERENICE FLORES BARAJAS,SILVIA VALDIVIA VILLANUEVA
14,46,FUTURO,JANET GONZALEZ RUBIO ALCARAZ,YOLIA DARINKA SEDANO OROZCO
14,46,FM,ERICK ALBERTO DUARTE MOLINA,NUBIA ANALI VELAZQUEZ GONZALEZ
14,47,PAN,LIDIA ALEJANDRA GUTIERREZ PONCE,ROSA CINTHIA ORTA GARCIA
14,47,PRI,ALBERTO SUAREZ CERVANTES,MA GUADALUPE GONZALEZ MERCADO
14,47,PVEM,JUAN DIEGO GODOY JACINTO,
14,47,PT,HECTOR MARTINEZ CAMACHO,RAMIRO MACIAS ORNELAS
14,47,MC,PEDRO HARO OCAMPO,MANUEL DIAZ GUTIERREZ
14,47,MORENA,LEONCIO GUZMAN GONZALEZ,CARLOS LOPEZ BARCENAS
14,47,PES,ALONDRA YARAZETH MORA GARCIA,ALMA ROSA MORA GARCIA
14,47,HAGAMOS,J JESUS MEJIA SANCHEZ,RICARDO GOMEZ SANCHEZ
14,47,FM,JESSICA GONZALEZ ORTIZ,LILIANA REYNOSO CARBAJAL
14,48,PAN,ARCELIA PEREZ MARTIN,FATIMA GUADALUPE REYNOSO REYNOSO
14,48,PRI,JOSE ALVAREZ CAMPOS,RODRIGO MARTINEZ REYNOSO
14,48,MC,ALEJANDRO ROMO RODRIGUEZ,J JESUS PRECIADO ORNELAS
14,48,MORENA,HORACIO ARIAS HERNANDEZ,EDWIN GUADALUPE ROMO TOSTADO
14,48,PES,MARCO ANTONIO DOMINGUEZ JIMENEZ,ROBERTO CARLOS RUIZ DE LA CRUZ
14,48,HAGAMOS,ALEJANDRA CERVANTES RAMOS,
14,48,RSP,MARIA FERNANDA ZARZA VALENZUELA,TERESITA DE JESUS MUÑOZ RAMIREZ
14,49,PAN,SALVADOR JIMENEZ RODRIGUEZ,JOSE LOPEZ CAMARENA
14,49,PRI,MARIA DE LOS ANGELES JIMENEZ LOPEZ,LETICIA ARIZAGA GONZALEZ
14,49,PT,KATY LILIANA JIMENEZ SALGADO,SILVIA KARINA CEJA NUÑO
14,49,MC,CESAR CELESTINO MOLINA SAHAGUN,JESUS CARMONA ZARAGOZA
14,49,MORENA,GABRIEL VELASCO GONZALEZ,ROGELIO ORTEGA VELASCO
14,49,PES,IGNACIO GODINEZ RODRIGUEZ,
14,49,HAGAMOS,EDUARDO HERNANDEZ GODINEZ,DIEGO ROMO MACIAS
14,49,FUTURO,GLORIA JIMENEZ LOPEZ,MARTHA JIMENEZ LOPEZ
14,50,PAN,RICARDO IVAN GONZALEZ GARCIA,MARIA LUCIA LEON OÑATE
14,50,PRI,ESMERALDA HERNANDEZ AGUIRRE,MARIBEL RIZO LOPEZ
14,50,MC,VERONICA SELENE MARTINEZ BERMUDEZ,SONIA ALEJANDRA PADILLA MAGAÑA
14,50,MORENA,VERONICA HERRERA MENDEZ,
14,50,PES,MARIA TERESA DE JESUS FUENTES MARQUEZ,VERONICA RIZO ALVAREZ
14,50,HAGAMOS,LUIS ALBERTO LOPEZ LOPEZ,FERNANDO OROZCO ZARATE
14,50,RSP,GABRIELA NATALIE ANGEL AGUIRRE,MONTSERRAT GUADALUPE LOPEZ CABRERA
14,50,FM,VERONICA GUADALUPE GUZMAN RAMIREZ,KARLA MARIANA CRUZ CORONADO
14,51,PAN,,MA ISABEL CARDENAS ALCARAZ
14,51,MC,,
14,51,MORENA,JOSE MANUEL CARDENAS FLORES,GERARDO CHAVEZ RAMOS
14,52,PAN,JOSE MANUEL SALCEDO OREGEL,ABEL RIVERA GUZMAN
14,52,PRI,ROSALVA MEJIA COVARRUBIAS,DULCE KAREN RUIZ SALCEDO
14,52,PVEM,JOSE MANUEL HARO CHACON,MOISES ANTONIO GONZALEZ PEREZ
14,52,PT,JOSE LUIS GAYTAN AGUAYO,JOSE SANTANA GONZALEZ AVALOS
14,52,MC,JOSE MIGUEL GOMEZ LOPEZ,ALBERTO OLMEDO CONTRERAS
14,52,MORENA,JOSE LUIS LEDEZMA ALMEIDA,JAIME GUZMAN JIMENEZ
14,52,HAGAMOS,MARIA DE LOURDES ALVAREZ CERNA,ANA ROCIO JIMENEZ IBARRA
14,52,FUTURO,HUGO DAVID GARCIA VARGAS,OCTAVIO HERNANDEZ CAZAREZ
14,52,RSP,FATIMA GUADALUPE RAMIREZ ROBLEDO,CELIA ESMERALDA MENDOZA SOLIS
14,52,FM,JAVIER PEREZ CAMPOS,ELSA GUADALUPE ARIAS JARA
14,53,PAN,FRANCISCO DE LA CERDA SUAREZ,ADRIAN MALDONADO ZAVALA
14,53,PRI,BLANCA ESTELA NAVARRO MALDONADO,ORALIA GARCIA MURGUIA
14,53,PRD,RODOLFO RAMIREZ FLORES,JOSE DE JESUS RAMIREZ JIMENEZ
14,53,PVEM,BELEN ABIGAIL ESTRADA MALDONADO,BEATRIZ VALDIVIA GARCIA
14,53,PT,ANA ROSA VERGARA ANGEL,MA SAGRARIO LARA HERNANDEZ
14,53,MC,SUSANA MELENDEZ VELAZQUEZ,PATRICIA VILLALOBOS JAUREGUI
14,53,MORENA,GLEIDY ISABEL MARQUEZ MEZA,ERIKA KARINA BALDERAS CARRILLO
14,53,HAGAMOS,ANGELICA ANYTSIRC BARBA MORENO,
14,53,FUTURO,ADRIANA CERVANTES LOPEZ,DIANA KARINA ALVAREZ GONZALEZ
14,53,FM,NAYELI BERENICE GONZALEZ BECERRA,
14,54,PAN,DALIA AZUCENA PRECIADO LEON,MARIA GUADALUPE BERNABE PRECIADO
14,54,PRI,SOCORRO AGUILAR RIOS,ALMA ELIZABETH ALCALA ARREGUIN
14,54,PVEM,CECILIA PATRICIA FLORES RENTERIA,MARIA AMALIA JARA LOMELI
14,54,MC,NORMA PATRICIA RANGEL LOPEZ,SARA GONZALEZ DIAZ
14,54,MORENA,JORGE ANTONIO FLETES FLETES,
14,54,SOMOS,RICARDO RANGEL FLETES,FERNANDO HERNANDEZ PRECIADO
14,54,HAGAMOS,FRANKLIN ALEXANDER MONTOYA MEJIA,JUAN MANUEL VILLALPANDO RODRIGUEZ
14,18,PAN,REYNALDO ALFARO MORALEZ,EDUARDO VEGA BARAJAS
14,18,PRI,RICARDO HERNANDEZ BECERRA,MIGUEL BARAJAS FLORES
14,18,PVEM,RODOLFO MONTAÑO BAROCIO,JUAN CARLOS GARCIA AGUIRRE
14,18,PT,JUAN GARCIA NAVARRO,CARLOS GONZALEZ SANTIAGO
