ord,part.elec,part.origen,edo,lista,propietario,suplente,dmujer,drp,nota
31,indep,indep,bcs,1,LORENZO RICARDO GARCIA DE LEON CORIA,MARTIN SERRANO GARCIA,0,0,
32,indep,indep,bcs,2,JESUS GUADALUPE OJEDA ALVARADO,MAYRA ARACELY GUEVARA SALGADO,1,0,
57,indep,indep,cps,1,PABLO ABNER SALAZAR MENDIGUCHIA,GABRIEL FERNANDO MONTOLLA OSEGUERA,0,0,
58,indep,indep,cps,2,KAROLYN CORZO ORNELAS,CARMEN HERNANDEZ BIELMA,1,0,
105,indep,indep,gue,1,SOLEDAD ROMERO ESPINAL,NANCY ROMERO RIVERA,1,0,
106,indep,indep,gue,2,JOSE GUADALUPE HERNANDEZ VIEYRA,NAHUM GARCIA CASTRO,0,0,
125,indep,indep,jal,1,JOSE PEDRO KUMAMOTO AGUILAR,CLAUDIA ANGELICA RAMIREZ RAMOS,1,0,
126,indep,indep,jal,2,JUANA ADELFA DELGADO QUINTANA,CINTHIA GABRIELA RAMIREZ FERNANDEZ,1,0,
177,indep,indep,nl,1,RAUL GONZALEZ RODRIGUEZ,JAVIER NAÑEZ PRO,0,0,
178,indep,indep,nl,2,MONICA GRICELDA GARZA CANDIA,ROSA MARIA ADAM TOVAR,1,0,
223,indep,indep,sin,1,MANUEL JESUS CLOUTHIER CARRILLO,JOSE MIGUEL TANIYAMA CEBALLOS,0,0,
224,indep,indep,sin,2,MARIA GUADALUPE SALDAÑA GARCIA,SOLANGEL SEDANO FIERRO,1,0,
257,indep,indep,tla,1,OBED JAVIER CRUZ PEREZ,MIGUEL LEZAMA DELGADO,0,0,
258,indep,indep,tla,2,VIANEY GOMEZ MORALES,ALMA PEREZ XOCHIPA,1,0,
149,mc,mc,mor,1,JESSICA MARIA GUADALUPE ORTEGA DE LA CRUZ JESSICA ORTEGA,MIRELLE VIRIDIANA MARTINEZ MARTINEZ,1,0,
150,mc,mc,mor,2,JOSE ALVAREZ ICAZA LONGORIA,ALEJANDRO MARROQUIN BASAVE,0,0,
171,mc,mc,nl,1,SAMUEL ALEJANDRO GARCIA SEPULVEDA,LUIS DAVID ORTIZ SALINAS,0,0,
172,mc,mc,nl,2,INDIRA KEMPIS MARTINEZ,MARCELA LUQUE RANGEL,1,0,
437,mc,,rp,1,DORA PATRICIA MERCADO CASTRO,JESSICA MARIA GUADALUPE ORTEGA DE LA CRUZ,1,1,
438,mc,,rp,2,DANTE ALFONSO DELGADO RANNAURO,SAMUEL ALEJANDRO GARCIA SEPULVEDA,0,1,
439,mc,,rp,3,MARIA ELENA ORANTES LOPEZ,VERONICA DELGADILLO GARCIA,1,1,
440,mc,,rp,4,ALEJANDRO CHANONA BURGUETE,JUAN IGNACIO SAMPERIO MONTAÑO,0,1,
441,mc,,rp,5,VANIA ROXANA AVILA GARCIA,NANCY YAEL LANDA GUERRERO,1,1,
442,mc,,rp,6,JESUS CUAUHTEMOC VELASCO OLIVA,JORGE BASTIDA RODRIGUEZ,0,1,
443,mc,,rp,7,MAGALY FREGOSO ORTIZ,NIKOL CARMEN RODRIGUEZ DE L´ORME,1,1,
444,mc,,rp,8,JOSE FRANCISCO MELO VELAZQUEZ,ALBERTO TLAXCALTECO HERNANDEZ,0,1,
445,mc,,rp,9,MARIA ELENA ABAROA LOPEZ,MITZI AVILES OSUNA,1,1,
446,mc,,rp,10,MARIO ALBERTO ZUBIETA LOPEZ,FRANCISCO JAVIER MARTINEZ HERNANDEZ,0,1,
447,mc,,rp,11,IRMA BEATRIZ MACIAS CAMACHO,VIRGINIA LUNA OLVERA,1,1,
448,mc,,rp,12,MIGUEL ERNESTO NEGRETE DE ALBA,ALFONSO REGINO ELORRIAGA GONZALEZ,0,1,
449,mc,,rp,13,LILYANA BARAJAS RIVAS,NALLELY GUEVARA ROMO,1,1,
450,mc,,rp,14,JUAN MIGUEL CASTILLO LARA,ALFREDO CUAUHTEMOC MUÑIZ ORTIZ,0,1,
451,mc,,rp,15,REBECA ROMERO BERRUECOS,YENI FLORES BERRUECOS,1,1,
452,mc,,rp,16,MARCOS CABALLERO MUÑOZ,JOSUE JARAMILLO BURIAN,0,1,
453,mc,,rp,17,DORA YAJAIRA DURAN GOMEZ,DORA AMELIA GUTIERREZ RODRIGUEZ,1,1,
454,mc,,rp,18,PEDRO ANTONIO CARBAJAL TERAN,MARCO ANTONIO VILLARREAL HERRERA,0,1,
455,mc,,rp,19,GUSHENKA KAREN GALLEGOS SALAZAR,MARCELINA CARRILLO MORENO,1,1,
456,mc,,rp,20,LEOBARDO ORTIZ FUENTES,LUIS ALBERTO BRISEÑO MORALES,0,1,
457,mc,,rp,21,ANGELICA ROSALIA CARDENAS SILVA,NADIA JACQUELINE CABRERA LOMELI,1,1,
458,mc,,rp,22,EDMOND ASSAD BOJALIL ZACARIAS,VICTOR HUGO ALCANTARA SUAREZ,0,1,
459,mc,,rp,23,BLANCA ELIZABETH PARRA PEREA,MIRTHA ROCIO MORENO AGUILAR,1,1,
460,mc,,rp,24,JAVIER GARCIA CORDOVA,LUIS ROBERTO HURTADO CHAVEZ,0,1,
461,mc,,rp,25,IRMA YOLANDA LOPEZ VELAZQUEZ,MARIA MAGDALENA SEVILLA SERNA,1,1,
462,mc,,rp,26,FERNANDO DE JESUS BARAJAS DOCTOR,JORGE LUIS OCHOA CRESPO,0,1,
463,mc,,rp,27,ISIS STEPHANIE HERNANDEZ REYES,PAOLA JACQUELINE HERNANDEZ REYES,1,1,
464,mc,,rp,28,JORGE ALBERTO ANGULO GARCIA,CARLOS MANUEL CICERO RIVERA,0,1,
465,mc,,rp,29,IRMA WENDOLIN ESTRADA ALFARO,ALICIA CORTES MERCADO,1,1,
466,mc,,rp,30,HERMINIO FERNANDO CHANONA PEREZ,JESUS AURELIO NAVA DECTOR,0,1,
467,mc,,rp,31,BERTHA ALICIA SANCHEZ LARA,LAURA ELENA FERNANDEZ CARO,1,1,
468,mc,,rp,32,FRANCISCO ZAVALA CARMONA,JAVIER AVILA SANCHEZ,0,1,
113,morena,morena,hgo,1,ANGELICA GARCIA ARRIETA,MARIA MERCED GONZALEZ GONZALEZ,1,0,
114,morena,morena,hgo,2,JULIO RAMON MENCHACA SALAZAR,ANDRES VELAZQUEZ VAZQUEZ,0,0,
501,morena,,rp,1,BLANCA ESTELA PIÑA GUDIÑO,ANTARES GUADALUPE VAZQUEZ ALATORRE,1,1,
502,morena,,rp,2,ANIBAL OSTOA ORTEGA,HECTOR ENRIQUE VASCONCELOS Y CRUZ,0,1,
503,morena,,rp,3,OLGA MARIA DEL CARMEN SANCHEZ CORDERO DAVILA,LAURA MARIA DE JESUS RODRIGUEZ RAMIREZ,1,1,
504,morena,,rp,4,RICARDO MONREAL AVILA,ALEJANDRO ROJAS DIAZ DURAN,0,1,
505,morena,,rp,5,IFIGENIA MARTHA MARTINEZ Y HERNANDEZ,BERTHA ELENA LUJAN URANGA,1,1,
506,morena,,rp,6,NAPOLEÓN GÓMEZ URRUTIA,CANDELARIO PEREZ ALVARADO,0,1,
507,morena,,rp,7,FREYDA MARYBEL VILLEGAS CANCHE,ELVIA MARCELA MORA ARELLANO,1,1,
508,morena,,rp,8,GERMAN MARTINEZ CAZARES,PEDRO MIGUEL HACES BARBA,0,1,
509,morena,,rp,9,NESTORA SALGADO GARCÍA,KATYA ELIZABETH AVILA VAZQUEZ,1,1,
510,morena,,rp,10,JOSE ANTONIO CRUZ ALVAREZ LIMA,JOSE LUIS DE ANDA RAMIREZ,0,1,
511,morena,,rp,11,IMELDA CASTRO CASTRO,EUNICE RENATA ROMO MOLINA,1,1,
512,morena,,rp,12,CASIMIRO MENDEZ ORTIZ,ROBERTO PANTOJA ARZOLA,0,1,
513,morena,,rp,13,CLAUDIA ESTHER BALDERAS ESPINOZA,TANYA CAROLA VIVEROS CHAZARO,1,1,
514,morena,,rp,14,GABRIEL GARCIA HERNANDEZ,JOSE ALEJANDRO PEÑA VILLA,0,1,
515,morena,,rp,15,SANTA AGUSTINA AGUILAR CASTILLO,LUZ MARINA MORALES BUSTAMANTE,1,1,
516,morena,,rp,16,OMAR HOLGUIN FRANCO,JOSE APOLONIO ALBAVERA VELAZQUEZ,0,1,
517,morena,,rp,17,GRACIELA ARGUETA BELLO,MARIA EUGENIA GONZALEZ CABALLERO,1,1,
518,morena,,rp,18,JOSE RANULFO ESQUINCA KOBEH,ALBERTO CUNDAPI NUÑEZ,0,1,
519,morena,,rp,19,MARTHA BEATRIZ ASID GAYTAN,KARLA ANDREA ROJAS NAVARRETE,1,1,
520,morena,,rp,20,RAFAEL MUÑOZ GOMEZ,JOSE ANGEL HERNANDEZ PUENTE,0,1,
521,morena,,rp,21,YANETH NAMBO CADEZA,CAROLINA PEÑALOZA ZARATE,1,1,
522,morena,,rp,22,JULIO VINICIO LARA MENDOZA,CARLOS PEÑAFIEL SOTO,0,1,
523,morena,,rp,23,LUCRECIA VAZQUEZ DE LA ROSA,MARGARITA MONTES VILLALVA,1,1,
524,morena,,rp,24,HECTOR FERNANDO DE LA GARZA BARROSO,FERNANDO HUMBERTO COELLO PEDRERO,0,1,
525,morena,,rp,25,ADELA MORALES CRUZ,ERIKA DEL ROCIO CORPUS ESCOBEDO,1,1,
526,morena,,rp,26,JOSE JACQUES Y MEDINA,CARLOS SOTO DAVILA,0,1,
527,morena,,rp,27,LAURA AURORA ESTRADA CUELLAR,OLINALZIN TABITHA GARCIA RODRIGUEZ,1,1,
528,morena,,rp,28,NAYAR MAYORQUIN CARRILLO,HUGO ALBERTO RODRIGUEZ MURRAY,0,1,
529,morena,,rp,29,MARTHA ELENA ARIAS GONZALEZ,KARINA ROCIO GONZALEZ LUNA,1,1,
530,morena,,rp,30,JAIME MIGUEL CASTAÑEDA SALAS,CARLOS ALBERTO ESTRADA MEJIA,0,1,
531,morena,,rp,31,GEMA DEL CARMEN CORTES HERNANDEZ,NOHEMI VERONICA BERAUD OSORIO,1,1,
532,morena,,rp,32,ISRAEL FLORES HERNANDEZ,MANUEL LARA TOLEDO,0,1,
9,morena-pt-pes,morena,ags,1,DANIEL GUTIERREZ CASTORENA,ALEJANDRO PONCE LARRINUA,0,0,
10,morena-pt-pes,morena,ags,2,MA. GUADALUPE MARTINEZ VAZQUEZ,ANGELICA SAUCEDO BOSQUEZ,1,0,
19,morena-pt-pes,morena,bc,1,JAIME BONILLA VALDEZ,GILBERTO HERRERA SOLORZANO,0,0,
20,morena-pt-pes,pes,bc,2,ALEJANDRA DEL CARMEN LEON GASTELUM,CLAUDIA HERRERA RODRIGUEZ,1,0,
29,morena-pt-pes,morena,bcs,1,VICTOR MANUEL CASTRO COSIO,RICARDO VELAZQUEZ MEZA,0,0,
30,morena-pt-pes,morena,bcs,2,JESUS LUCIA TRASVIÑA WALDENRATH,MONICA TREVIZO VASQUEZ,1,0,
37,morena-pt-pes,pes,cam,1,ANIBAL OSTOA ORTEGA,ARTURO DEL CARMEN MOO CAHUICH,0,0,
38,morena-pt-pes,morena,cam,2,CECILIA MARGARITA SANCHEZ GARCIA,LIDA RUIZ HERNANDEZ,1,0,
43,morena-pt-pes,morena,coa,1,SANTANA ARMANDO GUADIANA TIJERINA,REYES FLORES HURTADO,0,0,
44,morena-pt-pes,morena,coa,2,EVA EUGENIA GALAZ CALETTI EVA GALAZ,MONICA MONTERO CUELLAR,1,0,
49,morena-pt-pes,pt,col,1,JOEL PADILLA PEÑA,EDUARDO GUIA VELAZQUEZ,0,0,
50,morena-pt-pes,morena,col,2,GRICELDA VALENCIA DE LA MORA,ANA MARIA CONTRERAS RUIZ,1,0,
55,morena-pt-pes,morena,cps,1,OSCAR EDUARDO RAMIREZ AGUILAR,JOSE ANTONIO AGUILAR CASTILLEJOS,0,0,
56,morena-pt-pes,pes,cps,2,SASIL DORA LUZ DE LEON VILLARD,MARIA ISABEL RODRIGUEZ JIMENEZ,1,0,
67,morena-pt-pes,morena,cua,1,BERTHA ALICIA CARAVEO CAMARENA,FLOR PILAR CAZARES HOLGUIN,1,0,
68,morena-pt-pes,morena,cua,2,CRUZ PEREZ CUELLAR,RAFAEL ESPINO DE LA PEÑA,0,0,
77,morena-pt-pes,morena,df,1,MARTI BATRES GUADARRAMA,CESAR ARNULFO CRAVIOTO ROMERO,0,0,
78,morena-pt-pes,morena,df,2,MINERVA CITLALLI HERNANDEZ MORA,MARIA CELESTE SANCHEZ SUGIA,1,0,
87,morena-pt-pes,pt,dgo,1,ALEJANDRO GONZALEZ YAÑEZ GONZALO YAÑEZ,MIGUEL ANGEL LUCERO OLIVAS,0,0,
88,morena-pt-pes,pt,dgo,2,LILIA MARGARITA VALDEZ MARTINEZ,MARIA DE LA LUZ RICO RODRIGUEZ,1,0,
97,morena-pt-pes,morena,gua,1,MARTHA LUCIA MICHER CAMARENA,ROSMILDA SALINAS CASTILLA,1,0,
98,morena-pt-pes,morena,gua,2,CUAUHTEMOC BECERRA GONZALEZ,JUAN FRANCISCO HERNANDEZ RAMOS,0,0,
103,morena-pt-pes,morena,gue,1,J. FELIX SALGADO MACEDONIO,SAUL LOPEZ SOLLANO,0,0,
104,morena-pt-pes,pes,gue,2,NESTORA SALGADO GARCÍA,FELICITAS MARTINEZ SOLANO,1,0,
123,morena-pt-pes,pes,jal,1,MARIA ANTONIA CARDENAS MARISCAL,ELISA ILEANA DE ROBLES RAMIREZ,1,0,
124,morena-pt-pes,morena,jal,2,ANTONIO PEREZ GARIBAY,CARLOS ARROYO ALZAGA,0,0,
131,morena-pt-pes,morena,mex,1,DELFINA GOMEZ ALVAREZ,MARTHA GUERRERO SANCHEZ,1,0,
132,morena-pt-pes,morena,mex,2,HIGINIO MARTINEZ MIRANDA,RICARDO MORENO BASTIDA,0,0,
141,morena-pt-pes,morena,mic,1,BLANCA ESTELA PIÑA GUDIÑO,GRACIELA CARMINA ANDRADE GARCIA PELAEZ,1,0,
142,morena-pt-pes,morena,mic,2,CRISTOBAL ARIAS SOLIS,JOSE ALFONSO PASCUAL SOLORZANO FRAGA,0,0,
151,morena-pt-pes,morena,mor,1,LUCIA VIRGINIA MEZA GUZMAN LUCY MEZA GUZMAN,LETICIA PEÑA OCAMPO,1,0,
152,morena-pt-pes,pes,mor,2,RADAMES SALAZAR SOLORIO,SERGIO PEREZ FLORES,0,0,
161,morena-pt-pes,pt,nay,1,CORA CECILIA PINEDO ALONSO,SANDRA ELIZABETH ALONSO GUTIERREZ,1,0,
162,morena-pt-pes,morena,nay,2,MIGUEL ANGEL NAVARRO QUINTERO,DANIEL SEPULVEDA ARCEGA,0,0,
175,morena-pt-pes,morena,nl,1,ALVARO JOSE SUAREZ GARZA ALVARO SUAREZ EL 5X,JESUS NERI PRIETO HUERTA,0,0,
176,morena-pt-pes,morena,nl,2,BLANCA JUDITH DIAZ DELGADO,MARTHA ELVA MARTINEZ MARTINEZ,1,0,
183,morena-pt-pes,morena,oax,1,SUSANA HARP ITURRIBARRIA,CONCEPCION RUEDA GOMEZ,1,0,
184,morena-pt-pes,morena,oax,2,SALOMON JARA CRUZ,ADOLFO GOMEZ HERNANDEZ,0,0,
193,morena-pt-pes,morena,pue,1,ALEJANDRO ARMENTA MIER,JESUS ENCINAS MENESES,0,0,
194,morena-pt-pes,pt,pue,2,NANCY DE LA SIERRA ARAMBURO,SANDRA GONZALEZ DE YTA,1,0,
203,morena-pt-pes,morena,que,1,GILBERTO HERRERA RUIZ,JUAN JOSE JIMENEZ YAÑEZ,0,0,
204,morena-pt-pes,morena,que,2,CELIA MAYA GARCIA,LAURA ANDREA TOVAR SAAVEDRA,1,0,
209,morena-pt-pes,pes,qui,1,FREYDA MARYBEL VILLEGAS CANCHE,GABRIELA LOPEZ GOMEZ,1,0,
210,morena-pt-pes,morena,qui,2,JOSE LUIS PECH VARGUEZ,ROGELIO MARQUEZ VALDIVIA,0,0,
215,morena-pt-pes,morena,san,1,PRIMO DOTHE MATA,ELI CESAR EDUARDO CERVANTES ROJAS,0,0,
216,morena-pt-pes,morena,san,2,MARIA JOSEFINA BANDA ZERMEÑO,GUADALUPE ANA KAREN GUERRERO DURAN,1,0,
221,morena-pt-pes,morena,sin,1,RUBEN ROCHA MOYA,RAUL DE JESUS ELENES ANGULO,0,0,
222,morena-pt-pes,morena,sin,2,IMELDA CASTRO CASTRO,ELIZABETH AVILA CARRANCIO,1,0,
229,morena-pt-pes,morena,son,1,MARIA LILLY DEL CARMEN TELLEZ GARCIA LILLY TELLEZ,REINA CASTRO LONGORIA,1,0,
230,morena-pt-pes,morena,son,2,FRANCISCO ALFONSO DURAZO MONTAÑO,ARTURO BOURS GRIFFITH,0,0,
239,morena-pt-pes,morena,tab,1,MONICA FERNANDEZ BALBOA,ADRIANA MANZANILLA FOJACO,1,0,
240,morena-pt-pes,morena,tab,2,JAVIER MAY RODRIGUEZ,OVIDIO SALVADOR PERALTA SUAREZ,0,0,
249,morena-pt-pes,morena,tam,1,AMERICO VILLARREAL ANAYA,FAUSTINO LOPEZ VARGAS,0,0,
250,morena-pt-pes,pes,tam,2,MA. GUADALUPE COVARRUBIAS CERVANTES,ROSALINDA CANTU GONZALEZ,1,0,
255,morena-pt-pes,morena,tla,1,ANA LILIA RIVERA RIVERA,ROSA EUGENIA RODRIGUEZ LOPEZ,1,0,
256,morena-pt-pes,morena,tla,2,JOSE ANTONIO CRUZ ALVAREZ LIMA,JOEL MOLINA RAMIREZ,0,0,
263,morena-pt-pes,morena,ver,1,NORMA ROCIO NAHLE GARCIA,GLORIA SANCHEZ HERNANDEZ,1,0,
264,morena-pt-pes,morena,ver,2,RICARDO AHUED BARDAHUIL,ERNESTO PEREZ ASTORGA,0,0,
269,morena-pt-pes,morena,yuc,1,HILDA MARIANA CRUZ POOL,ANA CRISTINA PAREDES FLORES,1,0,
270,morena-pt-pes,morena,yuc,2,ROGERIO CASTRO VAZQUEZ,EDGARDO GILBERTO MEDINA RODRIGUEZ,0,0,
275,morena-pt-pes,morena,zac,1,MARIA SOLEDAD LUEVANO CANTU,MARIA TERESA INGUANZO GONZALEZ,1,0,
276,morena-pt-pes,morena,zac,2,JOSE NARRO CESPEDES,DOMINGO LIMONES ZUÑIGA,0,0,
143,pan,pan,mor,1,ERIKA CORTES MARTINEZ,EVELYN ANEL AYALA PINO,1,0,
144,pan,pan,mor,2,JOSE FRANCISCO AGUILAR CONTRERAS,SERGIO RENE QUEVEDO NUÑEZ,0,0,
163,pan,pan,nl,1,VICTOR OSWALDO FUENTES SOLIS,JESUS HORACIO GONZALEZ DELGADILLO,0,0,
164,pan,pan,nl,2,ALEJANDRA MARIA SADA ALANIS,VERONICA SADA PEREZ,1,0,
277,pan,,rp,1,JOSEFINA EUGENIA VAZQUEZ MOTA,GLORIA TRINIDAD LUNA RUIZ,1,1,
278,pan,,rp,2,MIGUEL ANGEL MANCERA ESPINOSA,JUAN PABLO ADAME ALEMAN,0,1,
279,pan,,rp,3,INDIRA DE JESUS ROSALES SAN ROMAN,JUDITH FABIOLA VAZQUEZ SAUT,1,1,
280,pan,,rp,4,DAMIAN ZEPEDA VIDALES,LUIS GERARDO SERRATO CASTELL,0,1,
281,pan,,rp,5,KENIA LOPEZ RABADAN,YADHIRA YVETTE TAMAYO HERRERA,1,1,
282,pan,,rp,6,RAFAEL MORENO VALLE ROSAS,ROBERTO JUAN MOYA CLEMENTE,0,1,
283,pan,,rp,7,MARIA GUADALUPE CECILIA ROMERO CASTILLO,EMMA MARGARITA ALEMAN OLVERA,1,1,
284,pan,,rp,8,MARKO ANTONIO CORTES MENDOZA,HERMINIO CORRAL ESTRADA,0,1,
285,pan,,rp,9,ADRIANA AGUILAR RAMIREZ,MARIA BELEN DEL CARMEN MONTAÑO SALCIDO,1,1,
286,pan,,rp,10,LUIS FELIPE BRAVO MENA,JOSE ESPINA VON ROEHRICH,0,1,
287,pan,,rp,11,MARIA ELOISA TALAVERA HERNANDEZ,LUZ ARGELIA PANIAGUA FIGUEROA,1,1,
288,pan,,rp,12,MIGUEL ANGEL ABADIA PARDO,ALBERTO DE LA BARREDA HERNANDEZ,0,1,
289,pan,,rp,13,MARIBEL VARGAS LICEA,ALMA REBECA MARTINEZ GUTIERREZ,1,1,
290,pan,,rp,14,JESUS FRANCISCO VALENCIA TERAN,FARIDH CONCEPCION NIEBLAS BARRANTES,0,1,
291,pan,,rp,15,MIRELLE ALEJANDRA MONTES AGREDANO,ALEJANDRA RIQUELME ALCANTAR,1,1,
292,pan,,rp,16,ROBERTO CHACÓN CÁRDENAS,SAJIDH SAÚL MAGDALENO AVILÉZ,0,1,
293,pan,,rp,17,ANA LORENA CASTRO IGLESIAS,LORENIA BEATRIZ MENDEZ CHAVEZ,1,1,
294,pan,,rp,18,MANUEL RUDECINDO GARCIA FONSECA,SERGIO GUERRA LOPEZ NEGRETE,0,1,
295,pan,,rp,19,WENDY ANAHI MEJIA FLORES,DIANA ESTEFANIA GUTIERREZ VALTIERRA,1,1,
296,pan,,rp,20,GILDARDO LOPEZ HERNANDEZ,AGUSTIN HERNANDEZ ROJO,0,1,
297,pan,,rp,21,IRAZEMA VASQUEZ RUIZ,SARA DEL CARMEN MEXIA ARRIETA,1,1,
298,pan,,rp,22,RAMON SAUL MENESES PEREZ,OSCAR OMAR CASTILLO CASTILLO,0,1,
299,pan,,rp,23,KARINA DOLORES GARZA CISNEROS,MAGALY ITZEL CHAZARO ZAMUDIO,1,1,
300,pan,,rp,24,RICARDO MORALES KUHN,OCTAVIO ALEJANDRO GAMBOA ALVA,0,1,
301,pan,,rp,25,CARMINA MONSERRATH DE AVILA RODRIGUEZ,KAREN ANAHI CANUL CETZAL,1,1,
302,pan,,rp,26,JOSE ARMANDO ACOSTA SANCHEZ,LUIS ROA ESCALONA,0,1,
303,pan,,rp,27,CARLA DENIS COLLINS,IRMA BERENICE MALDONADO JUAREZ,1,1,
304,pan,,rp,28,MARCO ANTONIO MARTINEZ GUERRERO,MIGUEL ALFREDO HERNANDEZ PEÑAFLOR,0,1,
305,pan,,rp,29,JOANNA ALEJANDRA FELIPE TORRES,BARBARA KARIME RIVAS MEJIA,1,1,
306,pan,,rp,30,LUIS IVAN BALDERAS COLIN,MARCO ANTONIO OROZCO CARMONA,0,1,
307,pan,,rp,31,YAZMIN ANDREA RAMIREZ GARCIA,ALEJANDRA ROSAS GARCIA,1,1,
308,pan,,rp,32,GUSTAVO SUAREZ SUAREZ,CRISTOBAL RAUL GUERRA REYES,0,1,
1,pan-prd-mc,pan,ags,1,MARTHA CECILIA MARQUEZ ALVARADO,ADRIANA GUADALUPE JURADO VALADEZ,1,0,
2,pan-prd-mc,pan,ags,2,JUAN ANTONIO MARTÍN DEL CAMPO MARTÍN DEL CAMPO,JUAN FRANCISCO LARIOS ESPARZA,0,0,
11,pan-prd-mc,pan,bc,1,GINA ANDREA CRUZ BLAKCLEDGE,IRAIS MARIA VAZQUEZ AGUIAR,1,0,
12,pan-prd-mc,pan,bc,2,JORGE RAMOS HERNANDEZ,JOSE LUIS OVANDO PATRON,0,0,
21,pan-prd-mc,pan,bcs,1,MARIA GUADALUPE SALDAÑA CISNEROS,AUDELIA ESTHELA VILLARREAL ZAVALA,1,0,
22,pan-prd-mc,pan,bcs,2,FRANCISCO PELAYO COVARRUBIAS,JOSE PABLO PARTIDA ESCOBOSA,0,0,
33,pan-prd-mc,pan,cam,1,YOLANDA GUADALUPE VALLADARES VALLE,TERESITA DE LA PARRA ISLA,1,0,
34,pan-prd-mc,pan,cam,2,EDUARDO ENRIQUE RAMOS ARCEO,MANUEL JESUS MORENO ZAVALA,0,0,
39,pan-prd-mc,pan,coa,1,JOSE GUILLERMO ANAYA LLAMAS,EDUARDO DE LA PEÑA GAITÁN,0,0,
40,pan-prd-mc,pan,coa,2,ESTHER QUINTANA SALINAS,SUSANA SÁNCHEZ SOSA,1,0,
45,pan-prd-mc,mc,col,1,MARIA ELENA ABAROA LOPEZ,KARINA YESENIA MANZO ALVAREZ,1,0,
46,pan-prd-mc,pan,col,2,LUIS HUMBERTO LADINO OCHOA,JOSE ARTURO RAMIREZ ALANIS,0,0,
51,pan-prd-mc,mc,cps,1,MARIA ELENA ORANTES LOPEZ,PATRICIA AGUILAR GARCIA,1,0,
52,pan-prd-mc,prd,cps,2,DIEGO VALENTE VALERA FUENTES,ALFONSO FONG DUBON,0,0,
59,pan-prd-mc,pan,cua,1,GUSTAVO ENRIQUE MADERO MUÑOZ,CARLOS ALFREDO OLSON SAN VICENTE,0,0,
60,pan-prd-mc,pan,cua,2,ROCIO ESMERALDA REZA GALLEGOS,MARTHA ADRIANA DURAN ESPINOZA,1,0,
69,pan-prd-mc,prd,df,1,EMILIO ALVAREZ ICAZA LONGORIA,ROGELIO ALBERTO GOMEZ HERMOSILLO MARIN,0,0,
70,pan-prd-mc,pan,df,2,BERTHA XOCHITL GALVEZ RUIZ,LAURA IRAIS BALLESTEROS MANCILLA,1,0,
79,pan-prd-mc,mc,dgo,1,JOSE RAMON ENRIQUEZ HERRERA,JUAN QUIÑONEZ RUIZ,0,0,
80,pan-prd-mc,pan,dgo,2,PATRICIA FLORES ELIZONDO,MARIA SALOME ELYD SAENZ,1,0,
89,pan-prd-mc,pan,gua,1,ALEJANDRA NOEMI REYNOSO SANCHEZ ALE WERA REYNOSO,ANA TERESA PANIAGUA GARCIA,1,0,
90,pan-prd-mc,pan,gua,2,JOSÉ ERANDI BERMÚDEZ MÉNDEZ,ARMANDO RANGEL HERNANDEZ,0,0,
99,pan-prd-mc,prd,gue,1,BEATRIZ MOJICA MORGA,SILVIA ROMERO SUAREZ,1,0,
100,pan-prd-mc,mc,gue,2,MARIO RAMOS DEL CARMEN,PIOQUINTO DAMIAN HUATO,0,0,
107,pan-prd-mc,prd,hgo,1,DARINA MARQUEZ URIBE,FRANCISCA OLVERA CABALLERO,1,0,
108,pan-prd-mc,mc,hgo,2,JUAN IGNACIO SAMPERIO MONTAÑO,ALVARO MIRANDA PINEDA,0,0,
115,pan-prd-mc,mc,jal,1,JOSE CLEMENTE CASTAÑEDA HOEFLICH,JOSE ALBERTO GALARZA VILLASEÑOR,0,0,
116,pan-prd-mc,mc,jal,2,VERONICA DELGADILLO GARCIA,RUTH ALEJANDRA LOPEZ HERNANDEZ,1,0,
127,pan-prd-mc,prd,mex,1,JUAN MANUEL ZEPEDA HERNANDEZ JUAN ZEPEDA,OMAR OBED MACEDA LUNA,0,0,
128,pan-prd-mc,pan,mex,2,MARIA FERNANDA RIVERA SANCHEZ FERNANDA RIVERA,CLAUDIA DEL ROSARIO ARANDA MUELA,1,0,
133,pan-prd-mc,prd,mic,1,ANTONIO GARCIA CONEJO,CARLOS EMILIO DEL RIVERO ROMERO,0,0,
134,pan-prd-mc,pan,mic,2,ALMA MIREYA GONZALEZ SANCHEZ,LAURA ESQUIVEL TORRES,1,0,
153,pan-prd-mc,pan,nay,1,GLORIA ELIZABETH NUÑEZ SANCHEZ,MARTHA MARIA RODRIGUEZ DOMINGUEZ,1,0,
154,pan-prd-mc,prd,nay,2,GUADALUPE ACOSTA NARANJO,RODRIGO GONZALEZ BARRIOS,0,0,
179,pan-prd-mc,prd,oax,1,HECTOR PABLO RAMIREZ PUGA LEYVA,LENIN LOPEZ NELIO LOPEZ,0,0,
180,pan-prd-mc,pan,oax,2,PERLA MARISELA WOOLRICH FERNANDEZ,NOEMI SUSAN GURRION SCOTT,1,0,
185,pan-prd-mc,pan,pue,1,NADIA NAVARRO ACEVEDO,MARIA DEL SOCORRO FIGUEROA ANDRADE,1,0,
186,pan-prd-mc,pan,pue,2,MARIO GERARDO RIESTRA PIÑA,CARLOS MARTINEZ AMADOR,0,0,
195,pan-prd-mc,pan,que,1,MAURICIO KURI GONZALEZ,JOSE ALFREDO BOTELLO MONTES,0,0,
196,pan-prd-mc,pan,que,2,MARIA GUADALUPE MURGUIA GUTIERREZ,ESTRELLA ROJAS LORETO,1,0,
205,pan-prd-mc,pan,qui,1,MAYULI LATIFA MARTINEZ SIMON,LAURA SUSANA MARTINEZ CARDENAS,1,0,
206,pan-prd-mc,prd,qui,2,JULIAN JAVIER RICALDE MAGAÑA,RICARDO OSWALDO OLIVARES MENA,0,0,
211,pan-prd-mc,prd,san,1,MA LEONOR NOYOLA CERVANTES,MARIA GRACIELA GAITAN DIAZ,1,0,
212,pan-prd-mc,pan,san,2,MARCO ANTONIO GAMA BASARTE,FRANCISCO JAVIER SALAZAR SAENZ,0,0,
217,pan-prd-mc,mc,sin,1,HECTOR MELESIO CUEN OJEDA,VICTOR ANTONIO CORRALES BURGUEÑO,0,0,
218,pan-prd-mc,pan,sin,2,SYLVIA TREVIÑO SALINAS,MARIA DE LA LUZ RAMIREZ RODRIGUEZ,1,0,
225,pan-prd-mc,pan,son,1,ANTONIO FRANCISCO ASTIAZARAN GUTIERREZ,RAMON CORRAL AVILA,0,0,
226,pan-prd-mc,mc,son,2,LETICIA ELIZABETH CUESTA MADRIGAL LETY CUESTA,MICHELLE LORENIA VALENZUELA NEVAREZ,1,0,
231,pan-prd-mc,prd,tab,1,JUAN MANUEL FOCIL PEREZ,CHRISTIAN GREGORIO DIAZ CARRASCO,0,0,
232,pan-prd-mc,prd,tab,2,ANA BERTHA VIDAL FOCIL,IDALIA LIMON CORDOVA,1,0,
241,pan-prd-mc,pan,tam,1,ISMAEL GARCIA CABEZA DE VACA,EDMUNDO JOSE MARON MANZUR,0,0,
242,pan-prd-mc,pan,tam,2,MARIA ELENA FIGUEROA SMITH,IMELDA MARGARITA SANMIGUEL SANCHEZ,1,0,
251,pan-prd-mc,prd,tla,1,MINERVA HERNANDEZ RAMOS,MAURA HERNANDEZ FERNANDEZ,1,0,
252,pan-prd-mc,pan,tla,2,GELACIO MONTIEL FUENTES,ALFONSO RODRIGUEZ DOMINGUEZ,0,0,
259,pan-prd-mc,pan,ver,1,JULEN REMENTERIA DEL PUERTO,ORESTES EUGENIO PEREZ CRUZ,0,0,
260,pan-prd-mc,prd,ver,2,YAZMIN DE LOS ANGELES COPETE ZAPOT,ZEFERINA DEL CARMEN MARIN MARTINEZ,1,0,
265,pan-prd-mc,pan,yuc,1,RAUL PAZ ALONZO,RODOLFO ENRIQUE GONZALEZ CRESPO,0,0,
266,pan-prd-mc,mc,yuc,2,ANA ROSA PAYAN CERVERA,ANA MARIA GUADALUPE ANCONA ROSAS,1,0,
271,pan-prd-mc,prd,zac,1,MARIA DE JESUS CHAVEZ CONTRERAS MARY CHAVEZ,CLAUDIA ANAYA VAZQUEZ,1,0,
272,pan-prd-mc,prd,zac,2,RAFAEL FLORES MENDOZA,MARCO ALBERTO REYES HERNANDEZ,0,0,
7,panal,panal,ags,1,DELIA CHAVEZ ALBA,MA. DEL CARMEN MEDINA ARENAS,1,0,
8,panal,panal,ags,2,DIEGO ARMANDO VAZQUEZ ALBOR,JAVIER ORNELAS IÑIGUEZ,0,0,
17,panal,panal,bc,1,EFRAIN MONRREAL GASTELUM,BENJAMIN KING RISTORI,0,0,
18,panal,panal,bc,2,MARÍA DEL ROSARIO LIZARRAGA SANCHEZ CHAYITO LIZARRAGA,DIANA AZUCENA BELTRAN DIARTE,1,0,
27,panal,panal,bcs,1,GUADALUPE MUNGUIA AVILES,AMELIA TRINIDAD CUELLAR CRUZ,1,0,
28,panal,panal,bcs,2,MANUEL DEL RIEGO DE LOS SANTOS,ALBERTO HIGUERA ZUÑIGA,0,0,
65,panal,panal,cua,1,IRMA PATRICIA ALAMILLO CALVILLO,GUADALUPE SALAZAR BORJA,1,0,
66,panal,panal,cua,2,ISIDRO VILLALBA MORENO,ROBERTO CARLO LOYA RAMIREZ,0,0,
75,panal,panal,df,1,EDUARDO MIGUEL ACHACH IGLESIAS,TOMAS ENRIQUE SCHWANKE PADILLA,0,0,
76,panal,panal,df,2,DENY ADEILAIDE VINIEGRA RODRIGUEZ,ALEXANDRA PEDROZA CORREA,1,0,
85,panal,panal,dgo,1,JOSE NIEVES GARCIA CARO,ALFONSO HERRERA GARCIA,0,0,
86,panal,panal,dgo,2,NINFA TORRES IBARRA,VERONICA HERNANDEZ TENORIO,1,0,
95,panal,panal,gua,1,MARIO ALBERTO HERNÁNDEZ CORONA,ESTEBAN COVARRUBIAS RODRIGUEZ,0,0,
96,panal,panal,gua,2,SONIA BAÑUELOS SANCHEZ,MA. ELEUTERIA FLORES RODRIGUEZ,1,0,
121,panal,panal,jal,1,SANDRA BEATRIZ GONZALEZ PEREZ,ESTHER ALONSO MENDOZA,1,0,
122,panal,panal,jal,2,RAMON ERNESTO GALLARDO LOPEZ,EDGAR LEONEL HERRERA RUBIO,0,0,
139,panal,panal,mic,1,ARACELI ANGELES MORAILA MARTINEZ,LETICIA DEL CARMEN MENDOZA SANCHEZ,1,0,
140,panal,panal,mic,2,RAFAEL TORRES GARCIA,AURELIO FREGOSO ROMERO,0,0,
159,panal,panal,nay,1,MARTIN CARRILLO GUZMAN,ICKOV S IVAN ALVAREZ DELGADO,0,0,
160,panal,panal,nay,2,LILIANA GUILLERMINA VALENZUELA ONTIVEROS,SAHILI TANZANIA CORTES GARCIA,1,0,
173,panal,panal,nl,1,MIRNA ISABEL SALDIVAR PAZ,JOSEFINA VILLANUEVA PADILLA,1,0,
174,panal,panal,nl,2,RUBEN GONZALEZ CABRIELES,LUIS ALFREDO CARDENAS MARTINEZ,0,0,
191,panal,panal,pue,1,NORMA ALICIA CARRETO CHALINI,MONICA GUTIERREZ DAMIAN,1,0,
192,panal,panal,pue,2,MARIO ADOLFO RAMIREZ PARTIDA,JOSE ALEJANDRO AGUILA ARGUELLES,0,0,
201,panal,panal,que,1,LUIS ANGEL GUTIERREZ PEREZ,SERGIO SANDOVAL CHAVEZ,0,0,
202,panal,panal,que,2,DULCE JACQUELINA HUERTA TELLEZ,MARIA JOSE RODRIGUEZ HERNANDEZ,1,0,
237,panal,panal,tab,1,MARGARITO RAMIREZ GARCIA,MIGUEL GUADALUPE BAAS POOT,0,0,
238,panal,panal,tab,2,NATALIA SOSA ALAMILLA,GLORIA ALICIA AGUIRE DIAZ,1,0,
247,panal,panal,tam,1,OSCAR MARTIN RAMOS SALINAS,JUAN CARLOS ALBERTO OLIVARES GUERRERO,0,0,
248,panal,panal,tam,2,HILDA GRACIELA SANTANA TURRUBIATES,JOSELEN HAMMOR PERALES ESPINOSA,1,0,
469,panal,,rp,1,SILVIA LUNA RODRIGUEZ,DORA MARIA GUADALUPE TALAMANTE LEMAS,1,1,
470,panal,,rp,2,NOE RODRIGUEZ GARCIA,RIGOBERTO VARGAS CERVANTES,0,1,
471,panal,,rp,3,KATYA IZQUIERDO HERRERA,ESMERALDA ESTRADA PEREZ,1,1,
472,panal,,rp,4,MIGUEL RAMIREZ SANCHEZ,JAVIER SAN MARTIN JARAMILLO,0,1,
473,panal,,rp,5,ADRIANA LOPEZ MARAÑON,NADIA ANAID GODOY SERRANO,1,1,
474,panal,,rp,6,EZEQUIEL CAMPOS VELARDE,JOSE REFUGIO SALAZAR MEZA,0,1,
475,panal,,rp,7,NORMA VERÓNICA FLORES PABLO,KARLA GUADALUPE MENDEZ CARIO,1,1,
476,panal,,rp,8,ENRIQUE ALEJANDRO CERRO LOZANO,HECTOR AIRAM VELAZQUEZ MARTINEZ,0,1,
477,panal,,rp,9,HILDA GRACIELA SANTANA TURRUBIATES,NEREYDA IZAGUIRRE PEREZ,1,1,
478,panal,,rp,10,DIEGO ALEJANDRO COOPER BARRERA,JOSE ANGEL SOTO ZUÑIGA,0,1,
479,panal,,rp,11,MARITZA LOPEZ GARCIA,NELLY ELVIRA OSORNO GONZALEZ,1,1,
480,panal,,rp,12,ALEXIS CEDEÑO ALFONSO,ABRAHAM BETANZOS LOPEZ,0,1,
481,panal,,rp,13,AURORA DEL ROCIO MENA PASTRANO,MARTHA ELIZABETH DIAZ RIVERA,1,1,
482,panal,,rp,14,GONZALO DE JESUS IBAÑEZ AVENDAÑO,RAMON HERNANDEZ PEREZ,0,1,
483,panal,,rp,15,MARIA GUADALUPE MARTINEZ DIAZ,MARIA DEL SAGRARIO DIAZ GRANILLO,1,1,
484,panal,,rp,16,ULISES GONZALEZ GARCIA,JULIO CESAR ORTIZ REGALADO,0,1,
485,panal,,rp,17,MA. DEL SOCORRO URQUIZU GRAJEDA,MAYRA RIOS GANDARA,1,1,
486,panal,,rp,18,EFRAIN MONRREAL GASTELUM,JORGE ALEJANDRO RODRIGUEZ MONTES,0,1,
487,panal,,rp,19,ANA KAREN SILVA VARGAS,LORENA CRUZ GOMEZ,1,1,
488,panal,,rp,20,GASTON HERNANDEZ HERNANDEZ,FERNANDO MARMOLEJO CERVANTES,0,1,
489,panal,,rp,21,AZALIA ACENETH GUERRA BOCARDO,MARIA GUADALUPE ORONA CAMACHO,1,1,
490,panal,,rp,22,ELIAS CERVANTES LEZAMA,ADALBERTO BARRAGAN MEZA,0,1,
491,panal,,rp,23,EDITH BELTRAN CARRILLO,DULCE MARIELA HORCASITAS DE LA ROSA,1,1,
492,panal,,rp,24,JOSE JAIME NUÑEZ MURGUIA,CARLOS HUGO CARRILLO PRECIADO,0,1,
493,panal,,rp,25,ELIZABETH GUADALUPE ARANGO SANTANA,GUADALUPE BAUTISTA PANE,1,1,
494,panal,,rp,26,LEOPOLDO PEREZ MENDIETA,ELIEZER MORALES MONTES DE OCA,0,1,
495,panal,,rp,27,IVON MARTINEZ RAMIREZ,MA. SOLEDAD SAUCEDO VENEGAS,1,1,
496,panal,,rp,28,CARLOS MANUEL ESQUER GALAVIZ,ANSELMO RAFAEL DUARTE SANTACRUZ,0,1,
497,panal,,rp,29,ELVIA ESTHER CONTRERAS RICALDE,LIA ELIZABETH CARRILLO PEREZ,1,1,
498,panal,,rp,30,SALVADOR AVILA AGUIÑAGA,CARLOS ALFREDO SOSA AVILA,0,1,
499,panal,,rp,31,ENRIQUETA LOPEZ BUSTOS,CARMEN BEATRIZ AGUILETA COBOS,1,1,
500,panal,,rp,32,JUAN FRANCISCO DE ASIS CHAVEZ SOLIS,MARIO MERITO LEON,0,1,
533,pes,,rp,1,ADRIANA SARUR TORRE,ALEJANDRINA MORENO ROMERO,1,1,
534,pes,,rp,2,ABDIES PINEDA MORIN,RIGOBERTO RODRIGUEZ RANGEL,0,1,
535,pes,,rp,3,BLANCA JUDITH DIAZ DELGADO,MARTHA ELVA MARTINEZ MARTINEZ,1,1,
536,pes,,rp,4,JOSE ALFREDO FERREIRO VELAZCO,INOCENCIO JUVENCIO HERNANDEZ HERNANDEZ,0,1,
537,pes,,rp,5,AIDA ARREGUI GUERRERO,MARIA DEL ROCIO FLORES CERVANTES,1,1,
538,pes,,rp,6,NAHUM NAVAS RUIZ,DANIEL MARTINEZ MARTINEZ,0,1,
539,pes,,rp,7,ALMA ROSA OLLERVIDES GONZALEZ,LILIANN KRISSTEL GARCIA CASTAÑEDA,1,1,
540,pes,,rp,8,MARCOS SANTANA MONTES,ALFREDO SALOME BALTAZAR GOMEZ,0,1,
541,pes,,rp,9,YOLANDA SANCHEZ GUZMAN,TOMASA TONCHE CHAVEZ,1,1,
542,pes,,rp,10,MARIO ALBERTO MORALES REYNOSO,JACOBO DANIEL HERNANDEZ ALONSO,0,1,
543,pes,,rp,11,CONCEPCIÓN SOFIA ROBLES ALTAMIRANO,MARIA TERESA RUIZ ACEVEDO,1,1,
544,pes,,rp,12,JESUS PEREZ ALBARRAN,JOSE ZARATE SANCHEZ,0,1,
545,pes,,rp,13,RUTH CERVANTES ARREDONDO,LUCIA JANETTE NUÑEZ GALLEGOS,1,1,
546,pes,,rp,14,LUIS LINO HERNANDEZ ESPINOZA,FELIX ANDRES ACEVES BRAVO,0,1,
