ord,edon,disn,part,dwon,propietario,suplente
890,10,3,MOVIMIENTO CIUDADANO,0,ROBERTO CARMONA JAUREGUI,MARGARITA ROCIO AYALA RIVERA
891,10,3,MORENA,1,MARIBEL AGUILERA CHAIREZ,MARTHA ALICIA ARREOLA MARTINEZ
892,10,3,PES,0,CLARA MAYRA ZEPEDA GARCIA,ZURISADAY HERNANDEZ ALCANTAR
893,10,3,RSP,0,FERNANDO ULISES ADAME DE LEON,GERARDO ALBERTO MORALES ALVAREZ
894,10,3,FS X MEXICO,0,MARGARITA DIAZ OLIVAS,ELIA ESTRADA MACIAS
903,10,4,PAN,1,GINA GERARDINA CAMPUZANO GONZALEZ,MARIA ELENA GONZALEZ RIVERA
904,10,4,PRI,1,GINA GERARDINA CAMPUZANO GONZALEZ,MARIA ELENA GONZALEZ RIVERA
905,10,4,PRD,1,GINA GERARDINA CAMPUZANO GONZALEZ,MARIA ELENA GONZALEZ RIVERA
906,10,4,PVEM,0,RIGOBERTO QUIÑONEZ SAMANIEGO,JOSE EMILIO MARTELL NEVAREZ
907,10,4,PT,0,RIGOBERTO QUIÑONEZ SAMANIEGO,JOSE EMILIO MARTELL NEVAREZ
908,10,4,MOVIMIENTO CIUDADANO,0,MARTIN VIVANCO LIRA,MARIANA ISABEL VERDUGA PALENCIA
909,10,4,MORENA,0,RIGOBERTO QUIÑONEZ SAMANIEGO,JOSE EMILIO MARTELL NEVAREZ
910,10,4,PES,0,ANTONIO DE LA TORRE CARLOS,TEOFILO CHAIREZ RAMIREZ
911,10,4,RSP,0,HUMBERTO RAUL ROSALES BADILLO,ANTONIO QUIROZ ORONA
912,10,4,FS X MEXICO,0,ALICIA GARCIA VALENZUELA,MARIA ROSALINA SALAZAR ELIZALDE
921,11,1,PAN,1,BERENICE MONTES ESTRADA,LETICIA GARCIA MARMOLEJO
922,11,1,PRI,0,MONSERRAT BANDA ARTEAGA,MA DE LOS ANGELES FERRO CAMPOS
923,11,1,PRD,0,ANA MARIA VALLE PEREZ,ORELIA FLORES VAZQUEZ
924,11,1,PVEM,0,JOSE BRAULIO FLORES CAMARILLO,JUAN JOSE TORRES LEDESMA
925,11,1,PT,0,VICTOR MANUEL ALVAREZ DUCOING,ARMANDO VALENCIA VARGAS
926,11,1,MOVIMIENTO CIUDADANO,0,MARTIN TADEO RODRIGUEZ FLORES,OSWALDO TADEO QUINTANA ROJAS
927,11,1,MORENA,0,MA DEL CARMEN VILLEGAS HERNANDEZ,YARET SARAI RANGEL GARCIA
928,11,1,PES,0,CAROLINA HUERTA AGUILAR,JAZMIN ARIDAI AMADOR CHAVERO
929,11,1,RSP,0,ADRIANA GUADALUPE GONZALEZ GARCIA,ALBA ROCIO GALVAN DE ANDA
930,11,1,FS X MEXICO,0,OLGA ELVA BECERRA DUCOING,MA DEL ROSARIO BECERRA RODRIGUEZ
931,11,2,PAN,1,RICARDO VILLARREAL GARCIA,RAMON ZAVALA ORTIZ
932,11,2,PRI,0,BEATRIZ MEZA ESCUTIA,FLORENCIA VARGAS BENITEZ
933,11,2,PRD,0,VALERIA LIZBETH PADRON JUAREZ,LIZZETTE JANET HERNANDEZ VILLEGAS
934,11,2,PVEM,0,MIRNA LUNA RODRIGUEZ,ROSA MARIA RANGEL MANCERA
935,11,2,PT,0,FERNANDO GARCIA CHAVEZ,AMBROCIO DUQUE PINEDA
936,11,2,MOVIMIENTO CIUDADANO,0,NATASHA PAMELA GRANJA MONJARAZ,VALERIA RAMIREZ COSSIO
937,11,2,MORENA,0,GENARO MARTIN ZUÑIGA SOTO,JONATHAN STEFANONNI ROSALES
938,11,2,PES,0,JUAN GONZALO CARRANZA ARREGUIN,LEONARDO ISRAEL GOMEZ OLALDE
939,11,2,RSP,0,RUBEN SILVA LOPEZ,CARLOS BRAVO LEON
940,11,2,FS X MEXICO,0,NELLY LOPEZ GARCIA,CITLALLI ABIGAIL GUTIERREZ CARDONA
941,11,3,PAN,1,FERNANDO TORRES GRACIANO,ERANDI ALEJANDRO ACEVES SANCHEZ
942,11,3,PRI,0,YOLANDA ELIZETH GALVAN HERNANDEZ,KARINA SARAI DE LA CRUZ DIAZ
943,11,3,PRD,0,GRACIELA ORTA SERRANO,MARTHA LETICIA GONZALEZ JUAREZ
944,11,3,PVEM,0,ALEJANDRO ARTURO CALVILLO APOLINAR,ALICIA CASTILLO RODRIGUEZ
945,11,3,PT,0,EDNA VIRGINIA GOMEZ MARTINEZ,JESSICA YOLANDA TIRADO ROCHA
946,11,3,MOVIMIENTO CIUDADANO,0,MA ISABEL LLAMAS ANDRADE,EUGENIA CRYSTAL PILOTZI MEDINA
947,11,3,MORENA,0,EDGAR OMAR CHICO MERCADO,ERICK DANIEL RODAS MORENO
948,11,3,PES,0,MARINO MARTINEZ GOMEZ,AGUSTIN HURTADO LIRA
949,11,3,RSP,0,MARIA FERNANDA VAZQUEZ GOMEZ,ARANZA GERALDINE AGUIRRE HERNANDEZ
950,11,3,FS X MEXICO,0,MA TERESA GONZALEZ DEL CASTILLO OROZCO,MARTHA LETICIA GOMEZ BAEZ
951,11,4,PAN,1,JUAN CARLOS ROMERO HICKS,DANIEL ANTONIO ORDAZ MARTINEZ
952,11,4,PRI,0,MARIA ESTEFANIA GARCIA DOBARGANES RAMIREZ,JUANA ELVA RAMIREZ GONZALEZ
953,11,4,PRD,0,IGOR OLAF SURA WYSOCKI,PERLA LETICIA OLMOS ROSALES
954,11,4,PVEM,0,GRICEL RODRIGUEZ ROBLEDO,BLANCA EDNA CABRERA BARRON
955,11,4,PT,0,ANGELICA MARTINEZ SALINAS,MA DE JESUS OROCIO QUINTERO
956,11,4,MOVIMIENTO CIUDADANO,0,JUAN OMAR PALAFOX LOPEZ,JUAN DIEGO MONTES BARRON
957,11,4,MORENA,0,RUTH ESPERANZA LUGO MARTINEZ,ALMA ROXANA MORENO ARAIZA
958,11,4,PES,0,JOSE MENDEZ ORTEGA,JOSE LUIS ARELLANO GONZALEZ
959,11,4,RSP,0,MARIBEL URIBE BUENDIA,LIDIA ITZAYANA FLORES CANO
960,11,4,FS X MEXICO,0,LAURA MARGARITA CARBAJAL DUARTE,MA CONCEPCION LOPEZ HERRERA
961,11,5,PAN,1,ECTOR JAIME RAMIREZ BARBA,ANTONIO EDUARDO ROCHA BRAVO
962,11,5,PRI,0,LUIS GERARDO GUTIERREZ CHICO,AURELIA GUTIERREZ RIOS
963,11,5,PRD,0,MIGUEL AGUSTIN CORTES GONZALEZ,RICARDO HERNANDEZ MORA
964,11,5,PVEM,0,ANA CECILIA GRACIELA SIMON BUSTAMANTE,BEATRIZ ARELLANO ALVAREZ
965,11,5,PT,0,XOCHITL PATRICIA ORTEGA ANGULO,ALMA JAZMIN GARCIA GARCIA
966,11,5,MOVIMIENTO CIUDADANO,0,JUAN ANGEL JAIME CORDOVA,ERNESTO GOMEZ OBREGON
967,11,5,MORENA,0,JUANA ANGELICA SANROMAN VAZQUEZ,MARIBEL CORDOVA GUERRERO
968,11,5,PES,0,JUAN DAVID FRAUSTO CHAVEZ,LUIS ALBERTO ESPINOZA HERNANDEZ
969,11,5,RSP,0,LUIS MANUEL MUÑOZ COPADO,ROGELIO LANDIN VERA
970,11,5,FS X MEXICO,0,MARIA EUGENIA SAAVEDRA RODRIGUEZ,PATRICIA GONZALEZ SEGOVIA
971,11,6,PAN,1,ANA MARIA ESQUIVEL ARRONA,ALMA CRISTINA RODRIGUEZ VALLEJO
972,11,6,PRI,0,JOSE DE JESUS VAZQUEZ TRUJILLO,DIANA MAGDALENA CAMARILLO GUZMAN
973,11,6,PRD,0,JOSEFINA NICASIO MEZA,MAGDALENA SANCHEZ REYNA
974,11,6,PVEM,0,KARLA DE LA PUENTE ESCUDERO,FATIMA BERNAL TORRES
975,11,6,PT,0,BASILIO MAGAÑA GARCIA,EDGAR OCTAVIO CASILLAS GUTIERREZ
976,11,6,MOVIMIENTO CIUDADANO,0,GABRIELA LETICIA CAAMAÑO MUÑOZ,MADAI BERENICE DE LA ENCARNACION VAZQUEZ OÑATE
977,11,6,MORENA,0,JANETTE GARCIA SANDOVAL,BERENICE HERNANDEZ SANTOS
978,11,6,PES,0,NAVIDAD GUTIERREZ CONTRERAS,JUDITH IVONNE GARCIA SERRANO
979,11,6,RSP,0,TERESITA LAGUNA FARFAN,ANGELICA ANAYA HERNANDEZ
980,11,6,FS X MEXICO,0,ANA ELIZABETH CARRILLO BALDERAS,GISELA ELIANA VALDIVIA PEREZ
981,11,7,PAN,1,KAREN MICHEL GONZALEZ MARQUEZ,GABRIELA GARCIA GONZALEZ
982,11,7,PRI,0,MA GUADALUPE GUERRERO MORENO,MARIA ELENA GARCIA MADRIGAL
983,11,7,PRD,0,ANA MARIA HERNANDEZ AYALA,GLORIA REYES VERDIN
984,11,7,PVEM,0,FABRICIO ANTONIO ALEMAN VALADEZ,OMAR EDGARDO RUIZ ALCOCER
985,11,7,PT,0,GLORIA RODRIGUEZ RUVALCABA,YANETH SOLEDAD HERNANDEZ CORTES
986,11,7,MOVIMIENTO CIUDADANO,0,SHAKIRA MADRIGAL GOMEZ CRUZ,MARIA ARACELI GOMEZ CRUZ
987,11,7,MORENA,0,ZORAIDA CARDONA JIMENEZ,LORENA GAMEZ ARROYO
988,11,7,PES,0,MARIA LIZBETH GUERRERO RODRIGUEZ,MERCY MURILLO DOMINGUEZ
989,11,7,RSP,0,SANDRA JAZMIN SANCHEZ TRUJILLO,LILIA GUADALUPE SANCHEZ TRUJILLO
990,11,7,FS X MEXICO,0,LIDIA HURTADO LOZANO,LORENA LARA FERNANDEZ
991,11,8,PAN,1,JUSTINO EUGENIO ARRIAGA ROJAS,HERMINIO TORRES AJURIA
992,11,8,PRI,1,JUSTINO EUGENIO ARRIAGA ROJAS,HERMINIO TORRES AJURIA
993,11,8,PRD,1,JUSTINO EUGENIO ARRIAGA ROJAS,HERMINIO TORRES AJURIA
994,11,8,PVEM,0,ISRAEL MARMOLEJO ARELLANO,JUAN CARLOS HERNANDEZ TOVAR
995,11,8,PT,0,FRANCISCO MARTIN FLORES SANCHEZ,AARON ADRIAN NAVARRO
996,11,8,MOVIMIENTO CIUDADANO,0,ELDA CASTILLO VARELA,MA MARTINA MONTENEGRO FLORES
997,11,8,MORENA,0,ALBERTO REYNA BRAVO,ALBERTO DE LA TORRE GLEASON
998,11,8,PES,0,SIN CANDIDATURA,MONICA DEL CARMEN TORRES SANCHEZ
999,11,8,RSP,0,SAUL ARAN ARELLANO,OSCAR CASTRO ROA
1000,11,8,FS X MEXICO,0,SANDRA SORAIDA DE LOS REYES FERNANDEZ,MARIA GUADALUPE MENDEZ PEREZ
1005,11,9,PAN,1,JORGE ALBERTO ROMERO VAZQUEZ,JOSE SALVADOR TOVAR VARGAS
1006,11,9,PRI,0,NORMA CONCEPCION PARRA ROCHA,ANA MA GUTIERREZ PEREZ
1007,11,9,PRD,0,MOISES CASTRO AYALA,FERNANDO CAMARILLO CERVANTES
1008,11,9,PVEM,0,J JESUS BOLAÑOS AUDIFRED,ISRAEL HERNANDEZ ARRIAGA
1009,11,9,PT,0,ADRIANA LORETO CHAGOYA ORTEGA,ESMERALDA CAROLINA SALINAS CHAGOYA
1010,11,9,MOVIMIENTO CIUDADANO,0,CARLOS IVAN PONCE MONTAÑO,CARLOS RAFAEL GARCIA GALLARDO
1011,11,9,MORENA,0,DIANA DEL ROSARIO PACO ARGUELLO,FABIOLA MONTSERRAT RANGEL MARTINEZ
1012,11,9,PES,0,MARTHA LUCIA OLMOS BARRERA,MIRIAM MONSERRAT AGUIRRE LAZARO
1013,11,9,RSP,0,MAURICIO HERNANDEZ BUSTAMANTE,PEDRO EDGAR FLORES MARTINEZ
1014,11,9,FS X MEXICO,0,BARBARA GUTIERREZ MARMOLEJO,VERONICA BELMAN MURILLO
1015,11,10,PAN,0,KARLA ALEJANDRINA LANUZA HERNANDEZ,ANA LAURA VILLAGOMEZ GUDIÑO
1016,11,10,PRI,0,J HERLINDO VELAZQUEZ FERNANDEZ,EDGAR JOSE ZAVALA OROZCO
1017,11,10,PRD,0,ANA LUISA RODRIGUEZ ARRIAGA,MARIA FERNANDA GARCIA GUERRERO
1018,11,10,PVEM,0,LILIA VILLAFUERTE ZAVALA,ELVIA GABRIELA VILLARREAL FUENTES
1019,11,10,PT,0,MIKJAIL ALEJANDRO JUAREZ LEON,OLIVER ANDRE LEON SUBIAS
1020,11,10,MOVIMIENTO CIUDADANO,0,MIRIAM GARCIA FLORES,MARIA JOSE ORTIZ JUAREZ
1021,11,10,MORENA,1,PEDRO DAVID ORTEGA FONSECA,JORGE LUIS GUZMAN DOMINGUEZ
1022,11,10,PES,0,ADRIAN CAMARGO ZAMUDIO,LUIS ALFONSO LOPEZ TORRES
1023,11,10,RSP,0,BENHUR SAMANO LOPEZ,ANDY CORNEJO HERNANDEZ
1024,11,10,FS X MEXICO,0,MARIA DEL RAYO MORENO CASTRO,MA DEL CARMEN ORTEGA
1025,11,11,PAN,1,JORGE ARTURO ESPADAS GALVAN,ALFREDO ZETTER GONZALEZ
1026,11,11,PRI,0,ROBERTO MAURICIO VALLEJO RABAGO,LINO AGUIÑAGA DURAN
1027,11,11,PRD,0,MARTIN EDUARDO SIERRA ARRIAGA,JOSE JUAN GARCIA LANDEROS
1028,11,11,PVEM,0,JESSICA DENISSE LOPEZ LANDEROS,JESSICA JULIETTE MARTINEZ GODINEZ
1029,11,11,PT,0,LETICIA CARRERA ZAVALA,LUZ GABRIELA SOLIS MALDONADO
1030,11,11,MOVIMIENTO CIUDADANO,0,ERNESTO ARRACHE GARCIA GUTIERREZ,DIEGO PORTILLO VELA
1031,11,11,MORENA,0,RICARDO GOMEZ ESCALANTE,JOSE LUIS MERCADO FLORES
1032,11,11,PES,0,DAVID GARCIA TREJO,JOSE ARMANDO JIMENEZ PACHECO
1033,11,11,RSP,0,JUAN VICTOR MANUEL TRUJILLO LOPEZ,JUAN JESUS FONSECA ORTEGA
1034,11,11,FS X MEXICO,0,VIVIANA LOPEZ RODRIGUEZ,ITZEL ROSITA VARGAS CABRERA
1035,11,12,PAN,1,SARAI NUÑEZ CERON,MARIA DE LOS MILAGROS RODRIGUEZ HERRERA
1036,11,12,PRI,0,ESTEFANIA GARCIA NAVAR,ALEJANDRA MARIA RAMIREZ TOVAR
1037,11,12,PRD,0,JOSE CARLOS CALLEJA LOPEZ,JESUS GILBERTO RUELAS FLORES
1038,11,12,PVEM,0,ARMANDO MONTIEL SANCHEZ,ALEJANDRO LEON MARIN
1039,11,12,PT,0,ROSAURA CUENCA SIERRA,HEIDI LARA GUTIERREZ
1040,11,12,MOVIMIENTO CIUDADANO,0,VICTOR HUGO PINEDA MARTINEZ,FABIOLA ELIZABETH RODRIGUEZ CASTAÑON
1041,11,12,MORENA,0,BARBARA VARELA ROSALES,ALMA PAOLA DOMINGUEZ VIRGEN
1042,11,12,PES,0,JUAN JOSE SANCHEZ ROBLES,ANA ERICKA SANCHEZ LEON
1043,11,12,RSP,0,SILVIA ANDREA OYANGUREN GUERRERO,MAYTE JANETH RUIZ TIRADO
1044,11,12,FS X MEXICO,0,PATRICIA DE GUADALUPE PATIÑO LEON,MONICA GUTIERREZ RAMIREZ
1045,11,13,PAN,0,ROCIO AMBRIZ ARREDONDO,EMELIN ZARAGOZA MORALES
1046,11,13,PRI,0,ANTONIO ZAVALA LEDESMA,JUAN JOSE RAYA CHAVEZ
1047,11,13,PRD,0,DIEGO MANUEL GOMEZ PEREZ,ANANIAS BARUK PLATAS MATA
1048,11,13,PVEM,1,EMMANUEL REYES CARMONA,ARNULFO GONZALEZ GRANADOS
1049,11,13,PT,1,EMMANUEL REYES CARMONA,ARNULFO GONZALEZ GRANADOS
1050,11,13,MOVIMIENTO CIUDADANO,0,BLANCA NALLELI ZAVALA VARGAS,ISAURA VARGAS MUÑOZ
1051,11,13,MORENA,1,EMMANUEL REYES CARMONA,ARNULFO GONZALEZ GRANADOS
1052,11,13,PES,0,JUAN MARTINEZ RODRIGUEZ,CARLOS EDGAR BACA PEREZ
1053,11,13,RSP,0,HUGO ZAVALA OLVERA,RICARDO DANIEL SALAZAR BAUTISTA
1054,11,13,FS X MEXICO,0,MARIA VERONICA HURTADO RAMIREZ,ANA LILIA VALADEZ ALVARADO
1059,11,14,PAN,1,ESTHER MANDUJANO TINAJERO,SANDRA GALVAN CERVANTES
1060,11,14,PRI,0,J CARMEN MONDRAGON RECENDIZ,JOSE LUIS TAMAYO MARTINEZ
1061,11,14,PRD,0,ROSA PAOLA VILLANUEVA ZAMUDIO,GRISELDA NATALI DURAN ALBARRAN
1062,11,14,PVEM,0,MA DEL CARMEN ZANATTA ZAGO,ALICIA GARCIA NAVARRETE
1063,11,14,PT,0,GABRIEL PEREZ CORONA,JOSE RUBEN LOPEZ JACOBO
1064,11,14,MOVIMIENTO CIUDADANO,0,JUANA GARCIA RAMIREZ,MARIA NOEMI SEGOVIANO LOPEZ
1065,11,14,MORENA,0,LUIS ANTONIO MAGDALENO GORDILLO,HOMAR PATIÑO RUBIO
1066,11,14,PES,0,MERCEDES TORAL GALVAN,GLORIA VALENCIA GUERRERO
1067,11,14,RSP,0,VIOLETA ELIZABETH MANDUJANO GONZALEZ,GRACIELA ZUÑIGA JARAMILLO
1068,11,14,FS X MEXICO,0,JUANA ERIKA RODRIGUEZ GUZMAN,MARIA DEL REFUGIO MORENO CASTRO
1069,11,15,PAN,1,ITZEL JOSEFINA BALDERAS HERNANDEZ,MARTHA ELENA ROMERO SIEKMAN
1070,11,15,PRI,0,JOSE CARLOS MONTIBELLER ZAPIEN,CARLOS ABEL LIRA TRUJILLO
1071,11,15,PRD,0,CARLOS ALBERTO DELGADO ARROYO,JUAN JOSE GAONA SALDIVAR
1072,11,15,PVEM,0,MAYRA ELIZABETH NEGRETE VACA,ELIZABETH FABIOLA LOPEZ MARTINEZ
1073,11,15,PT,0,ABRAHAM LOPEZ RAMIREZ,MARIO ARTURO ROA ARREORTUA
1074,11,15,MOVIMIENTO CIUDADANO,0,HUGO VILLASEÑOR ESLAVA,ROGELIO PEREZ ALVAREZ
1075,11,15,MORENA,0,MIGUEL ANGEL CHICO HERRERA,CARLOS VEGA CASTAÑON
1076,11,15,PES,0,ROSA PEREZ HERNANDEZ,LUCIA DEL CARMEN HERNANDEZ PEREZ
1077,11,15,RSP,0,RAQUEL ADELAIDA CAMARILLO JUAREZ,CINTHIA PAOLA MARTINEZ BAÑUELOS
1078,11,15,FS X MEXICO,0,MA ROSA ROSALES MARQUEZ,SIN CANDIDATURA
1079,12,1,PAN,1,REYNEL RODRIGUEZ MUÑOZ,FERNANDO SANDOVAL PALACIOS
1080,12,1,PRI,1,REYNEL RODRIGUEZ MUÑOZ,FERNANDO SANDOVAL PALACIOS
1081,12,1,PRD,1,REYNEL RODRIGUEZ MUÑOZ,FERNANDO SANDOVAL PALACIOS
1082,12,1,PVEM,0,VICTOR ADOLFO MOJICA WENCES,DIEGO ARMANDO CENCIANA MARQUEZ
1083,12,1,PT,0,VICTOR ADOLFO MOJICA WENCES,DIEGO ARMANDO CENCIANA MARQUEZ
1084,12,1,MOVIMIENTO CIUDADANO,0,ANIBAL FLORES GONZALEZ,ALFONSO LUIS VANGELISTA
1085,12,1,MORENA,0,VICTOR ADOLFO MOJICA WENCES,DIEGO ARMANDO CENCIANA MARQUEZ
1086,12,1,PES,0,ROSA LIDIA SANTAMARIA JIMENEZ,LORENA ROMERO GAONA
1087,12,1,RSP,0,DULCE MARIA MONTES LAGUNAS,MARICRUZ ROMERO RAMIREZ
1088,12,1,FS X MEXICO,0,ERIKA ARISMEL HINOJOSA CARDENAS,ORFANELIA GARCIA HERNANDEZ
1097,12,2,PAN,0,YESENIA GALARZA CASTRO,DULCE GUADALUPE VADILLO CRUZ
1098,12,2,PRI,0,ARACELY ALHELI ALVARADO GONZALEZ,ZITA LOPEZ ALVAREZ
1099,12,2,PRD,0,LAZARO MAZON ALONSO,ROBERTO SALAZAR RODRIGUEZ
1100,12,2,PVEM,0,NADIA GOMEZ JUAREZ,FRANCISCA GARCIA CRUZ
1101,12,2,PT,0,KALY VICTORIA DELGADO,ANGELICA DENISE CHAVEZ CASTRO
1102,12,2,MOVIMIENTO CIUDADANO,0,ALEJANDRINA VARGAS BELTRAN,JOHANY ROXANA NAVA NAVA
1103,12,2,MORENA,1,ARACELI OCAMPO MANZANARES,MARISOL RENDON RAMIREZ
1104,12,2,PES,0,EDUARDO CABALLERO ALMAZAN,RANDY DANIEL REYES LASOS
1105,12,2,RSP,0,PRISCILLA PACHECO ROMERO,SHARON VELASCO BOTELLO
1106,12,2,FS X MEXICO,0,SIN CANDIDATURA,LUZ DARIANA MARTINEZ DOMINGUEZ
1107,12,3,PAN,0,RICARDO ANGEL BARRIENTOS RIOS,ARTURO CABAÑAS FLORES
1108,12,3,PRI,0,RICARDO ANGEL BARRIENTOS RIOS,ARTURO CABAÑAS FLORES
1109,12,3,PRD,0,RICARDO ANGEL BARRIENTOS RIOS,ARTURO CABAÑAS FLORES
1110,12,3,PVEM,1,LUIS EDGARDO PALACIOS DIAZ,RAUL ROJAS RAMIREZ
1111,12,3,PT,1,LUIS EDGARDO PALACIOS DIAZ,RAUL ROJAS RAMIREZ
1112,12,3,MOVIMIENTO CIUDADANO,0,KEVIN JARET RAMIREZ PILO,IRVING SANCHEZ TAPIA
1113,12,3,MORENA,1,LUIS EDGARDO PALACIOS DIAZ,RAUL ROJAS RAMIREZ
1114,12,3,PES,0,ARTURO GARCIA ORTEGA,EDGAR AGUILAR BLANCO
1115,12,3,RSP,0,JENIFER VALLE VERDUZCO,VANELI VALLE VERDUZCO
1116,12,3,FS X MEXICO,0,CRUZ YASMINI RUIZ CARRILLO,HONORINA GALEANA RIOS
1125,12,4,PAN,0,SHEILA SOTO MANZANO,PAULINA GARCIA ORTIZ
1126,12,4,PRI,0,SHEILA SOTO MANZANO,PAULINA GARCIA ORTIZ
1127,12,4,PRD,0,SHEILA SOTO MANZANO,PAULINA GARCIA ORTIZ
1128,12,4,PVEM,0,EDGAR HERNANDEZ ALVAR,ISMAEL POLANCO VILLANUEVA
1129,12,4,PT,0,MARCO ANTONIO VILLEDA SALAMANCA,ANGEL ISAI ARANDA VELAZQUEZ
1130,12,4,MOVIMIENTO CIUDADANO,0,VICTOR MANUEL JORRIN LOZANO,ISRAEL BARAJAS ROJAS
1131,12,4,MORENA,1,PABLO AMILCAR SANDOVAL BALLESTEROS,LUIS ENRIQUE RIOS SAUCEDO
1132,12,4,PES,0,MA DE LA LUZ REYES RIOS,LAURA MELISSA MUÑOZ PEREZ
1133,12,4,RSP,0,MARIA ELDA MIRANDA HERNANDEZ,IVETTE CAROLINA RODRIGUEZ CRUZ
1134,12,4,FS X MEXICO,0,VIOLETA ARROYO SANTOS,CARMINA ADRIANA CASTILLO VILLA
1139,12,5,PAN,0,ISRAEL ROMERO SIERRA,ALFONSO EPITACIO FLORES
1140,12,5,PRI,0,ISRAEL ROMERO SIERRA,ALFONSO EPITACIO FLORES
1141,12,5,PRD,0,ISRAEL ROMERO SIERRA,ALFONSO EPITACIO FLORES
1142,12,5,PVEM,1,VICTORIANO WENCES REAL,ISAIAS ROJAS RAMIREZ
1143,12,5,PT,1,VICTORIANO WENCES REAL,ISAIAS ROJAS RAMIREZ
1144,12,5,MOVIMIENTO CIUDADANO,0,PEDRO GUEVARA TRINIDAD,JESUS OMAR BIBIANO BASURTO
1145,12,5,MORENA,1,VICTORIANO WENCES REAL,ISAIAS ROJAS RAMIREZ
1146,12,5,PES,0,CELESTINA GARCIA DIAZ,SOFIA DIAZ PINZON
1147,12,5,RSP,0,GABRIELA ESPINAL FLORES,KARLA DANIELA GARCIA GUZMAN
1148,12,5,FS X MEXICO,0,MARISELA SALMERON FELICIANO,AMALIA FLORES GALLARDO
1157,12,6,PAN,1,FABIOLA RAFAEL DIRCIO,BENITA COCTOLOLO NAVA
1158,12,6,PRI,1,FABIOLA RAFAEL DIRCIO,BENITA COCTOLOLO NAVA
1159,12,6,PRD,1,FABIOLA RAFAEL DIRCIO,BENITA COCTOLOLO NAVA
1160,12,6,PVEM,0,MARCO ANTONIO MIRANDA SALGADO,ANTELMA DE LA CRUZ CLEMENTE
1161,12,6,PT,0,MARCO ANTONIO MIRANDA SALGADO,ANTELMA DE LA CRUZ CLEMENTE
1162,12,6,MOVIMIENTO CIUDADANO,0,ARIZBETH RODRIGUEZ RIVERA,ILDEBERTA SIERRA SANCHEZ
1163,12,6,MORENA,0,MARCO ANTONIO MIRANDA SALGADO,ANTELMA DE LA CRUZ CLEMENTE
1164,12,6,PES,0,MARIA NORMA GRANDE VARGAS,MARTA MADAI SANCHEZ GARCIA
1165,12,6,RSP,0,SAULO AZUA REYES,LUIS ANTONIO LAGUNAS GUTIERREZ
1166,12,6,FS X MEXICO,0,LUZ ELENA SANTOS BELLO,ROCIO FLORES DIAZ
1175,12,7,PAN,0,BEATRIZ VELEZ NUÑEZ,LINDA WENDY SOTO VAZQUEZ
1176,12,7,PRI,0,BEATRIZ VELEZ NUÑEZ,LINDA WENDY SOTO VAZQUEZ
1177,12,7,PRD,0,BEATRIZ VELEZ NUÑEZ,LINDA WENDY SOTO VAZQUEZ
1178,12,7,PVEM,1,CARLOS SANCHEZ BARRIOS,LUIS ALBERTO SALVADOR SIERRA JIMENEZ
1179,12,7,PT,1,CARLOS SANCHEZ BARRIOS,LUIS ALBERTO SALVADOR SIERRA JIMENEZ
1180,12,7,MOVIMIENTO CIUDADANO,0,CONCEPCION JATCIRIS RUIZ GARCIA,MARIA ISABEL BAHENA TREJO
1181,12,7,MORENA,1,CARLOS SANCHEZ BARRIOS,LUIS ALBERTO SALVADOR SIERRA JIMENEZ
1182,12,7,PES,0,JULIO CESAR AGUIRRE SAGAHON,ROBERTO MARCELO ALARCON
1183,12,7,RSP,0,JOSE ANTONIO MORA RENDON,JORGE HERNANDEZ ROSAS
1184,12,7,FS X MEXICO,0,OLGA REBECA ROBLEDO FIGUEROA,YAHAIRA HARUMI GUTIERREZ VELASQUEZ
1193,12,8,PAN,0,GRETA ESTEOFENES VENTURA LEMUS,PATY ITZET BELTRAN GUTIERREZ
1194,12,8,PRI,0,GRETA ESTEOFENES VENTURA LEMUS,PATY ITZET BELTRAN GUTIERREZ
1195,12,8,PRD,0,GRETA ESTEOFENES VENTURA LEMUS,PATY ITZET BELTRAN GUTIERREZ
1196,12,8,PVEM,1,EUNICE MONZON GARCIA,DIANA CARMONA MARTINEZ
1197,12,8,PT,1,EUNICE MONZON GARCIA,DIANA CARMONA MARTINEZ
1198,12,8,MOVIMIENTO CIUDADANO,0,FERMIN RUANO MORALES,JESUS CASTILLO SILVAR
1199,12,8,MORENA,1,EUNICE MONZON GARCIA,DIANA CARMONA MARTINEZ
1200,12,8,PES,0,NOELIA MOCTEZUMA RIZO,MAGDA OLIVIA ESPINOZA NAVARRETE
1201,12,8,RSP,0,JUAN PABLO ROJAS PEREZ,MARIA MARGARITA CABUTO HERRERA
1202,12,8,FS X MEXICO,0,ERNESTINA FIDEL PANCHO,YAJAHIRA CRUZ AVILA
1211,12,9,PAN,0,JAIME LUIS COLON GARCIA,ALFREDO CAMPOS TABAREZ
1212,12,9,PRI,0,JAIME LUIS COLON GARCIA,ALFREDO CAMPOS TABAREZ
1213,12,9,PRD,0,JAIME LUIS COLON GARCIA,ALFREDO CAMPOS TABAREZ
1214,12,9,PVEM,0,IRIS ITALIA PEÑALOSA GUTIERREZ,ANAY GRISEL RAMIREZ ELIZONDO
1215,12,9,PT,0,SONIA SOFIA GALEANA LARA,ARMIDA LOPEZ LOZANO
1216,12,9,MOVIMIENTO CIUDADANO,0,ALEXANDER CAMPOS GARCIA,SANTIAGO BASILIO CELESTINO
1217,12,9,MORENA,1,MARIA DEL ROSARIO MERLIN GARCIA,ANY SANCHEZ PINEDA
1218,12,9,PES,0,ALFREDO FLORES LEON,JOSE LUIS TORRES HERRERA
1219,12,9,RSP,0,CARLOS CIENFUEGOS MILIAN,NAZARIO SIMON NAVARRETE
1220,12,9,FS X MEXICO,0,ANA LILIA PINACHO QUITERIO,ADELFA MORGAN SAGUILAN
1225,13,1,PAN,1,SAYONARA VARGAS RODRIGUEZ,ANABEL MATEOS SANCHEZ
1226,13,1,PRI,1,SAYONARA VARGAS RODRIGUEZ,ANABEL MATEOS SANCHEZ
1227,13,1,PRD,1,SAYONARA VARGAS RODRIGUEZ,ANABEL MATEOS SANCHEZ
1228,13,1,PVEM,0,FORTUNATO RIVERA CASTILLO,GERARDO GUTIERREZ NAVA
1229,13,1,PT,0,FORTUNATO RIVERA CASTILLO,GERARDO GUTIERREZ NAVA
1230,13,1,MOVIMIENTO CIUDADANO,0,MAXIMINO DE JESUS RIVERA CASTILLO,ANTONINO AGUADO ESCAMILLA
1231,13,1,MORENA,0,FORTUNATO RIVERA CASTILLO,GERARDO GUTIERREZ NAVA
1232,13,1,PES,0,OMAR ZERON CASTAÑON,CARLOS GARCIA ROMERO
1233,13,1,RSP,0,BETZUA SUJHARINY LASTRA PORTILLA,IRIS GALVAN LASTRA
1234,13,1,FS X MEXICO,0,DULCE MARIA QUIJANO CRESPO,DALIA ITZEL DE LA CRUZ RUANO
1243,13,2,PAN,0,GIOVANI GONZALEZ SEVERO,JUAN DE DIOS HERNANDEZ CHAVEZ
1244,13,2,PRI,0,GIOVANI GONZALEZ SEVERO,JUAN DE DIOS HERNANDEZ CHAVEZ
1245,13,2,PRD,0,GIOVANI GONZALEZ SEVERO,JUAN DE DIOS HERNANDEZ CHAVEZ
1246,13,2,PVEM,1,CIRIA YAMILE SALOMON DURAN,HONORINA HERNANDEZ JUAREZ
1247,13,2,PT,1,CIRIA YAMILE SALOMON DURAN,HONORINA HERNANDEZ JUAREZ
1248,13,2,MOVIMIENTO CIUDADANO,0,ITZEL MARTINEZ OLGUIN,ELENA ORTIZ ORTIZ
1249,13,2,MORENA,1,CIRIA YAMILE SALOMON DURAN,HONORINA HERNANDEZ JUAREZ
1250,13,2,PES,0,GERARDO ALVAREZ GOMEZ,DIEGO ALBERTO GARCIA CORTES
1251,13,2,RSP,0,SILVIANA GUERRERO TREJO,PAOLA MARTIN VENTURA
1252,13,2,FS X MEXICO,0,HORTENCIA MARTINEZ OLIVARES,MARIA GUADALUPE PALMA SIMON
1261,13,3,PAN,0,HECTOR CHAVEZ RUIZ,JAIME GALINDO UGALDE
1262,13,3,PRI,0,HECTOR CHAVEZ RUIZ,JAIME GALINDO UGALDE
1263,13,3,PRD,0,HECTOR CHAVEZ RUIZ,JAIME GALINDO UGALDE
1264,13,3,PVEM,0,ANDREY NITGARD CRUZ HERNANDEZ,GILBERTO RAMIREZ GALARZA
1265,13,3,PT,0,LUZ MARIA DE LA PAZ HERNANDEZ GARCIA,JOSEFINA BADILLO BADILLO
1266,13,3,MOVIMIENTO CIUDADANO,0,VICTOR HUGO CIENFUEGOS JIMENEZ,JORGE ACOSTA JIMENEZ
1267,13,3,MORENA,1,SANDRA SIMEY OLVERA BAUTISTA,YOLIS JIMENEZ RAMIREZ
1268,13,3,PES,0,JORGE ADRIAN ORDAZ MONROY,ARNOLD ABRAHAM MEJIA ORTIZ
1269,13,3,RSP,0,MARIA DE JESUS GARCIA VELAZQUEZ,OLIVIA PEREZ PORTILLO
1270,13,3,FS X MEXICO,0,FELIPE LABASTIDA DOMINGUEZ,EULALIO MORALES ZEPEDA
1275,13,4,PAN,0,BENITA MANILLA MARTINEZ,EMILSE MIRANDA MUNIVE
1276,13,4,PRI,0,BENITA MANILLA MARTINEZ,EMILSE MIRANDA MUNIVE
1277,13,4,PRD,0,BENITA MANILLA MARTINEZ,EMILSE MIRANDA MUNIVE
1278,13,4,PVEM,1,MARIA ISABEL ALFARO MORALES,LIRIO MIRANDA CRUZ
1279,13,4,PT,1,MARIA ISABEL ALFARO MORALES,LIRIO MIRANDA CRUZ
1280,13,4,MOVIMIENTO CIUDADANO,0,ERIKA DEL CARMEN TELLO ARENAS,REBECA OROZCO ELIAS
1281,13,4,MORENA,1,MARIA ISABEL ALFARO MORALES,LIRIO MIRANDA CRUZ
1282,13,4,PES,0,VIOLETA GUARNEROS CERVANTES,GRECIA DENIS HERNANDEZ ORTIZ
1283,13,4,RSP,0,ROSALVA MIMILA OLVERA,ARIADNA ESCALERA JARILLO
1284,13,4,FS X MEXICO,0,AARON JIMENEZ HERNANDEZ,JUAN MANUEL GARCIA MAYORGA
1293,13,5,PAN,0,IRENE SOTO VALVERDE,MARIELA LUNA PAREDES
1294,13,5,PRI,0,IRENE SOTO VALVERDE,MARIELA LUNA PAREDES
1295,13,5,PRD,0,IRENE SOTO VALVERDE,MARIELA LUNA PAREDES
1296,13,5,PVEM,1,CUAUHTEMOC OCHOA FERNANDEZ,VERONICA MONROY ELIZALDE
1297,13,5,PT,1,CUAUHTEMOC OCHOA FERNANDEZ,VERONICA MONROY ELIZALDE
1298,13,5,MOVIMIENTO CIUDADANO,0,BLAS ALONSO BARBOSA LOPEZ,SEBASTIAN OGANDO MEJIA
1299,13,5,MORENA,1,CUAUHTEMOC OCHOA FERNANDEZ,VERONICA MONROY ELIZALDE
1300,13,5,PES,0,MARIA DE LA LUZ BECERRA OLVERA,ANGELES ITZEL HERNANDEZ FLORES
1301,13,5,RSP,0,GUILLERMO TREJO RUIZ,POMPEYO AGUILAR ORTIZ
1302,13,5,FS X MEXICO,0,JOSE ALBERTO MARTINEZ GUZMAN,LUIS ADAN RODRIGUEZ DOMINGUEZ
1311,13,6,PAN,0,BENJAMIN PILAR RICO MORENO,GLORIA ROMERO LEON
1312,13,6,PRI,0,BENJAMIN PILAR RICO MORENO,GLORIA ROMERO LEON
1313,13,6,PRD,0,BENJAMIN PILAR RICO MORENO,GLORIA ROMERO LEON
1314,13,6,PVEM,1,LIDIA GARCIA ANAYA,ELIZANDRA HERNANDEZ GARCIA
1315,13,6,PT,1,LIDIA GARCIA ANAYA,ELIZANDRA HERNANDEZ GARCIA
1316,13,6,MOVIMIENTO CIUDADANO,0,OLGA MONTUFAR CONTRERAS,GUILLERMINA OLGUIN SOMILLEDA
1317,13,6,MORENA,1,LIDIA GARCIA ANAYA,ELIZANDRA HERNANDEZ GARCIA
1318,13,6,PES,0,ALBERTO MARGARITO OSORIO ALDAPE,MIGUEL ALFONSO LOPEZ DE LA FUENTE SALINAS
1319,13,6,RSP,0,JESUS EDUARDO PEREZ CERVANTES,BIBIANA DEL CARMEN HERNANDEZ NAVEJAS
1320,13,6,FS X MEXICO,0,ARIADNA PENELOPE APODACA SINSEL,MARIELA SARAI GARCIA SOLIS
1329,13,7,PAN,0,HECTOR MENESES ARRIETA,EDUARDO JAVIER BAÑOS PEREZ
1330,13,7,PRI,0,HECTOR MENESES ARRIETA,EDUARDO JAVIER BAÑOS PEREZ
1331,13,7,PRD,0,HECTOR MENESES ARRIETA,EDUARDO JAVIER BAÑOS PEREZ
1332,13,7,PVEM,0,NADIA CAROLINA RUIZ MARTINEZ,LIDIA BRICEIDA VARGAS VILLAVICENCIO
1333,13,7,PT,0,GLORIA OMAÑA ESPINOSA,LUZ ELENA ESTRADA UBILLA
1334,13,7,MOVIMIENTO CIUDADANO,0,VIANET HERNANDEZ NOLASCO,YURIHTZY ARRIETA OROZCO
1335,13,7,MORENA,1,NAVOR ALBERTO ROJAS MANCERA,MIGUEL ANGEL PEREZ NAVARRETE
1336,13,7,PES,0,ALMA DELIA HERNANDEZ MATA,MARIA FERNANDA PUENTES ISLAS
1337,13,7,RSP,0,ROMAN ADALBERTO JUAREZ LOPEZ,GEOVANNI ZURIEL CASTILLO VARGAS
1338,13,7,FS X MEXICO,0,LILIANA VILLAVICENCIO RUIZ,LILA ELIZABETH REFUGIO LEZAMA ESTRADA
1343,14,1,PAN,1,GUSTAVO MACIAS ZAMBRANO,JOSE ACUÑA RUIZ
1344,14,1,PRI,1,GUSTAVO MACIAS ZAMBRANO,JOSE ACUÑA RUIZ
1345,14,1,PRD,1,GUSTAVO MACIAS ZAMBRANO,JOSE ACUÑA RUIZ
1346,14,1,PVEM,0,MARIA ISABEL DELGADO CORNEJO,KENIA CORONEL ZUÑIGA
1347,14,1,PT,0,MARIA ISABEL DELGADO CORNEJO,KENIA CORONEL ZUÑIGA
1348,14,1,MOVIMIENTO CIUDADANO,0,JUAN GERARDO RUIZ DELGADO,JUAN CARLOS SANCHEZ TORRES
1349,14,1,MORENA,0,MARIA ISABEL DELGADO CORNEJO,KENIA CORONEL ZUÑIGA
1350,14,1,PES,0,MARCELA OROZCO GOMEZ,NORMA ARTEAGA CARRASCO
1351,14,1,RSP,0,MARTIN AVILA RODRIGUEZ,FELIPE DE JESUS JIMENEZ BERNAL
1352,14,1,FS X MEXICO,0,CELIA GONZALEZ PIZ,YALITZA GUZMAN GONZALEZ
1361,14,2,PAN,1,MARTHA ESTELA ROMO CUELLAR,MONICA DEL CARMEN VAZQUEZ HUERTA
1362,14,2,PRI,1,MARTHA ESTELA ROMO CUELLAR,MONICA DEL CARMEN VAZQUEZ HUERTA
1363,14,2,PRD,1,MARTHA ESTELA ROMO CUELLAR,MONICA DEL CARMEN VAZQUEZ HUERTA
1364,14,2,PVEM,0,YARITZA LOPEZ MEDINA,MARIA CRISTINA RAMIREZ TOSTADO
1365,14,2,PT,0,SERGIO PEREZ GONZALEZ,LUIS ALFONSO ALVIZO PINZON
1366,14,2,MOVIMIENTO CIUDADANO,0,EDGAR ALFREDO GONZALEZ CHAVEZ,GERMAN FAUSTO NUÑEZ FLORES
1367,14,2,MORENA,0,OLIVIA GUILLEN PADILLA,KARINA PAOLA FRIAS HERNANDEZ
1368,14,2,PES,0,EVELIA HERNANDEZ PARADA,OLGA ELIDIA ANDRADE MACIAS
1369,14,2,RSP,0,EPIFANIA SOCORRO VAZQUEZ FIGUEROA,SEELENE SUGEY ALVAREZ RAMIREZ
1370,14,2,FS X MEXICO,0,MARCELA ADRIANA MARTINEZ VALDIVIA,CLAUDIA ISABEL MUÑOZ ARRIAGA
1375,14,3,PAN,1,DESIDERIO TINAJERO ROBLES,JUAN ANTONIO GONZALEZ VELAZQUEZ
1376,14,3,PRI,1,DESIDERIO TINAJERO ROBLES,JUAN ANTONIO GONZALEZ VELAZQUEZ
1377,14,3,PRD,1,DESIDERIO TINAJERO ROBLES,JUAN ANTONIO GONZALEZ VELAZQUEZ
1378,14,3,PVEM,0,ESCARLETH MARIEL ARECHIGA GUTIERREZ,MARIANA TORRES ECHEVERRIA
1379,14,3,PT,0,EDUARDO GONZALEZ RUBIO GUERRERO,HUGO ADALBERTO GOMEZ GOMEZ
1380,14,3,MOVIMIENTO CIUDADANO,0,HECTOR HUGO BRAVO HERNANDEZ,YADIRA DEL CARMEN GUZMAN ALVIZO
1381,14,3,MORENA,0,RODRIGO MERCADO IBARRA,ENRIQUE MELANO CORTES
1382,14,3,PES,0,MARIA DOLORES JIMENEZ ORNELAS,LAURA GUADALUPE PEREZ MEZA
1383,14,3,RSP,0,JOSE LUIS RODRIGUEZ GARCIA,ALEJANDRA RIVERA MERCADO
1384,14,3,FS X MEXICO,0,JOSE LUIS VALLE MAGAÑA,YOLANDA ELIZABETH TORRES CASTILLON
1389,14,4,PAN,0,EDGAR LEOPOLDO CORTES MONTES DE OCA,LAURA ELIZABETH HURTADO RUIZ
1390,14,4,PRI,0,EDGAR LEOPOLDO CORTES MONTES DE OCA,LAURA ELIZABETH HURTADO RUIZ
1391,14,4,PRD,0,EDGAR LEOPOLDO CORTES MONTES DE OCA,LAURA ELIZABETH HURTADO RUIZ
1392,14,4,PVEM,0,RAUL ALVAREZ VILLASEÑOR,SERGIO HERNANDEZ GONZALEZ
1393,14,4,PT,0,RAUL ALVAREZ VILLASEÑOR,SERGIO HERNANDEZ GONZALEZ
1394,14,4,MOVIMIENTO CIUDADANO,1,TAYGETE IRISAY RODRIGUEZ GONZALEZ,ELIZABETH CERVANTES TORRES
1395,14,4,MORENA,0,RAUL ALVAREZ VILLASEÑOR,SERGIO HERNANDEZ GONZALEZ
1396,14,4,PES,0,SOFIA CARDENAS PINEDA,VERONICA LETICIA CAMARENA SANTILLAN
1397,14,4,RSP,0,PABLO ALFONSO CORTES HERNANDEZ,ISRAEL DAVID ALVAREZ SOLIS
