ord,edon,disn,part,dwon,propietario,suplente
1,1,1,PAN,1,NOEL MATA ATILANO,ARNULFO FEDERICO VARGAS GOMEZ
2,1,1,PRI,1,NOEL MATA ATILANO,ARNULFO FEDERICO VARGAS GOMEZ
3,1,1,PRD,1,NOEL MATA ATILANO,ARNULFO FEDERICO VARGAS GOMEZ
4,1,1,PVEM,0,CLAUDIA BRISEIDA CHAVEZ RAMIREZ,MELANNIE ITZAYANA REYES MARTINEZ
5,1,1,PT,0,JUAN MANUEL DE LOERA MARQUEZ,LILIA RODRIGUEZ GUERRERO
6,1,1,MOVIMIENTO CIUDADANO,0,NORMA ISABEL ZAMORA RODRIGUEZ,LUZ MARIA PADILLA DE LUNA
7,1,1,MORENA,0,RAFAEL CALDERON ZAMARRIPA,JUAN JOSE RUIZ ESCOBAR
8,1,1,PES,0,MARTHA ESPERANZA CAMPOS ZAMBRANO,PATRICIA MUÑOZ RAMIREZ
9,1,1,RSP,0,JORGE EMIR CRAVIOTO QUEZADA,FRANCISCO GERARDO FLORES CORREA
10,1,1,FS X MEXICO,0,PATRICIA DEL CARMEN RAMIREZ DE LARA,CLAUDIA MARGARITA GOMEZ GARCIA
11,1,2,PAN,1,MONICA BECERRA MORENO,LAURA PATRICIA AHEDO BARCENAS
12,1,2,PRI,0,ROBERTO LAMAS DE ALBA,ALEJANDRO LENIN RUELAS CALDERON
13,1,2,PRD,0,LUIS ERNESTO GUTIERREZ BERDEJA,EDGAR ALAN LUEVANO NUÑEZ
14,1,2,PVEM,0,ELBA LORENA TORRES DIAZ,PAMELA RESENDIZ LOPEZ
15,1,2,PT,0,ELBA LORENA TORRES DIAZ,PAMELA RESENDIZ LOPEZ
16,1,2,MOVIMIENTO CIUDADANO,0,PAOLA NADINE CORTES CALZADA,ITZEL IVVETHE TELLEZ MARMOLEJO
17,1,2,MORENA,0,ELBA LORENA TORRES DIAZ,PAMELA RESENDIZ LOPEZ
18,1,2,PES,0,VERONICA DAMARIS DIAZ RAMIREZ,LUCIA JANETTE NUÑEZ GALLEGOS
19,1,2,RSP,0,TEODULO NUÑEZ LEAÑOS,JULIO AMADOR RODRIGUEZ
20,1,2,FS X MEXICO,0,CECILIA ARLETTE HERNANDEZ TAPIA,ANA GALVAN GUERRERO
21,1,3,PAN,1,PAULO GONZALO MARTINEZ LOPEZ,JOSE DE JESUS ORTIZ DOMINGUEZ
22,1,3,PRI,0,LUIS FRANCISCO GERARDO PONCE MORAN,JUAN CARLOS LOPEZ HERNANDEZ
23,1,3,PRD,0,SUSAN ANY MUÑOZ RODRIGUEZ,SILVIA ARELI LOPEZ RAMIREZ
24,1,3,PVEM,0,AIDA KARINA BANDA IGLESIAS,LOURDES YOLANDA HERNANDEZ MUÑOZ
25,1,3,PT,0,AIDA KARINA BANDA IGLESIAS,LOURDES YOLANDA HERNANDEZ MUÑOZ
26,1,3,MOVIMIENTO CIUDADANO,0,FRANCE SVETLANA FARIAS CARRILLO,PATRICIA VALADEZ BUSTAMANTE
27,1,3,MORENA,0,AIDA KARINA BANDA IGLESIAS,LOURDES YOLANDA HERNANDEZ MUÑOZ
28,1,3,PES,0,DAVID PEREZ CALLEJA,PATRICIA MIROSLAVA DIAZ GONZALEZ
29,1,3,RSP,0,ANA LILIA MUÑOZ ARMENTA,LADY DIANA SILVA MUÑOZ
30,1,3,FS X MEXICO,0,MARIA FERNANDA CAMPOS ATRISTAIN,MARIA GEORGINA RODRIGUEZ TORRES
31,2,1,PAN,0,HECTOR GUZMAN HERNANDEZ,EDWVIGES PIO RODRIGUEZ
32,2,1,PRI,0,HECTOR GUZMAN HERNANDEZ,EDWVIGES PIO RODRIGUEZ
33,2,1,PRD,0,HECTOR GUZMAN HERNANDEZ,EDWVIGES PIO RODRIGUEZ
34,2,1,PVEM,1,YESSENIA LETICIA OLUA GONZALEZ,ROSSY STEPHANIE GOMEZ REYES
35,2,1,PT,1,YESSENIA LETICIA OLUA GONZALEZ,ROSSY STEPHANIE GOMEZ REYES
36,2,1,MOVIMIENTO CIUDADANO,0,JOSE LUIS MEJIA OJEDA,JUAN MANUEL MANRIQUEZ
37,2,1,MORENA,1,YESSENIA LETICIA OLUA GONZALEZ,ROSSY STEPHANIE GOMEZ REYES
38,2,1,PES,0,RUMUALDO LEONEL SILVA RIVERA,FRANCISCO JAVIER ARIAS LEON
39,2,1,RSP,0,AVELINO EDUARDO RUIZ ESQUER,JOSE ANTONIO ARCE DUARTE
40,2,1,FS X MEXICO,0,DANIELA LOPEZ GUZMAN,YADIRA GUADALUPE FISCAL ENRIQUEZ
41,2,2,PAN,0,MARIA TERESA BABUN VILLARREAL,EDNA LAURA VIDALES GARCIA
42,2,2,PRI,0,VICTOR MANUEL SANCHEZ SAENZ,NELLY HERMINIA BARCENA SANCHEZ
43,2,2,PRD,0,JOSE LUIS AGUIRRE BLANCAS,DIANA ELENA MORENO TIRADO
44,2,2,PVEM,0,LEXY YULIANA YAÑEZ LAMAS,ALMA GABRIELA RAMIREZ GIRON
45,2,2,PT,0,HORTENCIA MEZA CASTRO,SORAYA ANABEL COBOS CERVANTES
46,2,2,MOVIMIENTO CIUDADANO,0,EDNA PAULINA GUTIERREZ RUBALCAVA,SANDRA PEREZ CASTRO
47,2,2,MORENA,1,JULIETA ANDREA RAMIREZ PADILLA,MICHELLE ALEJANDRA TEJEDA MEDINA
48,2,2,PES,0,JOSE JUAN CONTRERAS SALCEDO,RICARDO SANDOVAL CHON
49,2,2,RSP,0,ROSA MARIA ACUÑA ARVIZU,MIRIAM GUADALUPE GONZALEZ JUAREZ
50,2,2,FS X MEXICO,0,PATRICIA SOSA CASTELLANOS,GABRIELA ARREOLA MEDRANO
51,2,3,PAN,0,JOHANNA ESTHELA CHAVEZ JACINTO,ROSARIO DEL CARMEN LUNA LOPEZ
52,2,3,PRI,0,JOHANNA ESTHELA CHAVEZ JACINTO,ROSARIO DEL CARMEN LUNA LOPEZ
53,2,3,PRD,0,JOHANNA ESTHELA CHAVEZ JACINTO,ROSARIO DEL CARMEN LUNA LOPEZ
54,2,3,PVEM,1,ARMANDO REYES LEDESMA,MIGUEL ANGEL PIÑA AGUILAR
55,2,3,PT,1,ARMANDO REYES LEDESMA,MIGUEL ANGEL PIÑA AGUILAR
56,2,3,MOVIMIENTO CIUDADANO,0,COLUMBA DOMINGUEZ DELGADILLO,ASTRID DAFNE MONROY LIZARRAGA
57,2,3,MORENA,1,ARMANDO REYES LEDESMA,MIGUEL ANGEL PIÑA AGUILAR
58,2,3,PES,0,PAMELA CASTRO FIGUEROA,SOLEDAD GUADALUPE LOYA LARA
59,2,3,RSP,0,HUGO ENRIQUE SANCHEZ VILLEGAS,GUSTAVO RAMIREZ ZAMORA
60,2,3,FS X MEXICO,0,ALEJANDRA GUTIERREZ CASTRO,ROSELA MEDINA LENCIONI
61,2,4,PAN,0,HORTENSIA HERNANDEZ MENDOZA,RAFAELA JOCOBI YOCUPICIO
62,2,4,PRI,0,HORTENSIA HERNANDEZ MENDOZA,RAFAELA JOCOBI YOCUPICIO
63,2,4,PRD,0,HORTENSIA HERNANDEZ MENDOZA,RAFAELA JOCOBI YOCUPICIO
64,2,4,PVEM,0,LUIS ARTURO GONZALEZ CRUZ,CARLOS MURGUIA MEJIA
65,2,4,PT,0,TANIA GUADALUPE GUERRERO MENA,MAYRA SOLEDAD LOPEZ GARCIA
66,2,4,MOVIMIENTO CIUDADANO,0,XOCHILT DE LABRA MONREAL,ESTHER BAEZ VALDIVIA
67,2,4,MORENA,1,SOCORRO IRMA ANDAZOLA GOMEZ,MARIA TERESA SAAVEDRA TALAVERA
68,2,4,PES,0,ROSARIO VIRIDIANA ROMAN CARRILLO,JUANA ALICIA VARGAS HERNANDEZ
69,2,4,RSP,0,MIRIAM SUSANA AVALOS GOVEA,YESENIA LOPEZ VICTORINO
70,2,4,FS X MEXICO,0,JOSEFINA ZAVALA GARCIA,GENOVEVA HERNANDEZ VILLA
71,2,5,PAN,0,JAIME CLEOFAS MARTINEZ VELOZ,JOSE LUIS KATO LIZARDI
72,2,5,PRI,0,JAIME CLEOFAS MARTINEZ VELOZ,JOSE LUIS KATO LIZARDI
73,2,5,PRD,0,JAIME CLEOFAS MARTINEZ VELOZ,JOSE LUIS KATO LIZARDI
74,2,5,PVEM,0,JUAN DIEGO BERISTAIN AVILA,CESAR ENRIQUE MANJARREZ NUÑEZ
75,2,5,PT,0,REYNA SOLEDAD RODRIGUEZ BORQUEZ,ELIZABETH FABIOLA NAVARRO RODRIGUEZ
76,2,5,MOVIMIENTO CIUDADANO,0,FARAH RISK MORALES,YANNETH ZERMEÑO DE NIZ
77,2,5,MORENA,1,EVANGELINA MORENO GUERRA,REBECA VALLE HERNANDEZ
78,2,5,PES,0,MANUEL ALEJANDRO FLORES PEREZ,GUSTAVO FERNANDEZ DE LEON
79,2,5,RSP,0,JULIO CESAR DIAZ CARRERA,SERGIO GABRIEL PACHECO RIVERA
80,2,5,FS X MEXICO,0,ALEJANDRA GOMEZ VICENCIO,CARMEN LIZBETH RAMIREZ VERDUGO
81,2,6,PAN,0,JACQUELINE NAVA MOUETT,CLAUDIA YANET BUCIO HERRERA
82,2,6,PRI,0,JACQUELINE NAVA MOUETT,CLAUDIA YANET BUCIO HERRERA
83,2,6,PRD,0,JACQUELINE NAVA MOUETT,CLAUDIA YANET BUCIO HERRERA
84,2,6,PVEM,0,HUGO LEON VALLE,PAULINA MENDEZ GARCILAZO
85,2,6,PT,0,CESAR BENJAMIN RAMIREZ ARIAS,RAFAEL IGNOT MAZABA
86,2,6,MOVIMIENTO CIUDADANO,0,JORGE FRANCISCO GUZMAN MENDEZ,FELIPE ROMAN VAZQUEZ CASTILLO
87,2,6,MORENA,1,HECTOR IRENEO MARES COSSIO,FELIPE IGNACIO LAMEIRO MEZA
88,2,6,PES,0,RODOLFO OLIMPO HERNANDEZ BOJORQUEZ,OCTAVIO JAVIER CORONA FLORES
89,2,6,RSP,0,NUBIA PALOMARES ROMO,ROSANGELA JIMENEZ NIETO
90,2,6,FS X MEXICO,0,MARIA DE JESUS RIVERA RAMIREZ,PAOLA WENDOLIN HERRERA LOPEZ
91,2,7,PAN,0,CELESTINO SALCEDO FLORES,HECTOR BOJORQUEZ QUINTERO
92,2,7,PRI,0,CELESTINO SALCEDO FLORES,HECTOR BOJORQUEZ QUINTERO
93,2,7,PRD,0,CELESTINO SALCEDO FLORES,HECTOR BOJORQUEZ QUINTERO
94,2,7,PVEM,1,JUAN ISAIAS BERTIN SANDOVAL,LUIS MIGUEL BUENROSTRO MARTIN
95,2,7,PT,1,JUAN ISAIAS BERTIN SANDOVAL,LUIS MIGUEL BUENROSTRO MARTIN
96,2,7,MOVIMIENTO CIUDADANO,0,FELIPE DE JESUS MAYORAL MAYORAL,FERNANDO PARRA VALLADOLID
97,2,7,MORENA,1,JUAN ISAIAS BERTIN SANDOVAL,LUIS MIGUEL BUENROSTRO MARTIN
98,2,7,PES,0,MARIA GUADALUPE BARRAZA CHIQUETE,BRENDA ARACELI CASTRO ANGULO
99,2,7,RSP,0,ALEJANDRA NICOLE ROMERO CORRAL,ALBA CELESTE RUIZ RODRIGUEZ
100,2,7,FS X MEXICO,0,JANNET YOLANDA DE JESUS PERALTA GONZALEZ,CATALINA CERVANTES HERNANDEZ
101,2,8,PAN,0,IGNACIO ANAYA BARRIGUETE,MANUEL MAURICIO MARTINEZ FLORES
102,2,8,PRI,0,IGNACIO ANAYA BARRIGUETE,MANUEL MAURICIO MARTINEZ FLORES
103,2,8,PRD,0,IGNACIO ANAYA BARRIGUETE,MANUEL MAURICIO MARTINEZ FLORES
104,2,8,PVEM,1,FAUSTO GALLARDO GARCIA,DAVID EMILIANO HERNANDEZ VILLELA
105,2,8,PT,1,FAUSTO GALLARDO GARCIA,DAVID EMILIANO HERNANDEZ VILLELA
106,2,8,MOVIMIENTO CIUDADANO,0,SIN CANDIDATURA,MONICA LORENA GARCIA MARTINEZ
107,2,8,MORENA,1,FAUSTO GALLARDO GARCIA,DAVID EMILIANO HERNANDEZ VILLELA
108,2,8,PES,0,RICARDO CANO CASTRO,ALEJANDRO ANDONAEGUI GALLEGOS
109,2,8,RSP,0,JESUS ISMAEL MARTINEZ PEREZ,OSCAR TENIS BADILLO
110,2,8,FS X MEXICO,0,JESUS ADRIANA BAEZ GERARDO,YOALI ITZEL NUÑEZ MARTINEZ
111,3,1,PAN,0,MARCO ANTONIO ALMENDARIZ PUPPO,ALEJANDRO ALONSO SOLIS LOPEZ
112,3,1,PRI,0,MARCO ANTONIO ALMENDARIZ PUPPO,ALEJANDRO ALONSO SOLIS LOPEZ
113,3,1,PRD,0,MARCO ANTONIO ALMENDARIZ PUPPO,ALEJANDRO ALONSO SOLIS LOPEZ
114,3,1,PVEM,1,MA MERCEDES MACIEL ORTIZ,MARIA DEL PILAR COSIO LUCERO
115,3,1,PT,1,MA MERCEDES MACIEL ORTIZ,MARIA DEL PILAR COSIO LUCERO
116,3,1,MOVIMIENTO CIUDADANO,0,RAMIRO RUIZ FLORES,ERNESTO MANUEL ALTAMIRANO SOLANO
117,3,1,MORENA,1,MA MERCEDES MACIEL ORTIZ,MARIA DEL PILAR COSIO LUCERO
118,3,1,PES,0,OSCAR HIGUERA MURILLO,ADRIAN GREGORIO DIAZ RAMOS
119,3,1,RSP,0,JUAN CARLOS JIMENEZ FUENTES,JUAN CARLOS MEDINA RAMOS
120,3,1,FS X MEXICO,0,SIN CANDIDATURA,SIN CANDIDATURA
121,3,2,PAN,0,SUSANA DEL CARMEN ZATARAIN GARCIA,FRANCIS ALEJANDRA DORING MENDOZA
122,3,2,PRI,0,SUSANA DEL CARMEN ZATARAIN GARCIA,FRANCIS ALEJANDRA DORING MENDOZA
123,3,2,PRD,0,SUSANA DEL CARMEN ZATARAIN GARCIA,FRANCIS ALEJANDRA DORING MENDOZA
124,3,2,PVEM,1,ALFREDO PORRAS DOMINGUEZ,JESUS ANDRES ACOSTA MOYRON
125,3,2,PT,1,ALFREDO PORRAS DOMINGUEZ,JESUS ANDRES ACOSTA MOYRON
126,3,2,MOVIMIENTO CIUDADANO,0,NORMA IGNACIA RIVERA GONZALEZ,SASHA DENISSE ANGULO MARTINEZ
127,3,2,MORENA,1,ALFREDO PORRAS DOMINGUEZ,JESUS ANDRES ACOSTA MOYRON
128,3,2,PES,0,LORENIA LINETH MONTAÑO RUIZ,ESTHER GUERRERO RIOS
129,3,2,RSP,0,SUHEIDI YADIRA DIAZ PANTALEON,LIDIA YAZMIN OREGON VILLANUEVA
130,3,2,FS X MEXICO,0,GUADALUPE MUNGUIA AVILES,MARIA ELENA GONZALEZ ROMERO
131,4,1,PAN,0,ANA MARTHA ESCALANTE CASTILLO,PATRICIA IRENE CHABLE CEN
132,4,1,PRI,0,ANA MARTHA ESCALANTE CASTILLO,PATRICIA IRENE CHABLE CEN
133,4,1,PRD,0,ANA MARTHA ESCALANTE CASTILLO,PATRICIA IRENE CHABLE CEN
134,4,1,PVEM,0,ELSA JOAQUINA CASTILLO GOMEZ,BRENDA ALICIA RUIZ HERNANDEZ
135,4,1,PT,0,ANTONIO GOMEZ SAUCEDO,JOSE SANTOS FELICIANO CHAN CHI
136,4,1,MOVIMIENTO CIUDADANO,0,CLAUDIA DE MONTSERRAT VALLADARES GUZMAN,ROSLYN ODELING CUEVAS URIBE
137,4,1,MORENA,1,JOSE LUIS FLORES PACHECO,GRISEL OKAIRI CUTZ GOMEZ
138,4,1,PES,0,ANGELICA MARIA REYES DOMINGUEZ,ROSA ALVA REYES DOMINGUEZ
139,4,1,RSP,0,MARCOS ALBERTO PINZON CHARLES,MARCO ANTONIO GONZALEZ DELGADO
140,4,1,FS X MEXICO,0,LORENA DEL JESUS NOVELO RODRIGUEZ,MARIA JUDITH DEL CARMEN RUIZ ESPARZA PINTO
141,4,2,PAN,0,SALVADOR FARIAS GONZALEZ,JOSE DEL CARMEN URUETA MOHA
142,4,2,PRI,0,SALVADOR FARIAS GONZALEZ,JOSE DEL CARMEN URUETA MOHA
143,4,2,PRD,0,SALVADOR FARIAS GONZALEZ,JOSE DEL CARMEN URUETA MOHA
144,4,2,PVEM,0,RUBISEL DEL ANGEL ESCOBEDO CASTILLO,MANUEL ANDRES HAU DZUL
145,4,2,PT,0,TEIDA GARCIA CORDOVA,YOLANDA RAMIREZ ADAN
146,4,2,MOVIMIENTO CIUDADANO,0,ANA CARMEN ONGAY REYES,TERESITA DE LA PARRA ISLA
147,4,2,MORENA,1,MARIA SIERRA DAMIAN,LAURA ERENDIRA PEREZ FLORES
148,4,2,PES,0,GUSTAVO DEL RIVERO LASTRA,ANGEL DAVID PEREZ MEDINA
149,4,2,RSP,0,ADAZA ELIZABETH RIVERA ALONZO,ANGELICA DEL CARMEN NOTARIO HERNANDEZ
150,4,2,FS X MEXICO,0,ENRIQUE PASTOR CRUZ CARRANZA,GLADYS ROMERO EZAETA
151,5,1,PAN,0,GUILLERMO ARTURO SANCHEZ GARCIA,JORGE ANTONIO MALTOS VILLARREAL
152,5,1,PRI,0,MARCOS VILLAREAL SUDAY,RAUL ALEJANDRO VELA ERHARD
153,5,1,PRD,0,CARMEN VELA IBARRA,KARLA PATRICIA VELA SANCHEZ
154,5,1,PVEM,1,BRIGIDO RAMIRO MORENO HERNANDEZ,EVARISTO LENIN PEREZ TALAMAS
155,5,1,PT,1,BRIGIDO RAMIRO MORENO HERNANDEZ,EVARISTO LENIN PEREZ TALAMAS
156,5,1,MOVIMIENTO CIUDADANO,0,VANESSA ALEMAN IBARRA,GABRIELA LOPEZ DE LA CRUZ
157,5,1,MORENA,1,BRIGIDO RAMIRO MORENO HERNANDEZ,EVARISTO LENIN PEREZ TALAMAS
158,5,1,PES,0,MARCO ANTONIO MARTINEZ LARA,PABLO CARDENAS VAZQUEZ
159,5,1,RSP,0,BLANCA LUCIA ESTRADA MENDOZA,HEIDY ESCOBEDO VELAZQUEZ
160,5,1,FS X MEXICO,0,DAMARIS ESTHER TAMEZ DOMINGUEZ,PAULETT MARCELA MORENO MALDONADO
161,5,2,PAN,0,MARCELA CASTELLANOS RENTERIA,DELIA MARINA RUIZ PEREZ
162,5,2,PRI,0,GLADYS AYALA FLORES,BRENDA CECILIA GUERECA HERNANDEZ
163,5,2,PRD,0,ROSA MARIA ROCHA DOMINGUEZ,CECILIA TERCERO ADAME
164,5,2,PVEM,1,FRANCISCO JAVIER BORREGO ADAME,JORGE ARTURO VALDES FLORES
165,5,2,PT,1,FRANCISCO JAVIER BORREGO ADAME,JORGE ARTURO VALDES FLORES
166,5,2,MOVIMIENTO CIUDADANO,0,ROSA MARIA GUADALUPE RANGEL PADILLA,JAZMIN ADANARY TOVAR RUIZ
167,5,2,MORENA,1,FRANCISCO JAVIER BORREGO ADAME,JORGE ARTURO VALDES FLORES
168,5,2,PES,0,MIGUEL ANGEL SERRATO FERNANDEZ,JUAN JOSE DE LA CRUZ CABRERA
169,5,2,RSP,0,VIVIANA ISELA ANTUNA RODRIGUEZ,ZAIDA YANETH HERRERA ESPARZA
170,5,2,FS X MEXICO,0,GRECIA ARACELY HERNANDEZ REVELES,MA DE LOURDES SANCHEZ GALLEGOS
171,5,3,PAN,0,JESUS ALFREDO PAREDES LOPEZ,MAURILIO ROMO RODRIGUEZ
172,5,3,PRI,1,CRISTINA AMEZCUA GONZALEZ,ALMA PATRICIA CARDONA ORTIZ
173,5,3,PRD,0,DAVID ALAN RAMOS VIRUETE,JESUS HUMBERTO GOMEZ RAMOS
174,5,3,PVEM,0,MELBA NELIA FARIAS ZAMBRANO,MA ESTHER HERRERA VENTURA
175,5,3,PT,0,MELBA NELIA FARIAS ZAMBRANO,MA ESTHER HERRERA VENTURA
176,5,3,MOVIMIENTO CIUDADANO,0,OSCAR ROMEO MALDONADO DOMINGUEZ,MIGUEL ANGEL ZAPATA VIERA
177,5,3,MORENA,0,MELBA NELIA FARIAS ZAMBRANO,MA ESTHER HERRERA VENTURA
178,5,3,PES,0,ADORACION MARIA GUADALUPE DE LA TORRE GARZA,VELIA NATIVIDAD VALDES PEREZ
179,5,3,RSP,0,DIANA LAURA SILVA TRUJILLO,MA DEL ROSARIO GARCIA RENDON
180,5,3,FS X MEXICO,0,MARIA CAROLINA DE LAS MERCEDES GONZALEZ ADAN,MA TERESA DE JESUS CANTU GARZA
181,5,4,PAN,0,ESTHER QUINTANA SALINAS,ATALA CONSUELO SANCHEZ MURILLO
182,5,4,PRI,1,YERICO ABRAMO MASSO,SALVADOR DAVILA SANCHEZ
183,5,4,PRD,0,ALFREDO MARTINEZ GUAJARDO,ADRIAN RICARDO VIRGEN AVALOS
184,5,4,PVEM,0,DIEGO EDUARDO DEL BOSQUE VILLARREAL,ROSAURA MONROY BECERRIL
185,5,4,PT,0,DIEGO EDUARDO DEL BOSQUE VILLARREAL,ROSAURA MONROY BECERRIL
186,5,4,MOVIMIENTO CIUDADANO,0,RICARDO ARTURO NAJERA FRANCO,MIGUEL ENRIQUE AGUILERA RODRIGUEZ
187,5,4,MORENA,0,DIEGO EDUARDO DEL BOSQUE VILLARREAL,ROSAURA MONROY BECERRIL
188,5,4,PES,0,SONIA ANGELICA GUERRERO ALMARAZ,MARYSOL ALEJANDRA CEPEDA MARTINEZ
189,5,4,RSP,0,VERONICA ELIZABETH HERNANDEZ BECERRA,SIN CANDIDATURA
190,5,4,FS X MEXICO,0,BLANCA CECILIA LOPEZ RIVERA,MARIA MAGDALENA PECINA MERAZ
191,5,5,PAN,0,JORGE ZERMEÑO INFANTE,ROGELIO ANTONIO CUELLAR GARCIA
192,5,5,PRI,1,JOSE ANTONIO GUTIERREZ JARDON,IRMA LETICIA CASTAÑO OROZCO
193,5,5,PRD,0,MARIA CRISTINA BETANCOURT GARCIA,NATALIA MURRA NUÑEZ
194,5,5,PVEM,0,ANTONIO ATTOLINI MURRA,SANTIAGO CADENA VIESCA
195,5,5,PT,0,ANTONIO ATTOLINI MURRA,SANTIAGO CADENA VIESCA
196,5,5,MOVIMIENTO CIUDADANO,0,JAVIER ANTONIO HANDAL CASTILLO,EMILIANO OVIEDO LOMAS
197,5,5,MORENA,0,ANTONIO ATTOLINI MURRA,SANTIAGO CADENA VIESCA
198,5,5,PES,0,GANDHI BONERGE VEGA ARGUIJO,JOSE LUIS CUELLO ELIAS
199,5,5,RSP,0,DORIAN ALEJANDRO PERALTA AGUILAR,ERNESTO MARTINEZ CAJERO
200,5,5,FS X MEXICO,0,DILERY MONSERRAT GUTIERREZ VALADEZ,ASENET CHAIREZ HERNANDEZ
201,5,6,PAN,0,FERNANDO IZAGUIRRE VALDES,RAMIRO VEGA REYES
202,5,6,PRI,1,SHAMIR FERNANDEZ HERNANDEZ,TEODORO ARGUIJO HERNANDEZ
203,5,6,PRD,0,PABLO FERNANDEZ LLAMAS,LUIS ANDONI ESQUIVEL AYALA
204,5,6,PVEM,0,ROSA ISELA PIÑA AVILA,GRACIELA COVARRUBIAS CONTLA
205,5,6,PT,0,ROSA ISELA PIÑA AVILA,GRACIELA COVARRUBIAS CONTLA
206,5,6,MOVIMIENTO CIUDADANO,0,ZULEMA ALEJANDRA ALVARADO GARCIA,SUSY TATIANA DURAN PACHECO
207,5,6,MORENA,0,ROSA ISELA PIÑA AVILA,GRACIELA COVARRUBIAS CONTLA
208,5,6,PES,0,LAURA OLIVIA AYALA FABELA,DIANA LAURA DELGADO QUISTIAN
209,5,6,RSP,0,VICTOR FIDENCIO BACA LEYVA,MARTIN RIVERA GARCIA
210,5,6,FS X MEXICO,0,EVANGELINA CHAVEZ RODRIGUEZ,EDNA LIZETTE RIVERA DE LEON
211,5,7,PAN,0,LAURA KARINA RAMIREZ RAMIREZ,MONICA GAYTAN GARCIA
212,5,7,PRI,1,JAIME BUENO ZERTUCHE,SERGIO HERNANDEZ FERRIÑO
213,5,7,PRD,0,JOSE LUIS LOPEZ CEPEDA,JOSE GUADALUPE CHAVEZ VERONICO
214,5,7,PVEM,0,SOFIA FRANCO VILLALOBOS,MARTHA CHARLOTTE GONZALEZ MULLER
215,5,7,PT,0,KARINA SALAS ALVARADO,SANDRA NIDIA CONTRERAS GARCIA
216,5,7,MOVIMIENTO CIUDADANO,0,KARLA GABRIELA CAMPBELL ZETINA,PATRICIA ALEJANDRA DE LA PEÑA VILLARREAL
217,5,7,MORENA,0,DIANA ISABEL HERNANDEZ AGUILAR,CLAUDIA CECILIA ZUÑIGA MONSIVAIS
218,5,7,PES,0,YESENIA LOURDES CARRILLO CAMPOS,ANA LUCIA LOPEZ ARELLANO
219,5,7,RSP,0,RAUL MONSIVAIS GALINDO,SIN CANDIDATURA
220,5,7,FS X MEXICO,0,BARBARA CASTILLO LABORDE,VERONICA FERNANDEZ RIVERA
221,6,1,PAN,1,RIULT RIVERA GUTIERREZ,CRISTIAN EXEQUIEL SUAREZ HEREDIA
222,6,1,PRI,1,RIULT RIVERA GUTIERREZ,CRISTIAN EXEQUIEL SUAREZ HEREDIA
223,6,1,PRD,1,RIULT RIVERA GUTIERREZ,CRISTIAN EXEQUIEL SUAREZ HEREDIA
224,6,1,PVEM,0,SERGIO AGUSTIN MORALES ANGUIANO,ALEJANDRO CABRERA SILVA
225,6,1,PT,0,ANILU SALAZAR MEJIA,ANA GUADALUPE AVILA SANCHEZ
226,6,1,MOVIMIENTO CIUDADANO,0,PATRICIA ALCARAZ PULIDO,MA REMEDIOS OLIVERA OROZCO
227,6,1,MORENA,0,VLADIMIR PARRA BARRAGAN,YAOMAUTZIN OHTOKANI OLVERA LARA
228,6,1,PES,0,BRENDA DEL CARMEN GUTIERREZ VEGA,ILENIA FABIOLA GUTIERREZ VEGA
229,6,1,RSP,0,SABINO HERMILO FLORES ARIAS,GUILLERMO CHANONA GONZALEZ
230,6,1,FS X MEXICO,0,YOLANDA VERDUZCO GUZMAN,ROSA MARIA GONZALEZ ESPIRITU
231,6,2,PAN,0,OSCAR ARMANDO AVALOS VERDUGO,JORGE ARMANDO GAITAN SANCHEZ
232,6,2,PRI,0,OSCAR ARMANDO AVALOS VERDUGO,JORGE ARMANDO GAITAN SANCHEZ
233,6,2,PRD,0,OSCAR ARMANDO AVALOS VERDUGO,JORGE ARMANDO GAITAN SANCHEZ
234,6,2,PVEM,0,RAFAEL MENDOZA GODINEZ,FERNANDO DIAZ CONTRERAS
235,6,2,PT,0,MARIA DE LOS ANGELES MAGAÑA FERNANDEZ,MARUSDALETH DEL ROSARIO MURGUIA PALOMERA
236,6,2,MOVIMIENTO CIUDADANO,0,FRANCISCO CUEVAS MARTIN,CUAUHTEMOC CALLEROS TENORIO
237,6,2,MORENA,1,ROSA MARIA BAYARDO CABRERA,MARIA DEL CARMEN ZUÑIGA CUEVAS
238,6,2,PES,0,MARCOS SANTANA MONTES,JOSE DANIEL MORENO NAVARRO
239,6,2,RSP,0,DAYNA VERONICA MARTINEZ VALDEZ,SANDRA LUZ ROMERO MONTERO
240,6,2,FS X MEXICO,0,SONIA LOPEZ VERDE,ANDREA MONTES CORONA
241,7,1,PAN,0,MAURICIO FERNANDO LASTRA ESCUDERO,LUCAS SANTIAGO PEREZ PEREZ
242,7,1,PRI,0,MAURICIO FERNANDO LASTRA ESCUDERO,LUCAS SANTIAGO PEREZ PEREZ
243,7,1,PRD,0,MAURICIO FERNANDO LASTRA ESCUDERO,LUCAS SANTIAGO PEREZ PEREZ
244,7,1,PVEM,1,MANUELA DEL CARMEN OBRADOR NARVAEZ,MICAELA PEÑATE MONTEJO
245,7,1,PT,1,MANUELA DEL CARMEN OBRADOR NARVAEZ,MICAELA PEÑATE MONTEJO
246,7,1,MOVIMIENTO CIUDADANO,0,ADA MARGARITA LASTRA MACOSAY,KARLA CECILIA HERNANDEZ CASTELLANOS
247,7,1,MORENA,1,MANUELA DEL CARMEN OBRADOR NARVAEZ,MICAELA PEÑATE MONTEJO
248,7,1,PES,0,PATRICIA VAZQUEZ CASTELLANO,JOVITA GUZMAN PEREZ
249,7,1,RSP,0,RUBEN MADARIAGA RIVERA,ELOISA ELIZABET ZAVALETA LOPEZ
250,7,1,FS X MEXICO,0,EVANGELINA LOPEZ VERA,MORELIA IRENE VAZQUEZ MARTINEZ
251,7,2,PAN,0,ROBERTO AQUILES AGUILAR HERNANDEZ,IRIS ADRIANA AGUILAR PAVON
252,7,2,PRI,0,ROBERTO AQUILES AGUILAR HERNANDEZ,IRIS ADRIANA AGUILAR PAVON
253,7,2,PRD,0,ROBERTO AQUILES AGUILAR HERNANDEZ,IRIS ADRIANA AGUILAR PAVON
254,7,2,PVEM,1,ADELA RAMOS JUAREZ,MICAELA PEREZ GONZALEZ
255,7,2,PT,1,ADELA RAMOS JUAREZ,MICAELA PEREZ GONZALEZ
256,7,2,MOVIMIENTO CIUDADANO,0,BEATRIZ ADRIANA PEREZ ENCINO,MARIA LUCIA DE LA CRUZ JIMENEZ
257,7,2,MORENA,1,ADELA RAMOS JUAREZ,MICAELA PEREZ GONZALEZ
258,7,2,PES,0,FABIOLA ISABEL SANCHEZ GOMEZ,ANA OLIVIA MARTINEZ ALVAREZ
259,7,2,RSP,0,MARBELLA DEL CARMEN VAZQUEZ GOMEZ,CARLA ROSARIA GOMEZ VAZQUEZ
260,7,2,FS X MEXICO,0,MOIRY JUDITH DOMINGUEZ ESPINOSA,JENNIFER ALEJANDRA RESENDEZ HERNANDEZ
265,7,3,PAN,0,REYNA MAYTE MARIN OVANDO,ARACELI AGUILAR GOMEZ
266,7,3,PRI,0,REYNA MAYTE MARIN OVANDO,ARACELI AGUILAR GOMEZ
267,7,3,PRD,0,REYNA MAYTE MARIN OVANDO,ARACELI AGUILAR GOMEZ
268,7,3,PVEM,0,MANUELA ANGELICA MENDEZ CRUZ,GUADALUPE SANCHEZ CULEBRO
269,7,3,PT,0,SEBASTIANA GOMEZ MORENO,AMPARO GOMEZ LOPEZ
270,7,3,MOVIMIENTO CIUDADANO,0,ELIEZER RODRIGUEZ HERNANDEZ,ZOILA ROSA PEREZ JIMENEZ
271,7,3,MORENA,1,ALFREDO VAZQUEZ VAZQUEZ,ALFREDO TORRES HERNANDEZ
272,7,3,PES,0,MARIO ZENTENO GUERRERO,RICARDO COZAR CUNDAPI
273,7,3,RSP,0,MARIA VIRGINIA MENDEZ GOMEZ,MARIA ESTHER MUÑOZ PANIAGUA
274,7,3,FS X MEXICO,0,YOLANDA GOMEZ SANTIZ,YURI IRACEMA PINTO GONZALEZ
275,7,4,PAN,0,MILDRED CAROLINA CALVO CHACON,DORALI PACECITA CRUZ GUICHARD
276,7,4,PRI,0,MILDRED CAROLINA CALVO CHACON,DORALI PACECITA CRUZ GUICHARD
277,7,4,PRD,0,MILDRED CAROLINA CALVO CHACON,DORALI PACECITA CRUZ GUICHARD
278,7,4,PVEM,0,DULCE MARIA RODRIGUEZ OVANDO,MONSERRAT LINARES DOMINGUEZ
279,7,4,PT,0,CESAR CARBALLO SANGEADO,HECTOR MAZA REYEZ
280,7,4,MOVIMIENTO CIUDADANO,0,TERESITA DE JESUS ROQUE LOPEZ,KARLA ESTEFANIA LOPEZ AGUILAR
281,7,4,MORENA,1,JOAQUIN ZEBADUA ALVA,NORMA EDITH GUTIERREZ SANCHEZ
282,7,4,PES,0,MARTHA CARBALLO SANGEADO,ARGELIA GRAJALES GONZALEZ
283,7,4,RSP,0,JANE DE GUADALUPE DE LA CRUZ PALACIOS,GUADALUPE SOLIS RAMOS
284,7,4,FS X MEXICO,0,YESENIA ALAMILLA VICENTE,KARLA PATRICIA DE VELASCO RODRIGUEZ
285,7,5,PAN,1,YEIMI YAZMIN AGUILAR CIFUENTES,ELENA PEREZ RAMOS
286,7,5,PRI,1,YEIMI YAZMIN AGUILAR CIFUENTES,ELENA PEREZ RAMOS
287,7,5,PRD,1,YEIMI YAZMIN AGUILAR CIFUENTES,ELENA PEREZ RAMOS
288,7,5,PVEM,0,CLEMENTINA MARTA DEKKER GOMEZ,CATALINA HERNANDEZ GIRON
289,7,5,PT,0,CLEMENTINA MARTA DEKKER GOMEZ,CATALINA HERNANDEZ GIRON
290,7,5,MOVIMIENTO CIUDADANO,0,FLOR DE MARIA GONZALEZ PEREZ,EVA RUTH SANTIZ DIAZ
291,7,5,MORENA,0,CLEMENTINA MARTA DEKKER GOMEZ,CATALINA HERNANDEZ GIRON
292,7,5,PES,0,MANUEL COLLAZO GOMEZ,ANA LAURA AGUILAR MARTINEZ
293,7,5,RSP,0,MARIO DE JESUS GOMEZ DOMINGUEZ,GILBERTO HERNANDEZ PEREZ
294,7,5,FS X MEXICO,0,ALFONSO ALEJANDRO HERNANDEZ AGUILAR,LUIS ANTONIO SANTIAGO MARTINEZ
295,7,6,PAN,0,CARLOS MOLANO ROBLES,VICTOR HUGO MENDOZA AGUILAR
296,7,6,PRI,0,CARLOS MOLANO ROBLES,VICTOR HUGO MENDOZA AGUILAR
297,7,6,PRD,0,CARLOS MOLANO ROBLES,VICTOR HUGO MENDOZA AGUILAR
298,7,6,PVEM,1,JORGE LUIS LLAVEN ABARCA,ROGER CELERINO NANGUYASMU VICENTE
299,7,6,PT,1,JORGE LUIS LLAVEN ABARCA,ROGER CELERINO NANGUYASMU VICENTE
300,7,6,MOVIMIENTO CIUDADANO,0,ADRIANA MANUELA ROBLES FELIX,DANIELA ADRIANA LOPEZ MAZARIEGOS
301,7,6,MORENA,1,JORGE LUIS LLAVEN ABARCA,ROGER CELERINO NANGUYASMU VICENTE
302,7,6,PES,0,VANESSA TRACONIS QUEVEDO,BARBARA VANESSA CASTILLO ALFARO
303,7,6,RSP,0,YARA MANZUR CONSTANTINO,LIZZETTE CUELLAR TREJO
304,7,6,FS X MEXICO,0,JORGE ARTURO SANCHEZ FLORES,ULISES MASIEL AGUILAR JIMENEZ
305,7,7,PAN,0,KENIA PALACIOS OVANDO,JENNDY MARIELA GIRON DE LEON
306,7,7,PRI,0,KENIA PALACIOS OVANDO,JENNDY MARIELA GIRON DE LEON
307,7,7,PRD,0,KENIA PALACIOS OVANDO,JENNDY MARIELA GIRON DE LEON
308,7,7,PVEM,1,MANUEL DE JESUS NARCIA COUTIÑO,JOSE JUAN TRINIDAD BALBOA
309,7,7,PT,1,MANUEL DE JESUS NARCIA COUTIÑO,JOSE JUAN TRINIDAD BALBOA
310,7,7,MOVIMIENTO CIUDADANO,0,JESSICA HANNIA VAZQUEZ LABRADOR,YASMILETH TOLEDO DE LOS SANTOS
311,7,7,MORENA,1,MANUEL DE JESUS NARCIA COUTIÑO,JOSE JUAN TRINIDAD BALBOA
312,7,7,PES,0,SILVIA TORREBLANCA ALFARO,CONCEPCION CUETO LOPEZ
313,7,7,RSP,0,VERONICA ARCEO SOLIS,ANA PATRICIA DEL CARMEN PEREZ ZUÑIGA
314,7,7,FS X MEXICO,0,ANA ELSY ARREOLA MOGUEL,MARY CARMEN ULLOA HERNANDEZ
315,7,8,PAN,0,MARIO CARLOS CULEBRO VELASCO,CORAZON GOMEZ CONSUEGRA
316,7,8,PRI,0,MARIO CARLOS CULEBRO VELASCO,CORAZON GOMEZ CONSUEGRA
317,7,8,PRD,0,MARIO CARLOS CULEBRO VELASCO,CORAZON GOMEZ CONSUEGRA
318,7,8,PVEM,1,ISMAEL BRITO MAZARIEGOS,ABRAHAM GUTIERREZ CALDERON
319,7,8,PT,1,ISMAEL BRITO MAZARIEGOS,ABRAHAM GUTIERREZ CALDERON
320,7,8,MOVIMIENTO CIUDADANO,0,RAUL FIGUEROA GOMEZ,WALTER FERNANDO GUILLEN GUILLEN
321,7,8,MORENA,1,ISMAEL BRITO MAZARIEGOS,ABRAHAM GUTIERREZ CALDERON
322,7,8,PES,0,CINTHYA VIANNEY REYES SUMUANO,KARINA BERENICE ARREOLA LOPEZ
323,7,8,RSP,0,NURY DEL IVANE JIMENEZ PEREZ,KARLA NOEMI GUTIERREZ BARRON
324,7,8,FS X MEXICO,0,SIN CANDIDATURA,SIN CANDIDATURA
325,7,9,PAN,0,EMILIO ENRIQUE SALAZAR FARIAS,CESAREO HERNANDEZ SANTOS
326,7,9,PRI,0,EMILIO ENRIQUE SALAZAR FARIAS,CESAREO HERNANDEZ SANTOS
327,7,9,PRD,0,EMILIO ENRIQUE SALAZAR FARIAS,CESAREO HERNANDEZ SANTOS
328,7,9,PVEM,1,ADRIANA BUSTAMANTE CASTELLANOS,CYNTHIA JAMILETH CORZO SARMIENTO
329,7,9,PT,1,ADRIANA BUSTAMANTE CASTELLANOS,CYNTHIA JAMILETH CORZO SARMIENTO
330,7,9,MOVIMIENTO CIUDADANO,0,JUAN CARLOS CAL Y MAYOR FRANCO,ENOCH ARAUJO ZAVALETA
331,7,9,MORENA,1,ADRIANA BUSTAMANTE CASTELLANOS,CYNTHIA JAMILETH CORZO SARMIENTO
332,7,9,PES,0,LETICIA ARLETT AGUILAR MOLINA,LAURA ORDOÑEZ GIRON
333,7,9,RSP,0,SERAFIN CULEBRO GONZALEZ,SADOT CHONGO RUIZ
334,7,9,FS X MEXICO,0,VICENTE VAZQUEZ GONZALEZ,PAHULO ARTURO VILLAGRAN ORTIZ
335,7,10,PAN,0,JULIAN NAZAR MORALES,JORDAN SEBASTIAN MONTERO VIDAL
336,7,10,PRI,0,JULIAN NAZAR MORALES,JORDAN SEBASTIAN MONTERO VIDAL
337,7,10,PRD,0,JULIAN NAZAR MORALES,JORDAN SEBASTIAN MONTERO VIDAL
338,7,10,PVEM,1,JUAN PABLO MONTES DE OCA AVENDAÑO,MARIA DEL CARMEN FERNANDEZ BENAVENTE
339,7,10,PT,1,JUAN PABLO MONTES DE OCA AVENDAÑO,MARIA DEL CARMEN FERNANDEZ BENAVENTE
340,7,10,MOVIMIENTO CIUDADANO,0,ARIANA GUADALUPE SURIANO MARTINEZ,MARIA DE JESUS LOPEZ ESPINOSA
341,7,10,MORENA,1,JUAN PABLO MONTES DE OCA AVENDAÑO,MARIA DEL CARMEN FERNANDEZ BENAVENTE
342,7,10,PES,0,MARTIN CORZO ROJAS,PASCUAL RODRIGUEZ AREVALO
343,7,10,RSP,0,JULIO CESAR MORENO MENDES,FRANCISCO DANIEL VILLATORO GUTIERREZ
344,7,10,FS X MEXICO,0,SIN CANDIDATURA,SIN CANDIDATURA
345,7,11,PAN,0,CRISTINA MORALES SANCHEZ,IMELDA SANTIZ SANTIZ
346,7,11,PRI,0,CRISTINA MORALES SANCHEZ,IMELDA SANTIZ SANTIZ
347,7,11,PRD,0,CRISTINA MORALES SANCHEZ,IMELDA SANTIZ SANTIZ
348,7,11,PVEM,1,ROBERTO ANTONIO RUBIO MONTEJO,ROGELIO RAYO MARTINEZ
349,7,11,PT,1,ROBERTO ANTONIO RUBIO MONTEJO,ROGELIO RAYO MARTINEZ
350,7,11,MOVIMIENTO CIUDADANO,0,MARIO ALEJANDRO SUAREZ CULEBRO,RICARDO HERNANDEZ CASTILLO
351,7,11,MORENA,1,ROBERTO ANTONIO RUBIO MONTEJO,ROGELIO RAYO MARTINEZ
352,7,11,PES,0,MARISOL DELGADILLO VAZQUEZ,GLADIS GEORGINA NAJERA AGUILAR
353,7,11,RSP,0,RENE SEBASTIAN CULEBRO GORDILLO,FLORIBERTHA GOMEZ MORALES
354,7,11,FS X MEXICO,0,HILDA MARICELA JIMENEZ LOPEZ,JULIA EDELMIRA MORENO VILLATORO
355,7,12,PAN,0,CLEMENTE MIGUEL LOPEZ ZEPEDA,CARLOS REYES CAJAS
356,7,12,PRI,0,CLEMENTE MIGUEL LOPEZ ZEPEDA,CARLOS REYES CAJAS
357,7,12,PRD,0,CLEMENTE MIGUEL LOPEZ ZEPEDA,CARLOS REYES CAJAS
358,7,12,PVEM,0,JOSE ANTONIO DE JESUS TORIELLO ELORZA,JUAN CARLOS ORELLANA GARCIA
359,7,12,PT,0,ALFREDO CRUZ OVANDO,MAURICIO RAMIREZ DIAZ
360,7,12,MOVIMIENTO CIUDADANO,0,PRISCILA BORGES GONZALEZ,DIANA GABRIELA MORENO ALVAREZ
361,7,12,MORENA,1,JOSE LUIS ELORZA FLORES,LIMBERGH ULISES GUILLEN MONTOYA
362,7,12,PES,0,JOSE ANTONIO CONSTANTINO CORZO,FERNANDO LOPEZ PEREZ
363,7,12,RSP,0,CINTHYA ELENA ALVARADO ENRIQUEZ,GLENDY SULEMA CHIGUICHON VAZQUEZ
364,7,12,FS X MEXICO,0,SIN CANDIDATURA,SIN CANDIDATURA
365,7,13,PAN,0,MARITOÑA CALDERON MERIDA,CAROLINA VELAZQUEZ MERIDA
366,7,13,PRI,0,MARITOÑA CALDERON MERIDA,CAROLINA VELAZQUEZ MERIDA
367,7,13,PRD,0,MARITOÑA CALDERON MERIDA,CAROLINA VELAZQUEZ MERIDA
368,7,13,PVEM,1,LUIS ARMANDO MELGAR BRAVO,JULIO CESAR PEREZ MUÑOZ
